nohup: ignoring input
/bin/bash: /opt/conda/lib/libtinfo.so.6: no version information available (required by /bin/bash)
==========================================
XGB CTGAN10000 파일 실행 시작
시작 시간: 2025-12-28 04:31:17
GPU: 0번 (CUDA_VISIBLE_DEVICES=0)
==========================================

----------------------------------------
실행 중: xgb_ctgan10000/XGB_ctgan10000_busan.py
시작 시간: 2025-12-28 04:31:17
----------------------------------------
데이터 로딩 중...
데이터 전처리 중...
하이퍼파라미터 최적화 시작...
  0%|          | 0/100 [00:00<?, ?trial/s, best loss=?]  1%|          | 1/100 [01:00<1:39:06, 60.06s/trial, best loss: -0.4522]  2%|▏         | 2/100 [01:27<1:06:28, 40.70s/trial, best loss: -0.4709]  3%|▎         | 3/100 [02:00<1:00:22, 37.35s/trial, best loss: -0.4806]  4%|▍         | 4/100 [02:36<58:57, 36.85s/trial, best loss: -0.4806]    5%|▌         | 5/100 [02:59<50:07, 31.66s/trial, best loss: -0.4822]  6%|▌         | 6/100 [03:46<57:59, 37.02s/trial, best loss: -0.4822]  7%|▋         | 7/100 [04:12<51:49, 33.43s/trial, best loss: -0.4822]  8%|▊         | 8/100 [04:40<48:45, 31.80s/trial, best loss: -0.4822]  9%|▉         | 9/100 [05:37<1:00:09, 39.66s/trial, best loss: -0.4822] 10%|█         | 10/100 [06:13<57:38, 38.43s/trial, best loss: -0.4822]  11%|█         | 11/100 [06:34<49:07, 33.12s/trial, best loss: -0.4822] 12%|█▏        | 12/100 [07:20<54:22, 37.07s/trial, best loss: -0.4822] 13%|█▎        | 13/100 [08:01<55:35, 38.34s/trial, best loss: -0.4822] 14%|█▍        | 14/100 [08:34<52:25, 36.57s/trial, best loss: -0.4822] 15%|█▌        | 15/100 [09:03<48:30, 34.24s/trial, best loss: -0.4822] 16%|█▌        | 16/100 [09:29<44:45, 31.97s/trial, best loss: -0.4822] 17%|█▋        | 17/100 [10:29<55:53, 40.40s/trial, best loss: -0.4822] 18%|█▊        | 18/100 [10:46<45:13, 33.10s/trial, best loss: -0.4822] 19%|█▉        | 19/100 [11:11<41:26, 30.70s/trial, best loss: -0.4822] 20%|██        | 20/100 [11:37<39:10, 29.38s/trial, best loss: -0.4822] 21%|██        | 21/100 [12:17<42:42, 32.43s/trial, best loss: -0.4822] 22%|██▏       | 22/100 [13:23<55:18, 42.55s/trial, best loss: -0.4822] 23%|██▎       | 23/100 [13:58<51:48, 40.37s/trial, best loss: -0.4822] 24%|██▍       | 24/100 [14:29<47:44, 37.69s/trial, best loss: -0.4822] 25%|██▌       | 25/100 [16:19<1:14:11, 59.35s/trial, best loss: -0.4822] 26%|██▌       | 26/100 [16:57<1:05:04, 52.76s/trial, best loss: -0.4822] 27%|██▋       | 27/100 [17:39<1:00:28, 49.70s/trial, best loss: -0.4822] 28%|██▊       | 28/100 [18:11<53:04, 44.23s/trial, best loss: -0.4822]   29%|██▉       | 29/100 [18:34<44:58, 38.01s/trial, best loss: -0.4822] 30%|███       | 30/100 [19:28<49:57, 42.82s/trial, best loss: -0.4822] 31%|███       | 31/100 [20:07<47:46, 41.54s/trial, best loss: -0.4822] 32%|███▏      | 32/100 [20:43<45:24, 40.07s/trial, best loss: -0.4822] 33%|███▎      | 33/100 [21:19<43:07, 38.62s/trial, best loss: -0.4822] 34%|███▍      | 34/100 [21:48<39:24, 35.83s/trial, best loss: -0.4822] 35%|███▌      | 35/100 [22:31<41:08, 37.98s/trial, best loss: -0.4822] 36%|███▌      | 36/100 [23:04<39:03, 36.62s/trial, best loss: -0.4822] 37%|███▋      | 37/100 [23:23<32:46, 31.22s/trial, best loss: -0.4822] 38%|███▊      | 38/100 [24:18<39:43, 38.44s/trial, best loss: -0.4822] 39%|███▉      | 39/100 [24:56<38:44, 38.10s/trial, best loss: -0.4822] 40%|████      | 40/100 [25:22<34:34, 34.57s/trial, best loss: -0.4822] 41%|████      | 41/100 [26:22<41:38, 42.35s/trial, best loss: -0.4822] 42%|████▏     | 42/100 [26:55<38:01, 39.34s/trial, best loss: -0.4822] 43%|████▎     | 43/100 [27:18<32:39, 34.38s/trial, best loss: -0.4822] 44%|████▍     | 44/100 [27:47<30:33, 32.74s/trial, best loss: -0.4822] 45%|████▌     | 45/100 [28:19<29:49, 32.54s/trial, best loss: -0.4822] 46%|████▌     | 46/100 [28:45<27:34, 30.64s/trial, best loss: -0.4822] 47%|████▋     | 47/100 [29:14<26:38, 30.15s/trial, best loss: -0.4822] 48%|████▊     | 48/100 [29:46<26:33, 30.65s/trial, best loss: -0.4822] 49%|████▉     | 49/100 [30:25<28:21, 33.36s/trial, best loss: -0.4822] 50%|█████     | 50/100 [31:31<35:53, 43.06s/trial, best loss: -0.4822] 51%|█████     | 51/100 [31:58<31:21, 38.40s/trial, best loss: -0.4822] 52%|█████▏    | 52/100 [32:28<28:27, 35.58s/trial, best loss: -0.4822] 53%|█████▎    | 53/100 [33:11<29:43, 37.96s/trial, best loss: -0.4822] 54%|█████▍    | 54/100 [33:55<30:23, 39.63s/trial, best loss: -0.4822] 55%|█████▌    | 55/100 [34:24<27:21, 36.48s/trial, best loss: -0.4822] 56%|█████▌    | 56/100 [34:51<24:49, 33.84s/trial, best loss: -0.4822] 57%|█████▋    | 57/100 [35:28<24:50, 34.66s/trial, best loss: -0.4822] 58%|█████▊    | 58/100 [36:06<25:02, 35.78s/trial, best loss: -0.4822] 59%|█████▉    | 59/100 [36:42<24:24, 35.72s/trial, best loss: -0.4822] 60%|██████    | 60/100 [37:06<21:31, 32.29s/trial, best loss: -0.4822] 61%|██████    | 61/100 [37:32<19:40, 30.28s/trial, best loss: -0.4822] 62%|██████▏   | 62/100 [38:46<27:34, 43.54s/trial, best loss: -0.4822] 63%|██████▎   | 63/100 [39:13<23:43, 38.47s/trial, best loss: -0.4822] 64%|██████▍   | 64/100 [39:56<23:52, 39.79s/trial, best loss: -0.4822] 65%|██████▌   | 65/100 [40:47<25:10, 43.16s/trial, best loss: -0.4822] 66%|██████▌   | 66/100 [41:09<20:56, 36.97s/trial, best loss: -0.4822] 67%|██████▋   | 67/100 [41:44<19:56, 36.27s/trial, best loss: -0.4822] 68%|██████▊   | 68/100 [42:13<18:06, 33.96s/trial, best loss: -0.4822] 69%|██████▉   | 69/100 [42:38<16:17, 31.53s/trial, best loss: -0.4822] 70%|███████   | 70/100 [43:17<16:46, 33.55s/trial, best loss: -0.4822] 71%|███████   | 71/100 [44:05<18:23, 38.06s/trial, best loss: -0.4822] 72%|███████▏  | 72/100 [44:36<16:42, 35.80s/trial, best loss: -0.4822] 73%|███████▎  | 73/100 [44:57<14:11, 31.55s/trial, best loss: -0.4822] 74%|███████▍  | 74/100 [45:29<13:43, 31.66s/trial, best loss: -0.4822] 75%|███████▌  | 75/100 [45:50<11:52, 28.50s/trial, best loss: -0.4822] 76%|███████▌  | 76/100 [46:19<11:22, 28.43s/trial, best loss: -0.4822] 77%|███████▋  | 77/100 [46:44<10:32, 27.51s/trial, best loss: -0.4822] 78%|███████▊  | 78/100 [47:10<09:56, 27.11s/trial, best loss: -0.4822] 79%|███████▉  | 79/100 [47:56<11:27, 32.75s/trial, best loss: -0.4822] 80%|████████  | 80/100 [48:24<10:24, 31.23s/trial, best loss: -0.4822] 81%|████████  | 81/100 [48:43<08:45, 27.68s/trial, best loss: -0.4822] 82%|████████▏ | 82/100 [49:12<08:25, 28.09s/trial, best loss: -0.4822] 83%|████████▎ | 83/100 [49:39<07:49, 27.62s/trial, best loss: -0.4822] 84%|████████▍ | 84/100 [50:07<07:24, 27.78s/trial, best loss: -0.4822] 85%|████████▌ | 85/100 [50:55<08:25, 33.72s/trial, best loss: -0.4822] 86%|████████▌ | 86/100 [51:11<06:38, 28.47s/trial, best loss: -0.4845] 87%|████████▋ | 87/100 [51:30<05:33, 25.68s/trial, best loss: -0.4845] 88%|████████▊ | 88/100 [52:03<05:34, 27.85s/trial, best loss: -0.4845] 89%|████████▉ | 89/100 [52:36<05:23, 29.37s/trial, best loss: -0.4845] 90%|█████████ | 90/100 [53:00<04:38, 27.88s/trial, best loss: -0.4845] 91%|█████████ | 91/100 [53:23<03:56, 26.31s/trial, best loss: -0.4845] 92%|█████████▏| 92/100 [54:16<04:34, 34.36s/trial, best loss: -0.4845] 93%|█████████▎| 93/100 [54:44<03:47, 32.57s/trial, best loss: -0.4845] 94%|█████████▍| 94/100 [55:04<02:52, 28.71s/trial, best loss: -0.4845] 95%|█████████▌| 95/100 [55:47<02:45, 33.04s/trial, best loss: -0.4845] 96%|█████████▌| 96/100 [56:11<02:01, 30.30s/trial, best loss: -0.4845] 97%|█████████▋| 97/100 [56:42<01:31, 30.51s/trial, best loss: -0.4845] 98%|█████████▊| 98/100 [57:01<00:53, 26.91s/trial, best loss: -0.4845] 99%|█████████▉| 99/100 [57:30<00:27, 27.60s/trial, best loss: -0.4881]100%|██████████| 100/100 [57:48<00:00, 24.90s/trial, best loss: -0.4881]100%|██████████| 100/100 [57:48<00:00, 34.69s/trial, best loss: -0.4881]

최적화 완료. 최적 파라미터: {'colsample_bytree': 0.6875780545091519, 'gamma': 2.658982028747467, 'learning_rate': 0.11595019019771602, 'max_depth': 12.0, 'min_child_weight': 18.0, 'reg_alpha': 0.9071038284958559, 'reg_lambda': 0.2880553949579837, 'subsample': 0.7100915343806586}
최적 CSI 점수: 0.4881 (loss: -0.4881)

최적화 과정 요약:
  - 총 시도 횟수: 100
  - 성공한 시도: 100
  - 최초 CSI: 0.4522
  - 최종 CSI: 0.4780
  - 최고 CSI: 0.4881
  - 최저 CSI: 0.4459
  - 평균 CSI: 0.4737

최적화 Trials 객체가 /workspace/visibility_prediction/Analysis_code/optimization_history/xgb_ctgan10000_busan_trials.pkl에 저장되었습니다.
최종 모델 학습 시작...
Fold 1 학습 중... (학습 연도: [2018, 2019], 검증 연도: 2020)
Fold 1 검증 CSI: 0.4329
Fold 2 학습 중... (학습 연도: [2018, 2020], 검증 연도: 2019)
Fold 2 검증 CSI: 0.5007
Fold 3 학습 중... (학습 연도: [2019, 2020], 검증 연도: 2018)
Fold 3 검증 CSI: 0.5306
모델 저장 중...
모델이 /workspace/visibility_prediction/Analysis_code/save_model/xgb_optima/xgb_ctgan10000_busan.pkl에 저장되었습니다.

✓ 완료: xgb_ctgan10000/XGB_ctgan10000_busan.py (소요 시간: 3501초)

----------------------------------------
실행 중: xgb_ctgan10000/XGB_ctgan10000_daegu.py
시작 시간: 2025-12-28 05:29:38
----------------------------------------
데이터 로딩 중...
데이터 전처리 중...
하이퍼파라미터 최적화 시작...
  0%|          | 0/100 [00:00<?, ?trial/s, best loss=?]  1%|          | 1/100 [00:44<1:13:09, 44.34s/trial, best loss: -0.4037]  2%|▏         | 2/100 [01:13<58:05, 35.57s/trial, best loss: -0.4037]    3%|▎         | 3/100 [01:31<44:34, 27.57s/trial, best loss: -0.4037]  4%|▍         | 4/100 [02:03<46:37, 29.14s/trial, best loss: -0.427]   5%|▌         | 5/100 [02:28<43:56, 27.75s/trial, best loss: -0.427]  6%|▌         | 6/100 [03:09<50:15, 32.08s/trial, best loss: -0.427]  7%|▋         | 7/100 [03:47<52:46, 34.05s/trial, best loss: -0.427]  8%|▊         | 8/100 [04:35<59:09, 38.58s/trial, best loss: -0.427]  9%|▉         | 9/100 [05:06<55:05, 36.32s/trial, best loss: -0.427] 10%|█         | 10/100 [05:26<46:43, 31.15s/trial, best loss: -0.427] 11%|█         | 11/100 [05:59<47:10, 31.80s/trial, best loss: -0.427] 12%|█▏        | 12/100 [06:38<49:41, 33.88s/trial, best loss: -0.427] 13%|█▎        | 13/100 [07:14<49:58, 34.47s/trial, best loss: -0.427] 14%|█▍        | 14/100 [07:46<48:22, 33.75s/trial, best loss: -0.427] 15%|█▌        | 15/100 [08:53<1:02:15, 43.95s/trial, best loss: -0.427] 16%|█▌        | 16/100 [09:27<57:04, 40.77s/trial, best loss: -0.427]   17%|█▋        | 17/100 [09:54<50:35, 36.57s/trial, best loss: -0.427] 18%|█▊        | 18/100 [10:31<50:22, 36.86s/trial, best loss: -0.427] 19%|█▉        | 19/100 [11:01<46:58, 34.80s/trial, best loss: -0.427] 20%|██        | 20/100 [11:33<45:04, 33.81s/trial, best loss: -0.4356] 21%|██        | 21/100 [11:58<41:05, 31.21s/trial, best loss: -0.4356] 22%|██▏       | 22/100 [12:28<40:14, 30.96s/trial, best loss: -0.4356] 23%|██▎       | 23/100 [12:59<39:36, 30.86s/trial, best loss: -0.4356] 24%|██▍       | 24/100 [13:22<36:20, 28.69s/trial, best loss: -0.4356] 25%|██▌       | 25/100 [13:43<32:45, 26.20s/trial, best loss: -0.4356] 26%|██▌       | 26/100 [14:31<40:32, 32.87s/trial, best loss: -0.4356] 27%|██▋       | 27/100 [15:03<39:37, 32.57s/trial, best loss: -0.4356] 28%|██▊       | 28/100 [15:44<42:03, 35.05s/trial, best loss: -0.4356] 29%|██▉       | 29/100 [16:06<36:44, 31.04s/trial, best loss: -0.4356] 30%|███       | 30/100 [16:31<34:04, 29.21s/trial, best loss: -0.4356] 31%|███       | 31/100 [17:21<40:48, 35.48s/trial, best loss: -0.4356] 32%|███▏      | 32/100 [17:53<38:59, 34.40s/trial, best loss: -0.4356] 33%|███▎      | 33/100 [18:25<37:36, 33.68s/trial, best loss: -0.4356] 34%|███▍      | 34/100 [19:02<38:21, 34.87s/trial, best loss: -0.4356] 35%|███▌      | 35/100 [19:46<40:41, 37.56s/trial, best loss: -0.4356] 36%|███▌      | 36/100 [20:19<38:39, 36.24s/trial, best loss: -0.4356] 37%|███▋      | 37/100 [20:58<38:45, 36.92s/trial, best loss: -0.4356] 38%|███▊      | 38/100 [21:35<38:17, 37.06s/trial, best loss: -0.4356] 39%|███▉      | 39/100 [22:13<37:55, 37.30s/trial, best loss: -0.4356] 40%|████      | 40/100 [22:50<37:13, 37.22s/trial, best loss: -0.4356] 41%|████      | 41/100 [23:24<35:32, 36.15s/trial, best loss: -0.4356] 42%|████▏     | 42/100 [24:04<36:02, 37.29s/trial, best loss: -0.4356] 43%|████▎     | 43/100 [24:49<37:45, 39.75s/trial, best loss: -0.4356] 44%|████▍     | 44/100 [25:16<33:24, 35.80s/trial, best loss: -0.4356] 45%|████▌     | 45/100 [26:10<37:56, 41.39s/trial, best loss: -0.4356] 46%|████▌     | 46/100 [26:50<36:48, 40.90s/trial, best loss: -0.4356] 47%|████▋     | 47/100 [27:14<31:46, 35.97s/trial, best loss: -0.4356] 48%|████▊     | 48/100 [27:47<30:19, 35.00s/trial, best loss: -0.4356] 49%|████▉     | 49/100 [28:32<32:12, 37.89s/trial, best loss: -0.4356] 50%|█████     | 50/100 [29:28<36:14, 43.50s/trial, best loss: -0.4356] 51%|█████     | 51/100 [30:21<37:40, 46.14s/trial, best loss: -0.4356] 52%|█████▏    | 52/100 [31:09<37:22, 46.71s/trial, best loss: -0.4356] 53%|█████▎    | 53/100 [32:18<41:53, 53.48s/trial, best loss: -0.4356] 54%|█████▍    | 54/100 [32:59<38:09, 49.77s/trial, best loss: -0.4356] 55%|█████▌    | 55/100 [33:27<32:22, 43.16s/trial, best loss: -0.4356] 56%|█████▌    | 56/100 [33:57<28:47, 39.26s/trial, best loss: -0.4356] 57%|█████▋    | 57/100 [34:23<25:14, 35.22s/trial, best loss: -0.4356] 58%|█████▊    | 58/100 [34:48<22:39, 32.38s/trial, best loss: -0.4356] 59%|█████▉    | 59/100 [35:24<22:48, 33.38s/trial, best loss: -0.4356] 60%|██████    | 60/100 [36:06<23:54, 35.87s/trial, best loss: -0.4356] 61%|██████    | 61/100 [36:30<20:57, 32.23s/trial, best loss: -0.4356] 62%|██████▏   | 62/100 [37:49<29:19, 46.31s/trial, best loss: -0.4356] 63%|██████▎   | 63/100 [38:30<27:42, 44.93s/trial, best loss: -0.4356] 64%|██████▍   | 64/100 [39:13<26:27, 44.09s/trial, best loss: -0.4356] 65%|██████▌   | 65/100 [40:08<27:38, 47.39s/trial, best loss: -0.4356] 66%|██████▌   | 66/100 [40:29<22:22, 39.48s/trial, best loss: -0.4356] 67%|██████▋   | 67/100 [40:47<18:14, 33.17s/trial, best loss: -0.4356] 68%|██████▊   | 68/100 [41:12<16:25, 30.80s/trial, best loss: -0.4356] 69%|██████▉   | 69/100 [41:34<14:30, 28.09s/trial, best loss: -0.4356] 70%|███████   | 70/100 [41:55<12:53, 25.80s/trial, best loss: -0.4356] 71%|███████   | 71/100 [42:33<14:15, 29.51s/trial, best loss: -0.4356] 72%|███████▏  | 72/100 [43:08<14:35, 31.26s/trial, best loss: -0.4356] 73%|███████▎  | 73/100 [43:38<13:51, 30.79s/trial, best loss: -0.4356] 74%|███████▍  | 74/100 [44:06<12:57, 29.92s/trial, best loss: -0.4356] 75%|███████▌  | 75/100 [44:40<13:04, 31.37s/trial, best loss: -0.4356] 76%|███████▌  | 76/100 [45:08<12:05, 30.22s/trial, best loss: -0.4356] 77%|███████▋  | 77/100 [45:38<11:33, 30.17s/trial, best loss: -0.4392] 78%|███████▊  | 78/100 [46:12<11:27, 31.26s/trial, best loss: -0.4392] 79%|███████▉  | 79/100 [46:52<11:55, 34.05s/trial, best loss: -0.4392] 80%|████████  | 80/100 [47:46<13:18, 39.93s/trial, best loss: -0.4392] 81%|████████  | 81/100 [48:28<12:49, 40.49s/trial, best loss: -0.4392] 82%|████████▏ | 82/100 [49:20<13:11, 43.98s/trial, best loss: -0.4392] 83%|████████▎ | 83/100 [49:44<10:44, 37.90s/trial, best loss: -0.4392] 84%|████████▍ | 84/100 [50:14<09:32, 35.78s/trial, best loss: -0.4392] 85%|████████▌ | 85/100 [50:59<09:38, 38.55s/trial, best loss: -0.4392] 86%|████████▌ | 86/100 [51:33<08:39, 37.09s/trial, best loss: -0.4392] 87%|████████▋ | 87/100 [51:53<06:53, 31.80s/trial, best loss: -0.4392] 88%|████████▊ | 88/100 [52:14<05:45, 28.78s/trial, best loss: -0.4392] 89%|████████▉ | 89/100 [52:47<05:28, 29.87s/trial, best loss: -0.4392] 90%|█████████ | 90/100 [53:16<04:56, 29.61s/trial, best loss: -0.4392] 91%|█████████ | 91/100 [53:43<04:21, 29.03s/trial, best loss: -0.4392] 92%|█████████▏| 92/100 [54:14<03:54, 29.37s/trial, best loss: -0.4392] 93%|█████████▎| 93/100 [54:35<03:08, 26.99s/trial, best loss: -0.4392] 94%|█████████▍| 94/100 [54:59<02:36, 26.00s/trial, best loss: -0.4392] 95%|█████████▌| 95/100 [55:37<02:28, 29.75s/trial, best loss: -0.4392] 96%|█████████▌| 96/100 [55:55<01:45, 26.28s/trial, best loss: -0.4392] 97%|█████████▋| 97/100 [56:31<01:27, 29.00s/trial, best loss: -0.4392] 98%|█████████▊| 98/100 [56:54<00:54, 27.17s/trial, best loss: -0.4392] 99%|█████████▉| 99/100 [57:34<00:31, 31.01s/trial, best loss: -0.4392]100%|██████████| 100/100 [58:02<00:00, 30.26s/trial, best loss: -0.4392]100%|██████████| 100/100 [58:02<00:00, 34.83s/trial, best loss: -0.4392]

최적화 완료. 최적 파라미터: {'colsample_bytree': 0.8557253370653987, 'gamma': 1.1563957561197729, 'learning_rate': 0.19232018363683898, 'max_depth': 10.0, 'min_child_weight': 8.0, 'reg_alpha': 0.21149066093980878, 'reg_lambda': 0.2690618200166374, 'subsample': 0.714526167464626}
최적 CSI 점수: 0.4392 (loss: -0.4392)

최적화 과정 요약:
  - 총 시도 횟수: 100
  - 성공한 시도: 100
  - 최초 CSI: 0.4037
  - 최종 CSI: 0.4027
  - 최고 CSI: 0.4392
  - 최저 CSI: 0.3123
  - 평균 CSI: 0.4163

최적화 Trials 객체가 /workspace/visibility_prediction/Analysis_code/optimization_history/xgb_ctgan10000_daegu_trials.pkl에 저장되었습니다.
최종 모델 학습 시작...
Fold 1 학습 중... (학습 연도: [2018, 2019], 검증 연도: 2020)
Fold 1 검증 CSI: 0.4690
Fold 2 학습 중... (학습 연도: [2018, 2020], 검증 연도: 2019)
Fold 2 검증 CSI: 0.4544
Fold 3 학습 중... (학습 연도: [2019, 2020], 검증 연도: 2018)
Fold 3 검증 CSI: 0.3943
모델 저장 중...
모델이 /workspace/visibility_prediction/Analysis_code/save_model/xgb_optima/xgb_ctgan10000_daegu.pkl에 저장되었습니다.

✓ 완료: xgb_ctgan10000/XGB_ctgan10000_daegu.py (소요 시간: 3515초)

----------------------------------------
실행 중: xgb_ctgan10000/XGB_ctgan10000_daejeon.py
시작 시간: 2025-12-28 06:28:13
----------------------------------------
데이터 로딩 중...
데이터 전처리 중...
하이퍼파라미터 최적화 시작...
  0%|          | 0/100 [00:00<?, ?trial/s, best loss=?]  1%|          | 1/100 [00:37<1:02:28, 37.86s/trial, best loss: -0.4839]  2%|▏         | 2/100 [01:13<59:40, 36.53s/trial, best loss: -0.4839]    3%|▎         | 3/100 [01:51<1:00:22, 37.34s/trial, best loss: -0.4865]  4%|▍         | 4/100 [02:59<1:19:11, 49.49s/trial, best loss: -0.4865]  5%|▌         | 5/100 [04:05<1:27:35, 55.32s/trial, best loss: -0.4953]  6%|▌         | 6/100 [04:39<1:15:30, 48.19s/trial, best loss: -0.4953]  7%|▋         | 7/100 [05:08<1:04:51, 41.84s/trial, best loss: -0.4953]  8%|▊         | 8/100 [05:51<1:04:45, 42.23s/trial, best loss: -0.4953]  9%|▉         | 9/100 [06:43<1:08:41, 45.30s/trial, best loss: -0.4953] 10%|█         | 10/100 [07:11<1:00:00, 40.00s/trial, best loss: -0.4953] 11%|█         | 11/100 [07:50<58:33, 39.47s/trial, best loss: -0.4953]   12%|█▏        | 12/100 [08:40<1:02:40, 42.74s/trial, best loss: -0.502] 13%|█▎        | 13/100 [09:11<56:49, 39.19s/trial, best loss: -0.502]   14%|█▍        | 14/100 [10:06<1:03:07, 44.04s/trial, best loss: -0.502] 15%|█▌        | 15/100 [10:59<1:06:00, 46.60s/trial, best loss: -0.502] 16%|█▌        | 16/100 [11:49<1:06:55, 47.80s/trial, best loss: -0.502] 17%|█▋        | 17/100 [13:07<1:18:45, 56.93s/trial, best loss: -0.502] 18%|█▊        | 18/100 [13:24<1:01:13, 44.79s/trial, best loss: -0.502] 19%|█▉        | 19/100 [13:55<54:42, 40.53s/trial, best loss: -0.502]   20%|██        | 20/100 [14:36<54:26, 40.83s/trial, best loss: -0.502] 21%|██        | 21/100 [15:25<57:02, 43.32s/trial, best loss: -0.502] 22%|██▏       | 22/100 [15:51<49:20, 37.95s/trial, best loss: -0.502] 23%|██▎       | 23/100 [16:26<47:50, 37.28s/trial, best loss: -0.502] 24%|██▍       | 24/100 [16:53<43:12, 34.11s/trial, best loss: -0.502] 25%|██▌       | 25/100 [17:17<38:47, 31.04s/trial, best loss: -0.502] 26%|██▌       | 26/100 [17:53<39:57, 32.41s/trial, best loss: -0.502] 27%|██▋       | 27/100 [18:24<39:06, 32.14s/trial, best loss: -0.502] 28%|██▊       | 28/100 [19:03<40:56, 34.12s/trial, best loss: -0.502] 29%|██▉       | 29/100 [19:45<43:05, 36.42s/trial, best loss: -0.5029] 30%|███       | 30/100 [20:21<42:37, 36.54s/trial, best loss: -0.5029] 31%|███       | 31/100 [20:55<40:57, 35.62s/trial, best loss: -0.5029] 32%|███▏      | 32/100 [21:32<40:42, 35.92s/trial, best loss: -0.5029] 33%|███▎      | 33/100 [22:06<39:42, 35.55s/trial, best loss: -0.5029] 34%|███▍      | 34/100 [22:48<41:01, 37.30s/trial, best loss: -0.5029] 35%|███▌      | 35/100 [23:25<40:19, 37.23s/trial, best loss: -0.5029] 36%|███▌      | 36/100 [24:00<38:58, 36.54s/trial, best loss: -0.5029] 37%|███▋      | 37/100 [24:24<34:28, 32.83s/trial, best loss: -0.5029] 38%|███▊      | 38/100 [24:57<34:06, 33.01s/trial, best loss: -0.5029] 39%|███▉      | 39/100 [25:44<37:50, 37.22s/trial, best loss: -0.5029] 40%|████      | 40/100 [26:30<39:40, 39.68s/trial, best loss: -0.5029] 41%|████      | 41/100 [27:20<42:07, 42.84s/trial, best loss: -0.5029] 42%|████▏     | 42/100 [27:51<38:06, 39.41s/trial, best loss: -0.5029] 43%|████▎     | 43/100 [28:15<33:02, 34.79s/trial, best loss: -0.5029] 44%|████▍     | 44/100 [29:30<43:38, 46.75s/trial, best loss: -0.5029] 45%|████▌     | 45/100 [30:15<42:20, 46.19s/trial, best loss: -0.5029] 46%|████▌     | 46/100 [30:53<39:26, 43.82s/trial, best loss: -0.5029] 47%|████▋     | 47/100 [31:15<32:57, 37.32s/trial, best loss: -0.5029] 48%|████▊     | 48/100 [31:43<29:44, 34.32s/trial, best loss: -0.5029] 49%|████▉     | 49/100 [32:11<27:32, 32.40s/trial, best loss: -0.5029] 50%|█████     | 50/100 [32:38<25:52, 31.05s/trial, best loss: -0.5029] 51%|█████     | 51/100 [33:21<28:12, 34.55s/trial, best loss: -0.5029] 52%|█████▏    | 52/100 [33:56<27:48, 34.77s/trial, best loss: -0.5029] 53%|█████▎    | 53/100 [34:35<28:10, 35.98s/trial, best loss: -0.5029] 54%|█████▍    | 54/100 [35:06<26:20, 34.36s/trial, best loss: -0.5029] 55%|█████▌    | 55/100 [35:38<25:22, 33.84s/trial, best loss: -0.5029] 56%|█████▌    | 56/100 [36:30<28:49, 39.30s/trial, best loss: -0.5029] 57%|█████▋    | 57/100 [37:21<30:29, 42.55s/trial, best loss: -0.5029] 58%|█████▊    | 58/100 [38:01<29:24, 42.00s/trial, best loss: -0.5029] 59%|█████▉    | 59/100 [38:39<27:43, 40.57s/trial, best loss: -0.5029] 60%|██████    | 60/100 [39:17<26:36, 39.92s/trial, best loss: -0.5029] 61%|██████    | 61/100 [40:33<33:02, 50.83s/trial, best loss: -0.5029] 62%|██████▏   | 62/100 [41:01<27:54, 44.05s/trial, best loss: -0.5029] 63%|██████▎   | 63/100 [41:30<24:15, 39.33s/trial, best loss: -0.5029] 64%|██████▍   | 64/100 [42:06<22:58, 38.29s/trial, best loss: -0.5029] 65%|██████▌   | 65/100 [42:37<21:10, 36.30s/trial, best loss: -0.5029] 66%|██████▌   | 66/100 [43:07<19:29, 34.39s/trial, best loss: -0.5029] 67%|██████▋   | 67/100 [43:41<18:52, 34.31s/trial, best loss: -0.5029] 68%|██████▊   | 68/100 [44:11<17:29, 32.80s/trial, best loss: -0.5029] 69%|██████▉   | 69/100 [44:39<16:10, 31.32s/trial, best loss: -0.5029] 70%|███████   | 70/100 [45:18<16:51, 33.72s/trial, best loss: -0.5029] 71%|███████   | 71/100 [46:03<17:59, 37.22s/trial, best loss: -0.5029] 72%|███████▏  | 72/100 [46:37<16:54, 36.22s/trial, best loss: -0.5029] 73%|███████▎  | 73/100 [47:05<15:07, 33.61s/trial, best loss: -0.5029] 74%|███████▍  | 74/100 [47:28<13:13, 30.51s/trial, best loss: -0.5029] 75%|███████▌  | 75/100 [48:09<14:03, 33.75s/trial, best loss: -0.5029] 76%|███████▌  | 76/100 [48:34<12:28, 31.19s/trial, best loss: -0.5029] 77%|███████▋  | 77/100 [49:12<12:40, 33.05s/trial, best loss: -0.5029] 78%|███████▊  | 78/100 [49:46<12:17, 33.50s/trial, best loss: -0.5029] 79%|███████▉  | 79/100 [50:25<12:18, 35.15s/trial, best loss: -0.5029] 80%|████████  | 80/100 [51:02<11:49, 35.46s/trial, best loss: -0.5029] 81%|████████  | 81/100 [52:07<14:07, 44.61s/trial, best loss: -0.5029] 82%|████████▏ | 82/100 [52:39<12:13, 40.76s/trial, best loss: -0.5029] 83%|████████▎ | 83/100 [53:41<13:21, 47.14s/trial, best loss: -0.5029] 84%|████████▍ | 84/100 [54:31<12:47, 47.94s/trial, best loss: -0.5029] 85%|████████▌ | 85/100 [54:54<10:06, 40.42s/trial, best loss: -0.5029] 86%|████████▌ | 86/100 [55:25<08:46, 37.60s/trial, best loss: -0.5029] 87%|████████▋ | 87/100 [55:54<07:35, 35.01s/trial, best loss: -0.5029] 88%|████████▊ | 88/100 [56:45<07:56, 39.74s/trial, best loss: -0.5029] 89%|████████▉ | 89/100 [57:25<07:18, 39.87s/trial, best loss: -0.5029] 90%|█████████ | 90/100 [58:02<06:31, 39.12s/trial, best loss: -0.5029] 91%|█████████ | 91/100 [58:38<05:42, 38.08s/trial, best loss: -0.5029] 92%|█████████▏| 92/100 [59:05<04:39, 34.90s/trial, best loss: -0.5029] 93%|█████████▎| 93/100 [1:00:12<05:10, 44.39s/trial, best loss: -0.5029] 94%|█████████▍| 94/100 [1:00:53<04:19, 43.29s/trial, best loss: -0.5029] 95%|█████████▌| 95/100 [1:01:48<03:54, 46.95s/trial, best loss: -0.5029] 96%|█████████▌| 96/100 [1:02:42<03:16, 49.08s/trial, best loss: -0.5029] 97%|█████████▋| 97/100 [1:03:52<02:46, 55.36s/trial, best loss: -0.5029] 98%|█████████▊| 98/100 [1:04:30<01:39, 49.96s/trial, best loss: -0.5029] 99%|█████████▉| 99/100 [1:05:12<00:47, 47.59s/trial, best loss: -0.5029]100%|██████████| 100/100 [1:05:56<00:00, 46.50s/trial, best loss: -0.5029]100%|██████████| 100/100 [1:05:56<00:00, 39.56s/trial, best loss: -0.5029]

최적화 완료. 최적 파라미터: {'colsample_bytree': 0.7816067762051363, 'gamma': 0.5799629095615334, 'learning_rate': 0.06287412401679013, 'max_depth': 3.0, 'min_child_weight': 5.0, 'reg_alpha': 0.36731169488772253, 'reg_lambda': 0.03192020366519255, 'subsample': 0.6004605601176048}
최적 CSI 점수: 0.5029 (loss: -0.5029)

최적화 과정 요약:
  - 총 시도 횟수: 100
  - 성공한 시도: 100
  - 최초 CSI: 0.4839
  - 최종 CSI: 0.4873
  - 최고 CSI: 0.5029
  - 최저 CSI: 0.4796
  - 평균 CSI: 0.4918

최적화 Trials 객체가 /workspace/visibility_prediction/Analysis_code/optimization_history/xgb_ctgan10000_daejeon_trials.pkl에 저장되었습니다.
최종 모델 학습 시작...
Fold 1 학습 중... (학습 연도: [2018, 2019], 검증 연도: 2020)
Fold 1 검증 CSI: 0.4534
Fold 2 학습 중... (학습 연도: [2018, 2020], 검증 연도: 2019)
Fold 2 검증 CSI: 0.4712
Fold 3 학습 중... (학습 연도: [2019, 2020], 검증 연도: 2018)
Fold 3 검증 CSI: 0.5842
모델 저장 중...
모델이 /workspace/visibility_prediction/Analysis_code/save_model/xgb_optima/xgb_ctgan10000_daejeon.pkl에 저장되었습니다.

✓ 완료: xgb_ctgan10000/XGB_ctgan10000_daejeon.py (소요 시간: 3996초)

----------------------------------------
실행 중: xgb_ctgan10000/XGB_ctgan10000_gwangju.py
시작 시간: 2025-12-28 07:34:49
----------------------------------------
데이터 로딩 중...
데이터 전처리 중...
하이퍼파라미터 최적화 시작...
  0%|          | 0/100 [00:00<?, ?trial/s, best loss=?]  1%|          | 1/100 [00:25<41:41, 25.27s/trial, best loss: -0.4941]  2%|▏         | 2/100 [01:28<1:17:46, 47.61s/trial, best loss: -0.4941]  3%|▎         | 3/100 [02:09<1:11:52, 44.46s/trial, best loss: -0.4941]  4%|▍         | 4/100 [03:21<1:28:25, 55.27s/trial, best loss: -0.4941]  5%|▌         | 5/100 [04:15<1:26:54, 54.89s/trial, best loss: -0.4941]  6%|▌         | 6/100 [04:47<1:14:05, 47.29s/trial, best loss: -0.4941]  7%|▋         | 7/100 [05:30<1:11:03, 45.85s/trial, best loss: -0.4941]  8%|▊         | 8/100 [06:17<1:10:33, 46.01s/trial, best loss: -0.4941]  9%|▉         | 9/100 [06:38<58:16, 38.42s/trial, best loss: -0.4941]   10%|█         | 10/100 [07:21<59:33, 39.70s/trial, best loss: -0.4941] 11%|█         | 11/100 [08:11<1:03:31, 42.82s/trial, best loss: -0.4941] 12%|█▏        | 12/100 [08:40<56:37, 38.61s/trial, best loss: -0.4941]   13%|█▎        | 13/100 [09:29<1:00:31, 41.74s/trial, best loss: -0.4941] 14%|█▍        | 14/100 [09:52<51:46, 36.12s/trial, best loss: -0.4941]   15%|█▌        | 15/100 [10:31<52:22, 36.96s/trial, best loss: -0.4941] 16%|█▌        | 16/100 [11:05<50:37, 36.16s/trial, best loss: -0.4941] 17%|█▋        | 17/100 [12:46<1:16:56, 55.62s/trial, best loss: -0.4941] 18%|█▊        | 18/100 [13:14<1:04:51, 47.46s/trial, best loss: -0.4941] 19%|█▉        | 19/100 [13:50<59:23, 44.00s/trial, best loss: -0.4941]   20%|██        | 20/100 [14:43<1:02:07, 46.59s/trial, best loss: -0.4941] 21%|██        | 21/100 [15:08<52:40, 40.00s/trial, best loss: -0.4941]   22%|██▏       | 22/100 [15:46<51:25, 39.56s/trial, best loss: -0.4941] 23%|██▎       | 23/100 [16:16<47:05, 36.70s/trial, best loss: -0.4975] 24%|██▍       | 24/100 [16:56<47:48, 37.75s/trial, best loss: -0.4975] 25%|██▌       | 25/100 [17:26<44:15, 35.41s/trial, best loss: -0.4975] 26%|██▌       | 26/100 [17:53<40:27, 32.81s/trial, best loss: -0.4975] 27%|██▋       | 27/100 [18:16<36:21, 29.89s/trial, best loss: -0.4975] 28%|██▊       | 28/100 [18:58<40:12, 33.50s/trial, best loss: -0.4975] 29%|██▉       | 29/100 [19:58<48:53, 41.32s/trial, best loss: -0.4975] 30%|███       | 30/100 [20:29<44:54, 38.49s/trial, best loss: -0.4975] 31%|███       | 31/100 [21:09<44:27, 38.66s/trial, best loss: -0.4975] 32%|███▏      | 32/100 [21:48<44:08, 38.94s/trial, best loss: -0.4991] 33%|███▎      | 33/100 [22:18<40:26, 36.21s/trial, best loss: -0.4991] 34%|███▍      | 34/100 [22:47<37:32, 34.13s/trial, best loss: -0.4991] 35%|███▌      | 35/100 [23:14<34:32, 31.88s/trial, best loss: -0.4991] 36%|███▌      | 36/100 [23:39<31:40, 29.70s/trial, best loss: -0.4991] 37%|███▋      | 37/100 [24:20<34:47, 33.13s/trial, best loss: -0.4991] 38%|███▊      | 38/100 [24:54<34:35, 33.47s/trial, best loss: -0.4991] 39%|███▉      | 39/100 [25:26<33:35, 33.05s/trial, best loss: -0.4991] 40%|████      | 40/100 [26:03<34:11, 34.19s/trial, best loss: -0.4991] 41%|████      | 41/100 [26:45<35:55, 36.54s/trial, best loss: -0.4991] 42%|████▏     | 42/100 [27:12<32:38, 33.76s/trial, best loss: -0.4991] 43%|████▎     | 43/100 [28:18<41:16, 43.45s/trial, best loss: -0.4991] 44%|████▍     | 44/100 [28:46<36:11, 38.77s/trial, best loss: -0.4991] 45%|████▌     | 45/100 [29:38<39:08, 42.71s/trial, best loss: -0.4991] 46%|████▌     | 46/100 [30:24<39:16, 43.64s/trial, best loss: -0.4991] 47%|████▋     | 47/100 [30:48<33:24, 37.83s/trial, best loss: -0.4991] 48%|████▊     | 48/100 [31:18<30:43, 35.45s/trial, best loss: -0.4991] 49%|████▉     | 49/100 [32:28<38:51, 45.71s/trial, best loss: -0.4991] 50%|█████     | 50/100 [32:56<33:50, 40.60s/trial, best loss: -0.4991] 51%|█████     | 51/100 [33:45<35:11, 43.09s/trial, best loss: -0.4991] 52%|█████▏    | 52/100 [34:45<38:28, 48.10s/trial, best loss: -0.4991] 53%|█████▎    | 53/100 [35:06<31:25, 40.11s/trial, best loss: -0.4991] 54%|█████▍    | 54/100 [35:50<31:31, 41.13s/trial, best loss: -0.4991] 55%|█████▌    | 55/100 [36:31<30:51, 41.15s/trial, best loss: -0.4991] 56%|█████▌    | 56/100 [36:51<25:32, 34.83s/trial, best loss: -0.4991] 57%|█████▋    | 57/100 [37:30<25:48, 36.00s/trial, best loss: -0.4991] 58%|█████▊    | 58/100 [38:18<27:43, 39.60s/trial, best loss: -0.4991] 59%|█████▉    | 59/100 [38:42<23:51, 34.91s/trial, best loss: -0.4991] 60%|██████    | 60/100 [39:10<21:51, 32.80s/trial, best loss: -0.4991] 61%|██████    | 61/100 [40:10<26:39, 41.02s/trial, best loss: -0.4991] 62%|██████▏   | 62/100 [40:54<26:28, 41.80s/trial, best loss: -0.4991] 63%|██████▎   | 63/100 [41:14<21:46, 35.32s/trial, best loss: -0.4991] 64%|██████▍   | 64/100 [41:41<19:48, 33.02s/trial, best loss: -0.4991] 65%|██████▌   | 65/100 [42:14<19:07, 32.80s/trial, best loss: -0.4991] 66%|██████▌   | 66/100 [42:50<19:10, 33.83s/trial, best loss: -0.4991] 67%|██████▋   | 67/100 [43:20<18:03, 32.84s/trial, best loss: -0.4991] 68%|██████▊   | 68/100 [43:49<16:47, 31.49s/trial, best loss: -0.4991] 69%|██████▉   | 69/100 [44:17<15:43, 30.42s/trial, best loss: -0.4991] 70%|███████   | 70/100 [44:43<14:36, 29.21s/trial, best loss: -0.4991] 71%|███████   | 71/100 [45:10<13:43, 28.40s/trial, best loss: -0.4991] 72%|███████▏  | 72/100 [45:32<12:25, 26.64s/trial, best loss: -0.4991] 73%|███████▎  | 73/100 [46:05<12:50, 28.55s/trial, best loss: -0.4991] 74%|███████▍  | 74/100 [46:38<12:53, 29.74s/trial, best loss: -0.4991] 75%|███████▌  | 75/100 [47:08<12:28, 29.93s/trial, best loss: -0.4991] 76%|███████▌  | 76/100 [47:36<11:40, 29.19s/trial, best loss: -0.4999] 77%|███████▋  | 77/100 [47:58<10:25, 27.18s/trial, best loss: -0.4999] 78%|███████▊  | 78/100 [48:32<10:40, 29.13s/trial, best loss: -0.4999] 79%|███████▉  | 79/100 [48:55<09:34, 27.34s/trial, best loss: -0.4999] 80%|████████  | 80/100 [49:24<09:18, 27.92s/trial, best loss: -0.4999] 81%|████████  | 81/100 [49:43<07:58, 25.18s/trial, best loss: -0.4999] 82%|████████▏ | 82/100 [50:03<07:03, 23.55s/trial, best loss: -0.4999] 83%|████████▎ | 83/100 [50:25<06:35, 23.24s/trial, best loss: -0.4999] 84%|████████▍ | 84/100 [50:55<06:41, 25.11s/trial, best loss: -0.4999] 85%|████████▌ | 85/100 [51:15<05:57, 23.82s/trial, best loss: -0.4999] 86%|████████▌ | 86/100 [52:06<07:24, 31.75s/trial, best loss: -0.4999] 87%|████████▋ | 87/100 [52:29<06:20, 29.29s/trial, best loss: -0.4999] 88%|████████▊ | 88/100 [52:56<05:42, 28.56s/trial, best loss: -0.4999] 89%|████████▉ | 89/100 [53:27<05:23, 29.39s/trial, best loss: -0.4999] 90%|█████████ | 90/100 [53:55<04:47, 28.75s/trial, best loss: -0.4999] 91%|█████████ | 91/100 [54:28<04:30, 30.04s/trial, best loss: -0.4999] 92%|█████████▏| 92/100 [55:22<04:58, 37.30s/trial, best loss: -0.4999] 93%|█████████▎| 93/100 [56:11<04:45, 40.74s/trial, best loss: -0.4999] 94%|█████████▍| 94/100 [56:39<03:41, 36.98s/trial, best loss: -0.4999] 95%|█████████▌| 95/100 [57:03<02:44, 32.98s/trial, best loss: -0.4999] 96%|█████████▌| 96/100 [57:33<02:08, 32.24s/trial, best loss: -0.4999] 97%|█████████▋| 97/100 [57:51<01:23, 27.84s/trial, best loss: -0.4999] 98%|█████████▊| 98/100 [58:14<00:52, 26.39s/trial, best loss: -0.4999] 99%|█████████▉| 99/100 [58:35<00:24, 24.80s/trial, best loss: -0.4999]100%|██████████| 100/100 [59:02<00:00, 25.61s/trial, best loss: -0.4999]100%|██████████| 100/100 [59:02<00:00, 35.43s/trial, best loss: -0.4999]

최적화 완료. 최적 파라미터: {'colsample_bytree': 0.9825715751506052, 'gamma': 0.029399796024525915, 'learning_rate': 0.08575762330828458, 'max_depth': 11.0, 'min_child_weight': 8.0, 'reg_alpha': 0.8534545581720909, 'reg_lambda': 0.43478744549007325, 'subsample': 0.7629247503643918}
최적 CSI 점수: 0.4999 (loss: -0.4999)

최적화 과정 요약:
  - 총 시도 횟수: 100
  - 성공한 시도: 100
  - 최초 CSI: 0.4941
  - 최종 CSI: 0.4935
  - 최고 CSI: 0.4999
  - 최저 CSI: 0.4364
  - 평균 CSI: 0.4867

최적화 Trials 객체가 /workspace/visibility_prediction/Analysis_code/optimization_history/xgb_ctgan10000_gwangju_trials.pkl에 저장되었습니다.
최종 모델 학습 시작...
Fold 1 학습 중... (학습 연도: [2018, 2019], 검증 연도: 2020)
Fold 1 검증 CSI: 0.4102
Fold 2 학습 중... (학습 연도: [2018, 2020], 검증 연도: 2019)
Fold 2 검증 CSI: 0.5658
Fold 3 학습 중... (학습 연도: [2019, 2020], 검증 연도: 2018)
Fold 3 검증 CSI: 0.5239
모델 저장 중...
모델이 /workspace/visibility_prediction/Analysis_code/save_model/xgb_optima/xgb_ctgan10000_gwangju.pkl에 저장되었습니다.

✓ 완료: xgb_ctgan10000/XGB_ctgan10000_gwangju.py (소요 시간: 3571초)

----------------------------------------
실행 중: xgb_ctgan10000/XGB_ctgan10000_incheon.py
시작 시간: 2025-12-28 08:34:20
----------------------------------------
데이터 로딩 중...
데이터 전처리 중...
하이퍼파라미터 최적화 시작...
  0%|          | 0/100 [00:00<?, ?trial/s, best loss=?]  1%|          | 1/100 [00:20<34:14, 20.76s/trial, best loss: -0.5632]  2%|▏         | 2/100 [00:37<30:03, 18.41s/trial, best loss: -0.5632]  3%|▎         | 3/100 [01:03<35:30, 21.96s/trial, best loss: -0.5632]  4%|▍         | 4/100 [01:29<37:51, 23.66s/trial, best loss: -0.5632]  5%|▌         | 5/100 [01:52<36:56, 23.33s/trial, best loss: -0.5632]  6%|▌         | 6/100 [02:47<53:33, 34.18s/trial, best loss: -0.5632]  7%|▋         | 7/100 [03:23<53:40, 34.62s/trial, best loss: -0.5633]  8%|▊         | 8/100 [04:16<1:01:57, 40.41s/trial, best loss: -0.5633]  9%|▉         | 9/100 [04:34<50:47, 33.49s/trial, best loss: -0.5633]   10%|█         | 10/100 [05:16<54:10, 36.11s/trial, best loss: -0.5633] 11%|█         | 11/100 [05:43<49:17, 33.23s/trial, best loss: -0.5633] 12%|█▏        | 12/100 [06:37<57:55, 39.49s/trial, best loss: -0.5633] 13%|█▎        | 13/100 [07:17<57:38, 39.75s/trial, best loss: -0.5633] 14%|█▍        | 14/100 [07:53<55:28, 38.71s/trial, best loss: -0.5633] 15%|█▌        | 15/100 [08:29<53:39, 37.87s/trial, best loss: -0.5633] 16%|█▌        | 16/100 [08:55<47:53, 34.21s/trial, best loss: -0.5633] 17%|█▋        | 17/100 [09:19<42:58, 31.06s/trial, best loss: -0.5633] 18%|█▊        | 18/100 [10:25<56:45, 41.54s/trial, best loss: -0.5633] 19%|█▉        | 19/100 [10:47<48:32, 35.95s/trial, best loss: -0.5633] 20%|██        | 20/100 [11:12<43:15, 32.45s/trial, best loss: -0.5633] 21%|██        | 21/100 [11:35<39:02, 29.65s/trial, best loss: -0.5633] 22%|██▏       | 22/100 [11:55<34:38, 26.64s/trial, best loss: -0.5633] 23%|██▎       | 23/100 [12:16<32:13, 25.11s/trial, best loss: -0.5633] 24%|██▍       | 24/100 [12:47<33:55, 26.78s/trial, best loss: -0.5633] 25%|██▌       | 25/100 [13:49<46:58, 37.58s/trial, best loss: -0.5633] 26%|██▌       | 26/100 [14:16<42:20, 34.33s/trial, best loss: -0.5633] 27%|██▋       | 27/100 [14:45<39:33, 32.51s/trial, best loss: -0.5633] 28%|██▊       | 28/100 [15:10<36:39, 30.55s/trial, best loss: -0.5633] 29%|██▉       | 29/100 [15:42<36:29, 30.84s/trial, best loss: -0.5633] 30%|███       | 30/100 [16:04<32:59, 28.27s/trial, best loss: -0.5633] 31%|███       | 31/100 [16:38<34:23, 29.91s/trial, best loss: -0.5645] 32%|███▏      | 32/100 [17:22<38:46, 34.21s/trial, best loss: -0.5706] 33%|███▎      | 33/100 [18:15<44:24, 39.76s/trial, best loss: -0.5706] 34%|███▍      | 34/100 [19:01<45:49, 41.65s/trial, best loss: -0.5706] 35%|███▌      | 35/100 [19:35<42:44, 39.45s/trial, best loss: -0.5714] 36%|███▌      | 36/100 [20:19<43:18, 40.60s/trial, best loss: -0.5714] 37%|███▋      | 37/100 [20:54<40:58, 39.02s/trial, best loss: -0.5728] 38%|███▊      | 38/100 [21:20<36:23, 35.21s/trial, best loss: -0.5728] 39%|███▉      | 39/100 [22:31<46:32, 45.77s/trial, best loss: -0.5728] 40%|████      | 40/100 [23:00<40:50, 40.84s/trial, best loss: -0.5728] 41%|████      | 41/100 [23:50<42:55, 43.65s/trial, best loss: -0.5728] 42%|████▏     | 42/100 [24:25<39:33, 40.92s/trial, best loss: -0.5728] 43%|████▎     | 43/100 [25:12<40:33, 42.68s/trial, best loss: -0.5728] 44%|████▍     | 44/100 [25:44<36:53, 39.53s/trial, best loss: -0.5728] 45%|████▌     | 45/100 [26:27<37:07, 40.50s/trial, best loss: -0.5728] 46%|████▌     | 46/100 [26:55<33:11, 36.89s/trial, best loss: -0.5728] 47%|████▋     | 47/100 [27:29<31:48, 36.00s/trial, best loss: -0.5752] 48%|████▊     | 48/100 [28:12<32:56, 38.02s/trial, best loss: -0.5752] 49%|████▉     | 49/100 [29:03<35:42, 42.00s/trial, best loss: -0.5752] 50%|█████     | 50/100 [29:44<34:41, 41.64s/trial, best loss: -0.5752] 51%|█████     | 51/100 [30:31<35:24, 43.36s/trial, best loss: -0.5752] 52%|█████▏    | 52/100 [31:10<33:37, 42.03s/trial, best loss: -0.5752] 53%|█████▎    | 53/100 [32:15<38:25, 49.04s/trial, best loss: -0.5752] 54%|█████▍    | 54/100 [33:01<36:43, 47.91s/trial, best loss: -0.5752] 55%|█████▌    | 55/100 [33:49<36:06, 48.15s/trial, best loss: -0.5752] 56%|█████▌    | 56/100 [34:14<30:07, 41.07s/trial, best loss: -0.5752] 57%|█████▋    | 57/100 [35:00<30:34, 42.67s/trial, best loss: -0.5752] 58%|█████▊    | 58/100 [35:40<29:10, 41.68s/trial, best loss: -0.5752] 59%|█████▉    | 59/100 [36:03<24:48, 36.30s/trial, best loss: -0.5752] 60%|██████    | 60/100 [36:36<23:29, 35.23s/trial, best loss: -0.5752] 61%|██████    | 61/100 [37:05<21:41, 33.38s/trial, best loss: -0.5752] 62%|██████▏   | 62/100 [37:54<24:06, 38.07s/trial, best loss: -0.5752] 63%|██████▎   | 63/100 [38:44<25:39, 41.62s/trial, best loss: -0.5752] 64%|██████▍   | 64/100 [39:31<25:51, 43.10s/trial, best loss: -0.5752] 65%|██████▌   | 65/100 [40:19<26:01, 44.62s/trial, best loss: -0.5752] 66%|██████▌   | 66/100 [40:58<24:23, 43.04s/trial, best loss: -0.5752] 67%|██████▋   | 67/100 [41:51<25:12, 45.84s/trial, best loss: -0.5752] 68%|██████▊   | 68/100 [42:34<24:06, 45.19s/trial, best loss: -0.5752] 69%|██████▉   | 69/100 [43:11<22:05, 42.75s/trial, best loss: -0.5752] 70%|███████   | 70/100 [43:52<20:59, 41.99s/trial, best loss: -0.5752] 71%|███████   | 71/100 [44:35<20:27, 42.32s/trial, best loss: -0.5752] 72%|███████▏  | 72/100 [44:58<17:02, 36.50s/trial, best loss: -0.5752] 73%|███████▎  | 73/100 [45:17<14:03, 31.24s/trial, best loss: -0.5752] 74%|███████▍  | 74/100 [45:58<14:54, 34.42s/trial, best loss: -0.5752] 75%|███████▌  | 75/100 [46:29<13:49, 33.19s/trial, best loss: -0.5752] 76%|███████▌  | 76/100 [46:50<11:49, 29.56s/trial, best loss: -0.5752] 77%|███████▋  | 77/100 [47:37<13:24, 34.96s/trial, best loss: -0.5752] 78%|███████▊  | 78/100 [48:10<12:32, 34.23s/trial, best loss: -0.5752] 79%|███████▉  | 79/100 [48:29<10:21, 29.59s/trial, best loss: -0.5752] 80%|████████  | 80/100 [48:48<08:47, 26.39s/trial, best loss: -0.5752] 81%|████████  | 81/100 [49:21<09:03, 28.62s/trial, best loss: -0.5752] 82%|████████▏ | 82/100 [50:05<09:58, 33.23s/trial, best loss: -0.5752] 83%|████████▎ | 83/100 [50:31<08:45, 30.90s/trial, best loss: -0.5752] 84%|████████▍ | 84/100 [51:08<08:44, 32.80s/trial, best loss: -0.5752] 85%|████████▌ | 85/100 [51:39<08:03, 32.23s/trial, best loss: -0.5752] 86%|████████▌ | 86/100 [52:06<07:07, 30.56s/trial, best loss: -0.5752] 87%|████████▋ | 87/100 [52:34<06:26, 29.76s/trial, best loss: -0.5752] 88%|████████▊ | 88/100 [54:13<10:08, 50.68s/trial, best loss: -0.5752] 89%|████████▉ | 89/100 [54:46<08:17, 45.21s/trial, best loss: -0.5752] 90%|█████████ | 90/100 [55:12<06:34, 39.45s/trial, best loss: -0.5752] 91%|█████████ | 91/100 [55:50<05:53, 39.23s/trial, best loss: -0.5752] 92%|█████████▏| 92/100 [56:14<04:35, 34.50s/trial, best loss: -0.5752] 93%|█████████▎| 93/100 [56:38<03:40, 31.57s/trial, best loss: -0.5752] 94%|█████████▍| 94/100 [57:13<03:14, 32.49s/trial, best loss: -0.5752] 95%|█████████▌| 95/100 [57:49<02:47, 33.54s/trial, best loss: -0.5752] 96%|█████████▌| 96/100 [58:46<02:42, 40.69s/trial, best loss: -0.5752] 97%|█████████▋| 97/100 [59:20<01:55, 38.56s/trial, best loss: -0.5752] 98%|█████████▊| 98/100 [59:58<01:16, 38.38s/trial, best loss: -0.5752] 99%|█████████▉| 99/100 [1:00:25<00:35, 35.02s/trial, best loss: -0.5752]100%|██████████| 100/100 [1:00:50<00:00, 32.05s/trial, best loss: -0.5752]100%|██████████| 100/100 [1:00:50<00:00, 36.51s/trial, best loss: -0.5752]

최적화 완료. 최적 파라미터: {'colsample_bytree': 0.9876604099689714, 'gamma': 2.7259563165720655, 'learning_rate': 0.014353110732979967, 'max_depth': 5.0, 'min_child_weight': 8.0, 'reg_alpha': 0.43412935826888077, 'reg_lambda': 0.45790677460553664, 'subsample': 0.6390967315026312}
최적 CSI 점수: 0.5752 (loss: -0.5752)

최적화 과정 요약:
  - 총 시도 횟수: 100
  - 성공한 시도: 100
  - 최초 CSI: 0.5632
  - 최종 CSI: 0.5595
  - 최고 CSI: 0.5752
  - 최저 CSI: 0.5385
  - 평균 CSI: 0.5582

최적화 Trials 객체가 /workspace/visibility_prediction/Analysis_code/optimization_history/xgb_ctgan10000_incheon_trials.pkl에 저장되었습니다.
최종 모델 학습 시작...
Fold 1 학습 중... (학습 연도: [2018, 2019], 검증 연도: 2020)
Fold 1 검증 CSI: 0.5292
Fold 2 학습 중... (학습 연도: [2018, 2020], 검증 연도: 2019)
Fold 2 검증 CSI: 0.6124
Fold 3 학습 중... (학습 연도: [2019, 2020], 검증 연도: 2018)
Fold 3 검증 CSI: 0.5840
모델 저장 중...
모델이 /workspace/visibility_prediction/Analysis_code/save_model/xgb_optima/xgb_ctgan10000_incheon.pkl에 저장되었습니다.

✓ 완료: xgb_ctgan10000/XGB_ctgan10000_incheon.py (소요 시간: 3691초)

----------------------------------------
실행 중: xgb_ctgan10000/XGB_ctgan10000_seoul.py
시작 시간: 2025-12-28 09:35:51
----------------------------------------
데이터 로딩 중...
데이터 전처리 중...
하이퍼파라미터 최적화 시작...
  0%|          | 0/100 [00:00<?, ?trial/s, best loss=?]  1%|          | 1/100 [00:26<44:04, 26.71s/trial, best loss: -0.5553]  2%|▏         | 2/100 [01:25<1:14:19, 45.50s/trial, best loss: -0.5578]  3%|▎         | 3/100 [01:43<53:05, 32.84s/trial, best loss: -0.5642]    4%|▍         | 4/100 [02:23<57:11, 35.74s/trial, best loss: -0.5722]  5%|▌         | 5/100 [03:14<1:05:13, 41.19s/trial, best loss: -0.5722]  6%|▌         | 6/100 [03:53<1:03:36, 40.60s/trial, best loss: -0.5722]  7%|▋         | 7/100 [04:34<1:03:04, 40.69s/trial, best loss: -0.5722]  8%|▊         | 8/100 [05:56<1:22:33, 53.85s/trial, best loss: -0.5722]  9%|▉         | 9/100 [06:33<1:13:50, 48.69s/trial, best loss: -0.5722] 10%|█         | 10/100 [07:35<1:19:14, 52.83s/trial, best loss: -0.5722] 11%|█         | 11/100 [08:04<1:07:21, 45.41s/trial, best loss: -0.5722] 12%|█▏        | 12/100 [08:37<1:01:12, 41.74s/trial, best loss: -0.5722] 13%|█▎        | 13/100 [09:20<1:00:55, 42.02s/trial, best loss: -0.5722] 14%|█▍        | 14/100 [09:48<53:56, 37.64s/trial, best loss: -0.5722]   15%|█▌        | 15/100 [10:32<56:09, 39.64s/trial, best loss: -0.5722] 16%|█▌        | 16/100 [10:50<46:20, 33.10s/trial, best loss: -0.5722] 17%|█▋        | 17/100 [12:02<1:02:10, 44.95s/trial, best loss: -0.5722] 18%|█▊        | 18/100 [12:32<55:19, 40.49s/trial, best loss: -0.5733]   19%|█▉        | 19/100 [13:24<59:17, 43.91s/trial, best loss: -0.5733] 20%|██        | 20/100 [13:59<54:50, 41.13s/trial, best loss: -0.5733] 21%|██        | 21/100 [14:32<51:00, 38.74s/trial, best loss: -0.5746] 22%|██▏       | 22/100 [15:02<47:06, 36.24s/trial, best loss: -0.5746] 23%|██▎       | 23/100 [15:27<42:08, 32.83s/trial, best loss: -0.5746] 24%|██▍       | 24/100 [16:08<44:35, 35.20s/trial, best loss: -0.5755] 25%|██▌       | 25/100 [16:32<39:49, 31.86s/trial, best loss: -0.5755] 26%|██▌       | 26/100 [17:09<41:12, 33.42s/trial, best loss: -0.5755] 27%|██▋       | 27/100 [17:38<38:48, 31.90s/trial, best loss: -0.5755] 28%|██▊       | 28/100 [18:12<39:05, 32.58s/trial, best loss: -0.5755] 29%|██▉       | 29/100 [18:37<35:55, 30.36s/trial, best loss: -0.5755] 30%|███       | 30/100 [19:01<33:14, 28.50s/trial, best loss: -0.5755] 31%|███       | 31/100 [19:44<37:34, 32.68s/trial, best loss: -0.5755] 32%|███▏      | 32/100 [20:22<39:02, 34.45s/trial, best loss: -0.5756] 33%|███▎      | 33/100 [21:26<48:30, 43.44s/trial, best loss: -0.5756] 34%|███▍      | 34/100 [22:10<47:57, 43.60s/trial, best loss: -0.5756] 35%|███▌      | 35/100 [22:53<46:44, 43.14s/trial, best loss: -0.5765] 36%|███▌      | 36/100 [23:22<41:39, 39.06s/trial, best loss: -0.5765] 37%|███▋      | 37/100 [23:59<40:26, 38.52s/trial, best loss: -0.5765] 38%|███▊      | 38/100 [24:33<38:21, 37.12s/trial, best loss: -0.5765] 39%|███▉      | 39/100 [24:59<34:25, 33.87s/trial, best loss: -0.5765] 40%|████      | 40/100 [25:43<36:46, 36.77s/trial, best loss: -0.5765] 41%|████      | 41/100 [26:10<33:16, 33.83s/trial, best loss: -0.5765] 42%|████▏     | 42/100 [26:48<33:59, 35.16s/trial, best loss: -0.5795] 43%|████▎     | 43/100 [27:34<36:30, 38.44s/trial, best loss: -0.5795] 44%|████▍     | 44/100 [28:07<34:18, 36.75s/trial, best loss: -0.5795] 45%|████▌     | 45/100 [29:03<38:56, 42.49s/trial, best loss: -0.5795] 46%|████▌     | 46/100 [30:11<45:07, 50.14s/trial, best loss: -0.5795] 47%|████▋     | 47/100 [30:41<38:58, 44.12s/trial, best loss: -0.5795] 48%|████▊     | 48/100 [31:09<34:00, 39.25s/trial, best loss: -0.5795] 49%|████▉     | 49/100 [31:36<30:15, 35.60s/trial, best loss: -0.5795] 50%|█████     | 50/100 [32:00<26:38, 31.96s/trial, best loss: -0.5795] 51%|█████     | 51/100 [32:38<27:48, 34.04s/trial, best loss: -0.5795] 52%|█████▏    | 52/100 [33:11<26:53, 33.62s/trial, best loss: -0.5795] 53%|█████▎    | 53/100 [34:06<31:27, 40.15s/trial, best loss: -0.5795] 54%|█████▍    | 54/100 [34:35<28:05, 36.63s/trial, best loss: -0.5795] 55%|█████▌    | 55/100 [35:03<25:27, 33.96s/trial, best loss: -0.5795] 56%|█████▌    | 56/100 [35:32<23:48, 32.47s/trial, best loss: -0.5795] 57%|█████▋    | 57/100 [36:16<25:55, 36.18s/trial, best loss: -0.5795] 58%|█████▊    | 58/100 [36:39<22:28, 32.12s/trial, best loss: -0.5795] 59%|█████▉    | 59/100 [37:05<20:46, 30.41s/trial, best loss: -0.5795] 60%|██████    | 60/100 [37:46<22:14, 33.37s/trial, best loss: -0.5795] 61%|██████    | 61/100 [38:24<22:40, 34.89s/trial, best loss: -0.5795] 62%|██████▏   | 62/100 [39:05<23:12, 36.64s/trial, best loss: -0.5795] 63%|██████▎   | 63/100 [39:57<25:27, 41.29s/trial, best loss: -0.5795] 64%|██████▍   | 64/100 [40:19<21:21, 35.59s/trial, best loss: -0.5795] 65%|██████▌   | 65/100 [40:52<20:16, 34.76s/trial, best loss: -0.5795] 66%|██████▌   | 66/100 [41:14<17:26, 30.79s/trial, best loss: -0.5795] 67%|██████▋   | 67/100 [41:44<16:53, 30.70s/trial, best loss: -0.5795] 68%|██████▊   | 68/100 [42:07<15:10, 28.45s/trial, best loss: -0.5795] 69%|██████▉   | 69/100 [42:27<13:23, 25.92s/trial, best loss: -0.5795] 70%|███████   | 70/100 [42:55<13:15, 26.52s/trial, best loss: -0.5797] 71%|███████   | 71/100 [43:20<12:29, 25.85s/trial, best loss: -0.5824] 72%|███████▏  | 72/100 [43:50<12:40, 27.17s/trial, best loss: -0.5824] 73%|███████▎  | 73/100 [44:17<12:11, 27.08s/trial, best loss: -0.5824] 74%|███████▍  | 74/100 [44:38<10:59, 25.37s/trial, best loss: -0.5824] 75%|███████▌  | 75/100 [45:08<11:10, 26.80s/trial, best loss: -0.5824] 76%|███████▌  | 76/100 [45:54<12:56, 32.36s/trial, best loss: -0.5824] 77%|███████▋  | 77/100 [46:12<10:48, 28.20s/trial, best loss: -0.5824] 78%|███████▊  | 78/100 [46:36<09:51, 26.88s/trial, best loss: -0.5824] 79%|███████▉  | 79/100 [46:59<08:58, 25.63s/trial, best loss: -0.5824] 80%|████████  | 80/100 [47:29<09:04, 27.20s/trial, best loss: -0.5824] 81%|████████  | 81/100 [47:55<08:26, 26.67s/trial, best loss: -0.5824] 82%|████████▏ | 82/100 [48:35<09:13, 30.73s/trial, best loss: -0.5824] 83%|████████▎ | 83/100 [48:59<08:06, 28.60s/trial, best loss: -0.5824] 84%|████████▍ | 84/100 [49:26<07:29, 28.09s/trial, best loss: -0.5824] 85%|████████▌ | 85/100 [49:47<06:30, 26.06s/trial, best loss: -0.5824] 86%|████████▌ | 86/100 [50:44<08:15, 35.36s/trial, best loss: -0.5824] 87%|████████▋ | 87/100 [51:23<07:53, 36.46s/trial, best loss: -0.5824] 88%|████████▊ | 88/100 [51:46<06:28, 32.41s/trial, best loss: -0.5824] 89%|████████▉ | 89/100 [52:11<05:32, 30.19s/trial, best loss: -0.5824] 90%|█████████ | 90/100 [52:32<04:34, 27.47s/trial, best loss: -0.5824] 91%|█████████ | 91/100 [52:57<04:00, 26.68s/trial, best loss: -0.5824] 92%|█████████▏| 92/100 [53:34<03:57, 29.64s/trial, best loss: -0.5824] 93%|█████████▎| 93/100 [54:12<03:45, 32.28s/trial, best loss: -0.5824] 94%|█████████▍| 94/100 [54:43<03:11, 31.88s/trial, best loss: -0.5824] 95%|█████████▌| 95/100 [55:31<03:04, 36.86s/trial, best loss: -0.5824] 96%|█████████▌| 96/100 [55:57<02:14, 33.56s/trial, best loss: -0.5824] 97%|█████████▋| 97/100 [56:19<01:29, 29.99s/trial, best loss: -0.5824] 98%|█████████▊| 98/100 [56:47<00:59, 29.54s/trial, best loss: -0.5824] 99%|█████████▉| 99/100 [57:09<00:27, 27.11s/trial, best loss: -0.5824]100%|██████████| 100/100 [57:39<00:00, 28.09s/trial, best loss: -0.5824]100%|██████████| 100/100 [57:39<00:00, 34.60s/trial, best loss: -0.5824]

최적화 완료. 최적 파라미터: {'colsample_bytree': 0.8837225390968168, 'gamma': 0.1115044781500254, 'learning_rate': 0.10805110293567466, 'max_depth': 12.0, 'min_child_weight': 4.0, 'reg_alpha': 0.02183712172236562, 'reg_lambda': 0.6932207560084631, 'subsample': 0.6767341133785678}
최적 CSI 점수: 0.5824 (loss: -0.5824)

최적화 과정 요약:
  - 총 시도 횟수: 100
  - 성공한 시도: 100
  - 최초 CSI: 0.5553
  - 최종 CSI: 0.5700
  - 최고 CSI: 0.5824
  - 최저 CSI: 0.5435
  - 평균 CSI: 0.5687

최적화 Trials 객체가 /workspace/visibility_prediction/Analysis_code/optimization_history/xgb_ctgan10000_seoul_trials.pkl에 저장되었습니다.
최종 모델 학습 시작...
Fold 1 학습 중... (학습 연도: [2018, 2019], 검증 연도: 2020)
Fold 1 검증 CSI: 0.5165
Fold 2 학습 중... (학습 연도: [2018, 2020], 검증 연도: 2019)
Fold 2 검증 CSI: 0.6230
Fold 3 학습 중... (학습 연도: [2019, 2020], 검증 연도: 2018)
Fold 3 검증 CSI: 0.6077
모델 저장 중...
모델이 /workspace/visibility_prediction/Analysis_code/save_model/xgb_optima/xgb_ctgan10000_seoul.pkl에 저장되었습니다.

✓ 완료: xgb_ctgan10000/XGB_ctgan10000_seoul.py (소요 시간: 3488초)

==========================================
XGB CTGAN10000 파일 실행 완료
종료 시간: 2025-12-28 10:33:59
총 소요 시간: 6시간 2분 42초
성공: 6개
실패: 0개
==========================================
