nohup: ignoring input
/bin/bash: /opt/conda/lib/libtinfo.so.6: no version information available (required by /bin/bash)
==========================================
XGB SMOTE 파일 실행 시작
시작 시간: 2025-12-27 02:09:06
GPU: 0번 (os.environ['CUDA_VISIBLE_DEVICES'] = '0')
==========================================

----------------------------------------
실행 중: xgb_smote/XGB_smote_busan.py
시작 시간: 2025-12-27 02:09:06
----------------------------------------
데이터 로딩 중...
데이터 전처리 중...
하이퍼파라미터 최적화 시작...

  0%|          | 0/100 [00:00<?, ?trial/s, best loss=?]
  1%|          | 1/100 [00:26<43:57, 26.64s/trial, best loss: -0.4609]
  2%|▏         | 2/100 [01:09<59:16, 36.29s/trial, best loss: -0.4611]
  3%|▎         | 3/100 [02:23<1:26:36, 53.57s/trial, best loss: -0.4611]  4%|▍         | 4/100 [03:12<1:22:48, 51.76s/trial, best loss: -0.4655]  5%|▌         | 5/100 [04:02<1:20:57, 51.13s/trial, best loss: -0.4703]  6%|▌         | 6/100 [04:50<1:18:22, 50.03s/trial, best loss: -0.4703]  7%|▋         | 7/100 [06:11<1:33:15, 60.16s/trial, best loss: -0.4703]  8%|▊         | 8/100 [07:51<1:51:23, 72.65s/trial, best loss: -0.4703]  9%|▉         | 9/100 [08:23<1:30:55, 59.95s/trial, best loss: -0.4703] 10%|█         | 10/100 [08:57<1:18:15, 52.17s/trial, best loss: -0.4703] 11%|█         | 11/100 [09:35<1:10:58, 47.85s/trial, best loss: -0.4703] 12%|█▏        | 12/100 [10:49<1:21:47, 55.77s/trial, best loss: -0.4703] 13%|█▎        | 13/100 [11:28<1:13:23, 50.61s/trial, best loss: -0.4703] 14%|█▍        | 14/100 [12:38<1:20:55, 56.46s/trial, best loss: -0.4703] 15%|█▌        | 15/100 [13:40<1:22:25, 58.19s/trial, best loss: -0.4703] 16%|█▌        | 16/100 [14:41<1:22:37, 59.02s/trial, best loss: -0.4703] 17%|█▋        | 17/100 [15:19<1:12:48, 52.63s/trial, best loss: -0.4703] 18%|█▊        | 18/100 [16:21<1:15:40, 55.37s/trial, best loss: -0.4733] 19%|█▉        | 19/100 [17:44<1:26:07, 63.80s/trial, best loss: -0.4733] 20%|██        | 20/100 [18:18<1:13:10, 54.89s/trial, best loss: -0.4733] 21%|██        | 21/100 [18:57<1:05:46, 49.96s/trial, best loss: -0.4733] 22%|██▏       | 22/100 [19:34<1:00:03, 46.19s/trial, best loss: -0.4733] 23%|██▎       | 23/100 [20:39<1:06:30, 51.83s/trial, best loss: -0.4733] 24%|██▍       | 24/100 [21:09<57:19, 45.26s/trial, best loss: -0.4733]   25%|██▌       | 25/100 [22:53<1:18:38, 62.91s/trial, best loss: -0.4733] 26%|██▌       | 26/100 [23:43<1:12:41, 58.94s/trial, best loss: -0.4733] 27%|██▋       | 27/100 [24:39<1:10:37, 58.05s/trial, best loss: -0.4733] 28%|██▊       | 28/100 [25:17<1:02:32, 52.12s/trial, best loss: -0.4733] 29%|██▉       | 29/100 [26:14<1:03:14, 53.44s/trial, best loss: -0.4733] 30%|███       | 30/100 [27:11<1:03:46, 54.67s/trial, best loss: -0.4733] 31%|███       | 31/100 [28:02<1:01:29, 53.48s/trial, best loss: -0.4733] 32%|███▏      | 32/100 [28:42<56:10, 49.57s/trial, best loss: -0.4733]   33%|███▎      | 33/100 [31:01<1:25:15, 76.35s/trial, best loss: -0.4733] 34%|███▍      | 34/100 [32:07<1:20:38, 73.31s/trial, best loss: -0.4733] 35%|███▌      | 35/100 [33:09<1:15:38, 69.82s/trial, best loss: -0.4733] 36%|███▌      | 36/100 [33:50<1:05:23, 61.30s/trial, best loss: -0.4733] 37%|███▋      | 37/100 [34:38<1:00:00, 57.15s/trial, best loss: -0.4733] 38%|███▊      | 38/100 [35:28<56:52, 55.04s/trial, best loss: -0.4733]   39%|███▉      | 39/100 [36:13<52:54, 52.04s/trial, best loss: -0.4733] 40%|████      | 40/100 [37:13<54:26, 54.45s/trial, best loss: -0.4733] 41%|████      | 41/100 [37:38<44:54, 45.67s/trial, best loss: -0.4733] 42%|████▏     | 42/100 [38:45<50:20, 52.08s/trial, best loss: -0.4733] 43%|████▎     | 43/100 [39:40<50:12, 52.85s/trial, best loss: -0.4733] 44%|████▍     | 44/100 [40:55<55:31, 59.50s/trial, best loss: -0.4733] 45%|████▌     | 45/100 [41:56<54:56, 59.94s/trial, best loss: -0.4733] 46%|████▌     | 46/100 [42:33<47:52, 53.20s/trial, best loss: -0.4733] 47%|████▋     | 47/100 [43:56<54:50, 62.08s/trial, best loss: -0.4733] 48%|████▊     | 48/100 [44:30<46:19, 53.44s/trial, best loss: -0.474]  49%|████▉     | 49/100 [45:07<41:27, 48.77s/trial, best loss: -0.4748] 50%|█████     | 50/100 [45:49<38:43, 46.47s/trial, best loss: -0.4748] 51%|█████     | 51/100 [46:44<40:10, 49.20s/trial, best loss: -0.4748] 52%|█████▏    | 52/100 [47:28<38:07, 47.66s/trial, best loss: -0.4748] 53%|█████▎    | 53/100 [48:16<37:29, 47.85s/trial, best loss: -0.4748] 54%|█████▍    | 54/100 [49:07<37:18, 48.67s/trial, best loss: -0.4748] 55%|█████▌    | 55/100 [49:40<33:02, 44.05s/trial, best loss: -0.4748] 56%|█████▌    | 56/100 [50:28<33:00, 45.01s/trial, best loss: -0.4748] 57%|█████▋    | 57/100 [51:07<31:04, 43.35s/trial, best loss: -0.4748] 58%|█████▊    | 58/100 [51:49<30:05, 42.98s/trial, best loss: -0.4749] 59%|█████▉    | 59/100 [52:43<31:35, 46.22s/trial, best loss: -0.4773] 60%|██████    | 60/100 [53:23<29:40, 44.51s/trial, best loss: -0.4773] 61%|██████    | 61/100 [54:04<28:12, 43.40s/trial, best loss: -0.4773] 62%|██████▏   | 62/100 [54:44<26:52, 42.44s/trial, best loss: -0.4773] 63%|██████▎   | 63/100 [55:35<27:39, 44.86s/trial, best loss: -0.4773] 64%|██████▍   | 64/100 [56:32<29:07, 48.54s/trial, best loss: -0.4773] 65%|██████▌   | 65/100 [57:06<25:48, 44.24s/trial, best loss: -0.4773] 66%|██████▌   | 66/100 [57:45<24:06, 42.54s/trial, best loss: -0.4773] 67%|██████▋   | 67/100 [58:43<25:57, 47.21s/trial, best loss: -0.4773] 68%|██████▊   | 68/100 [59:20<23:29, 44.05s/trial, best loss: -0.4773] 69%|██████▉   | 69/100 [1:00:02<22:30, 43.56s/trial, best loss: -0.4773] 70%|███████   | 70/100 [1:01:13<25:50, 51.68s/trial, best loss: -0.4773] 71%|███████   | 71/100 [1:02:24<27:52, 57.66s/trial, best loss: -0.4773] 72%|███████▏  | 72/100 [1:03:20<26:35, 57.00s/trial, best loss: -0.4773] 73%|███████▎  | 73/100 [1:04:02<23:36, 52.46s/trial, best loss: -0.4773] 74%|███████▍  | 74/100 [1:04:36<20:23, 47.06s/trial, best loss: -0.4773] 75%|███████▌  | 75/100 [1:05:10<17:56, 43.05s/trial, best loss: -0.4773] 76%|███████▌  | 76/100 [1:05:55<17:32, 43.84s/trial, best loss: -0.4773] 77%|███████▋  | 77/100 [1:06:30<15:42, 40.99s/trial, best loss: -0.4773] 78%|███████▊  | 78/100 [1:07:41<18:20, 50.01s/trial, best loss: -0.4773] 79%|███████▉  | 79/100 [1:08:35<17:57, 51.30s/trial, best loss: -0.4773] 80%|████████  | 80/100 [1:09:16<16:05, 48.25s/trial, best loss: -0.4773] 81%|████████  | 81/100 [1:10:03<15:08, 47.81s/trial, best loss: -0.4773] 82%|████████▏ | 82/100 [1:10:30<12:27, 41.53s/trial, best loss: -0.4773] 83%|████████▎ | 83/100 [1:11:14<11:59, 42.33s/trial, best loss: -0.4773] 84%|████████▍ | 84/100 [1:11:54<11:04, 41.56s/trial, best loss: -0.4773] 85%|████████▌ | 85/100 [1:12:28<09:50, 39.34s/trial, best loss: -0.4773] 86%|████████▌ | 86/100 [1:12:58<08:30, 36.45s/trial, best loss: -0.4773] 87%|████████▋ | 87/100 [1:13:42<08:23, 38.76s/trial, best loss: -0.4773] 88%|████████▊ | 88/100 [1:14:19<07:37, 38.12s/trial, best loss: -0.4773] 89%|████████▉ | 89/100 [1:15:00<07:10, 39.18s/trial, best loss: -0.4773] 90%|█████████ | 90/100 [1:15:32<06:11, 37.11s/trial, best loss: -0.4773] 91%|█████████ | 91/100 [1:16:05<05:20, 35.64s/trial, best loss: -0.4773] 92%|█████████▏| 92/100 [1:17:24<06:30, 48.79s/trial, best loss: -0.4773] 93%|█████████▎| 93/100 [1:18:08<05:30, 47.22s/trial, best loss: -0.4773] 94%|█████████▍| 94/100 [1:18:48<04:30, 45.12s/trial, best loss: -0.4773] 95%|█████████▌| 95/100 [1:19:30<03:40, 44.09s/trial, best loss: -0.4773] 96%|█████████▌| 96/100 [1:20:11<02:52, 43.17s/trial, best loss: -0.4773] 97%|█████████▋| 97/100 [1:20:42<01:58, 39.54s/trial, best loss: -0.4773] 98%|█████████▊| 98/100 [1:21:27<01:22, 41.27s/trial, best loss: -0.4773] 99%|█████████▉| 99/100 [1:22:14<00:43, 43.00s/trial, best loss: -0.4773]100%|██████████| 100/100 [1:22:55<00:00, 42.43s/trial, best loss: -0.4773]100%|██████████| 100/100 [1:22:55<00:00, 49.76s/trial, best loss: -0.4773]

최적화 완료. 최적 파라미터: {'colsample_bytree': 0.7955102167770075, 'gamma': 0.16947237102826285, 'learning_rate': 0.04201247161970075, 'max_depth': 11.0, 'min_child_weight': 4.0, 'reg_alpha': 0.9136392250501164, 'reg_lambda': 0.4323511178052387, 'subsample': 0.6554957061124282}
최적 CSI 점수: 0.4773 (loss: -0.4773)

최적화 과정 요약:
  - 총 시도 횟수: 100
  - 성공한 시도: 100
  - 최초 CSI: 0.4609
  - 최종 CSI: 0.4728
  - 최고 CSI: 0.4773
  - 최저 CSI: 0.4510
  - 평균 CSI: 0.4668

최적화 Trials 객체가 /workspace/visibility_prediction/Analysis_code/optimization_history/xgb_smote_busan_trials.pkl에 저장되었습니다.
최종 모델 학습 시작...
Fold 1 학습 중... (학습 연도: [2018, 2019], 검증 연도: 2020)
Fold 1 검증 CSI: 0.4773
Fold 2 학습 중... (학습 연도: [2018, 2020], 검증 연도: 2019)
Fold 2 검증 CSI: 0.4851
Fold 3 학습 중... (학습 연도: [2019, 2020], 검증 연도: 2018)
Fold 3 검증 CSI: 0.4696
모델 저장 중...
모델이 /workspace/visibility_prediction/Analysis_code/save_model/xgb_optima/xgb_smote_busan.pkl에 저장되었습니다.

✓ 완료: xgb_smote/XGB_smote_busan.py (소요 시간: 5032초)

----------------------------------------
실행 중: xgb_smote/XGB_smote_daegu.py
시작 시간: 2025-12-27 03:32:58
----------------------------------------
데이터 로딩 중...
데이터 전처리 중...
하이퍼파라미터 최적화 시작...
  0%|          | 0/100 [00:00<?, ?trial/s, best loss=?]  1%|          | 1/100 [00:33<54:47, 33.20s/trial, best loss: -0.4577]  2%|▏         | 2/100 [01:14<1:01:33, 37.69s/trial, best loss: -0.4577]  3%|▎         | 3/100 [01:44<55:40, 34.44s/trial, best loss: -0.4577]    4%|▍         | 4/100 [02:30<1:02:15, 38.91s/trial, best loss: -0.4577]  5%|▌         | 5/100 [03:17<1:06:18, 41.88s/trial, best loss: -0.4577]  6%|▌         | 6/100 [04:03<1:07:42, 43.22s/trial, best loss: -0.4577]  7%|▋         | 7/100 [04:32<1:00:05, 38.77s/trial, best loss: -0.4577]  8%|▊         | 8/100 [05:06<57:05, 37.23s/trial, best loss: -0.4577]    9%|▉         | 9/100 [07:01<1:33:04, 61.37s/trial, best loss: -0.4577] 10%|█         | 10/100 [07:34<1:18:58, 52.64s/trial, best loss: -0.4577] 11%|█         | 11/100 [08:03<1:07:18, 45.37s/trial, best loss: -0.4577] 12%|█▏        | 12/100 [08:49<1:06:45, 45.51s/trial, best loss: -0.4577] 13%|█▎        | 13/100 [09:25<1:01:58, 42.74s/trial, best loss: -0.4577] 14%|█▍        | 14/100 [10:00<57:43, 40.28s/trial, best loss: -0.4577]   15%|█▌        | 15/100 [10:36<55:12, 38.97s/trial, best loss: -0.4577] 16%|█▌        | 16/100 [11:11<52:52, 37.77s/trial, best loss: -0.4577] 17%|█▋        | 17/100 [11:49<52:38, 38.06s/trial, best loss: -0.4577] 18%|█▊        | 18/100 [12:43<58:26, 42.76s/trial, best loss: -0.4577] 19%|█▉        | 19/100 [13:18<54:35, 40.43s/trial, best loss: -0.4577] 20%|██        | 20/100 [13:55<52:41, 39.52s/trial, best loss: -0.4577] 21%|██        | 21/100 [14:29<49:45, 37.79s/trial, best loss: -0.4577] 22%|██▏       | 22/100 [15:13<51:32, 39.65s/trial, best loss: -0.4593] 23%|██▎       | 23/100 [15:43<47:03, 36.66s/trial, best loss: -0.4593] 24%|██▍       | 24/100 [16:25<48:33, 38.34s/trial, best loss: -0.4593] 25%|██▌       | 25/100 [16:54<44:30, 35.61s/trial, best loss: -0.4593] 26%|██▌       | 26/100 [17:33<45:09, 36.62s/trial, best loss: -0.4593] 27%|██▋       | 27/100 [18:52<1:00:02, 49.35s/trial, best loss: -0.4593] 28%|██▊       | 28/100 [19:28<54:28, 45.39s/trial, best loss: -0.4593]   29%|██▉       | 29/100 [20:05<50:24, 42.60s/trial, best loss: -0.4633] 30%|███       | 30/100 [21:02<55:01, 47.16s/trial, best loss: -0.4633] 31%|███       | 31/100 [21:55<56:14, 48.90s/trial, best loss: -0.4672] 32%|███▏      | 32/100 [23:04<1:02:09, 54.84s/trial, best loss: -0.4672] 33%|███▎      | 33/100 [24:19<1:07:51, 60.77s/trial, best loss: -0.4672] 34%|███▍      | 34/100 [25:10<1:03:47, 58.00s/trial, best loss: -0.4672] 35%|███▌      | 35/100 [25:57<59:12, 54.66s/trial, best loss: -0.4672]   36%|███▌      | 36/100 [26:32<51:54, 48.66s/trial, best loss: -0.4672] 37%|███▋      | 37/100 [28:02<1:04:08, 61.09s/trial, best loss: -0.4672] 38%|███▊      | 38/100 [29:19<1:08:01, 65.83s/trial, best loss: -0.4672] 39%|███▉      | 39/100 [29:59<59:05, 58.12s/trial, best loss: -0.4672]   40%|████      | 40/100 [30:58<58:34, 58.58s/trial, best loss: -0.4672] 41%|████      | 41/100 [31:33<50:25, 51.27s/trial, best loss: -0.4672] 42%|████▏     | 42/100 [32:33<52:15, 54.07s/trial, best loss: -0.4672] 43%|████▎     | 43/100 [33:38<54:21, 57.21s/trial, best loss: -0.4672] 44%|████▍     | 44/100 [34:34<53:14, 57.04s/trial, best loss: -0.4672] 45%|████▌     | 45/100 [35:36<53:27, 58.31s/trial, best loss: -0.4672] 46%|████▌     | 46/100 [36:17<47:58, 53.30s/trial, best loss: -0.4672] 47%|████▋     | 47/100 [37:09<46:41, 52.86s/trial, best loss: -0.4672] 48%|████▊     | 48/100 [38:15<49:10, 56.74s/trial, best loss: -0.4672] 49%|████▉     | 49/100 [39:18<49:46, 58.56s/trial, best loss: -0.4672] 50%|█████     | 50/100 [41:34<1:08:10, 81.82s/trial, best loss: -0.4672] 51%|█████     | 51/100 [42:26<59:40, 73.06s/trial, best loss: -0.4672]   52%|█████▏    | 52/100 [43:19<53:25, 66.79s/trial, best loss: -0.4672] 53%|█████▎    | 53/100 [44:40<55:41, 71.09s/trial, best loss: -0.4672] 54%|█████▍    | 54/100 [45:16<46:31, 60.68s/trial, best loss: -0.4672] 55%|█████▌    | 55/100 [45:55<40:31, 54.04s/trial, best loss: -0.4672] 56%|█████▌    | 56/100 [46:18<32:48, 44.74s/trial, best loss: -0.4672] 57%|█████▋    | 57/100 [47:34<38:46, 54.11s/trial, best loss: -0.4672] 58%|█████▊    | 58/100 [48:12<34:38, 49.50s/trial, best loss: -0.4672] 59%|█████▉    | 59/100 [48:53<31:55, 46.71s/trial, best loss: -0.4672] 60%|██████    | 60/100 [50:12<37:38, 56.46s/trial, best loss: -0.4672] 61%|██████    | 61/100 [51:02<35:32, 54.69s/trial, best loss: -0.4672] 62%|██████▏   | 62/100 [52:31<40:59, 64.73s/trial, best loss: -0.4672] 63%|██████▎   | 63/100 [53:28<38:34, 62.54s/trial, best loss: -0.4672] 64%|██████▍   | 64/100 [54:04<32:41, 54.47s/trial, best loss: -0.4672] 65%|██████▌   | 65/100 [54:40<28:36, 49.05s/trial, best loss: -0.4672] 66%|██████▌   | 66/100 [55:15<25:28, 44.94s/trial, best loss: -0.4672] 67%|██████▋   | 67/100 [56:00<24:35, 44.70s/trial, best loss: -0.4672] 68%|██████▊   | 68/100 [56:50<24:42, 46.34s/trial, best loss: -0.4672] 69%|██████▉   | 69/100 [57:46<25:31, 49.40s/trial, best loss: -0.4672] 70%|███████   | 70/100 [58:33<24:20, 48.67s/trial, best loss: -0.4672] 71%|███████   | 71/100 [59:14<22:18, 46.16s/trial, best loss: -0.4672] 72%|███████▏  | 72/100 [59:49<20:01, 42.92s/trial, best loss: -0.4672] 73%|███████▎  | 73/100 [1:00:32<19:21, 43.02s/trial, best loss: -0.4672] 74%|███████▍  | 74/100 [1:01:20<19:18, 44.57s/trial, best loss: -0.4672] 75%|███████▌  | 75/100 [1:02:21<20:38, 49.53s/trial, best loss: -0.4672] 76%|███████▌  | 76/100 [1:03:14<20:08, 50.36s/trial, best loss: -0.4672] 77%|███████▋  | 77/100 [1:04:05<19:21, 50.50s/trial, best loss: -0.4672] 78%|███████▊  | 78/100 [1:04:36<16:25, 44.78s/trial, best loss: -0.4672] 79%|███████▉  | 79/100 [1:05:07<14:14, 40.69s/trial, best loss: -0.4672] 80%|████████  | 80/100 [1:05:34<12:12, 36.61s/trial, best loss: -0.4672] 81%|████████  | 81/100 [1:06:15<11:58, 37.84s/trial, best loss: -0.4672] 82%|████████▏ | 82/100 [1:06:43<10:30, 35.04s/trial, best loss: -0.4672] 83%|████████▎ | 83/100 [1:07:18<09:53, 34.93s/trial, best loss: -0.4672] 84%|████████▍ | 84/100 [1:08:07<10:27, 39.19s/trial, best loss: -0.4672] 85%|████████▌ | 85/100 [1:08:50<10:04, 40.29s/trial, best loss: -0.4672] 86%|████████▌ | 86/100 [1:09:31<09:26, 40.46s/trial, best loss: -0.4672] 87%|████████▋ | 87/100 [1:10:37<10:26, 48.21s/trial, best loss: -0.4672] 88%|████████▊ | 88/100 [1:11:24<09:33, 47.80s/trial, best loss: -0.4672] 89%|████████▉ | 89/100 [1:11:57<07:57, 43.40s/trial, best loss: -0.4672] 90%|█████████ | 90/100 [1:12:24<06:22, 38.29s/trial, best loss: -0.4672] 91%|█████████ | 91/100 [1:13:04<05:51, 39.02s/trial, best loss: -0.4672] 92%|█████████▏| 92/100 [1:13:33<04:46, 35.78s/trial, best loss: -0.4672] 93%|█████████▎| 93/100 [1:14:37<05:09, 44.26s/trial, best loss: -0.4672] 94%|█████████▍| 94/100 [1:15:03<03:52, 38.76s/trial, best loss: -0.4672] 95%|█████████▌| 95/100 [1:15:34<03:02, 36.50s/trial, best loss: -0.4672] 96%|█████████▌| 96/100 [1:16:47<03:09, 47.49s/trial, best loss: -0.4672] 97%|█████████▋| 97/100 [1:17:14<02:04, 41.42s/trial, best loss: -0.4672] 98%|█████████▊| 98/100 [1:17:44<01:15, 37.81s/trial, best loss: -0.4672] 99%|█████████▉| 99/100 [1:18:16<00:36, 36.07s/trial, best loss: -0.4672]100%|██████████| 100/100 [1:18:46<00:00, 34.25s/trial, best loss: -0.4672]100%|██████████| 100/100 [1:18:46<00:00, 47.26s/trial, best loss: -0.4672]

최적화 완료. 최적 파라미터: {'colsample_bytree': 0.8132816721507904, 'gamma': 0.9002659162503241, 'learning_rate': 0.04046864452016672, 'max_depth': 4.0, 'min_child_weight': 17.0, 'reg_alpha': 0.4681545450085154, 'reg_lambda': 0.531313515098387, 'subsample': 0.827198506312037}
최적 CSI 점수: 0.4672 (loss: -0.4672)

최적화 과정 요약:
  - 총 시도 횟수: 100
  - 성공한 시도: 100
  - 최초 CSI: 0.4577
  - 최종 CSI: 0.4534
  - 최고 CSI: 0.4672
  - 최저 CSI: 0.4275
  - 평균 CSI: 0.4521

최적화 Trials 객체가 /workspace/visibility_prediction/Analysis_code/optimization_history/xgb_smote_daegu_trials.pkl에 저장되었습니다.
최종 모델 학습 시작...
Fold 1 학습 중... (학습 연도: [2018, 2019], 검증 연도: 2020)
Fold 1 검증 CSI: 0.3865
Fold 2 학습 중... (학습 연도: [2018, 2020], 검증 연도: 2019)
Fold 2 검증 CSI: 0.4828
Fold 3 학습 중... (학습 연도: [2019, 2020], 검증 연도: 2018)
Fold 3 검증 CSI: 0.5322
모델 저장 중...
모델이 /workspace/visibility_prediction/Analysis_code/save_model/xgb_optima/xgb_smote_daegu.pkl에 저장되었습니다.

✓ 완료: xgb_smote/XGB_smote_daegu.py (소요 시간: 4763초)

==========================================
XGB SMOTE 파일 실행 완료
종료 시간: 2025-12-27 04:52:21
총 소요 시간: 2시간 43분 15초
성공: 2개
실패: 0개
==========================================
