nohup: ignoring input
/bin/bash: /opt/conda/lib/libtinfo.so.6: no version information available (required by /bin/bash)
==========================================
XGB Pure 파일 실행 시작
시작 시간: 2025-12-23 14:44:21
GPU: 0번 (os.environ['CUDA_VISIBLE_DEVICES'] = '0')
==========================================

----------------------------------------
실행 중: xgb_pure/XGB_pure_daejeon.py
시작 시간: 2025-12-23 14:44:21
----------------------------------------
데이터 로딩 중...
하이퍼파라미터 최적화 시작...
  0%|          | 0/100 [00:00<?, ?trial/s, best loss=?]  1%|          | 1/100 [00:42<1:09:30, 42.12s/trial, best loss: -0.4842]  2%|▏         | 2/100 [01:16<1:01:37, 37.73s/trial, best loss: -0.4864]  3%|▎         | 3/100 [02:04<1:08:22, 42.29s/trial, best loss: -0.4887]  4%|▍         | 4/100 [02:41<1:04:35, 40.37s/trial, best loss: -0.4902]  5%|▌         | 5/100 [03:08<55:53, 35.30s/trial, best loss: -0.4904]    6%|▌         | 6/100 [03:50<59:11, 37.78s/trial, best loss: -0.5009]  7%|▋         | 7/100 [04:36<1:02:24, 40.26s/trial, best loss: -0.5009]  8%|▊         | 8/100 [05:18<1:02:40, 40.88s/trial, best loss: -0.5009]  9%|▉         | 9/100 [05:57<1:01:03, 40.26s/trial, best loss: -0.5009] 10%|█         | 10/100 [07:10<1:15:34, 50.39s/trial, best loss: -0.5043] 11%|█         | 11/100 [08:06<1:17:17, 52.10s/trial, best loss: -0.5043] 12%|█▏        | 12/100 [08:50<1:12:41, 49.56s/trial, best loss: -0.5043] 13%|█▎        | 13/100 [09:31<1:08:04, 46.95s/trial, best loss: -0.5043] 14%|█▍        | 14/100 [10:08<1:02:59, 43.95s/trial, best loss: -0.5043] 15%|█▌        | 15/100 [10:42<58:08, 41.04s/trial, best loss: -0.5043]   16%|█▌        | 16/100 [11:50<1:08:45, 49.11s/trial, best loss: -0.5043] 17%|█▋        | 17/100 [12:54<1:14:05, 53.57s/trial, best loss: -0.5043] 18%|█▊        | 18/100 [13:46<1:12:43, 53.21s/trial, best loss: -0.5043] 19%|█▉        | 19/100 [14:25<1:06:11, 49.03s/trial, best loss: -0.5061] 20%|██        | 20/100 [15:25<1:09:26, 52.08s/trial, best loss: -0.5061] 21%|██        | 21/100 [16:11<1:06:30, 50.51s/trial, best loss: -0.5061] 22%|██▏       | 22/100 [16:54<1:02:35, 48.14s/trial, best loss: -0.5061] 23%|██▎       | 23/100 [17:15<51:12, 39.91s/trial, best loss: -0.5061]   24%|██▍       | 24/100 [18:33<1:05:02, 51.34s/trial, best loss: -0.5061] 25%|██▌       | 25/100 [19:09<58:24, 46.73s/trial, best loss: -0.5061]   26%|██▌       | 26/100 [20:33<1:11:22, 57.87s/trial, best loss: -0.5061] 27%|██▋       | 27/100 [20:50<55:47, 45.86s/trial, best loss: -0.5061]   28%|██▊       | 28/100 [21:29<52:16, 43.57s/trial, best loss: -0.5061] 29%|██▉       | 29/100 [22:14<52:04, 44.00s/trial, best loss: -0.5061] 30%|███       | 30/100 [23:04<53:31, 45.87s/trial, best loss: -0.5061] 31%|███       | 31/100 [24:02<57:02, 49.60s/trial, best loss: -0.5061] 32%|███▏      | 32/100 [24:30<48:42, 42.98s/trial, best loss: -0.5061] 33%|███▎      | 33/100 [25:02<44:25, 39.78s/trial, best loss: -0.5061] 34%|███▍      | 34/100 [25:49<46:02, 41.86s/trial, best loss: -0.5061] 35%|███▌      | 35/100 [26:24<43:22, 40.04s/trial, best loss: -0.5061] 36%|███▌      | 36/100 [27:04<42:31, 39.86s/trial, best loss: -0.5061] 37%|███▋      | 37/100 [27:31<37:49, 36.02s/trial, best loss: -0.5061] 38%|███▊      | 38/100 [27:56<33:50, 32.75s/trial, best loss: -0.5061] 39%|███▉      | 39/100 [28:29<33:11, 32.65s/trial, best loss: -0.5061] 40%|████      | 40/100 [29:05<33:53, 33.90s/trial, best loss: -0.5061] 41%|████      | 41/100 [29:32<31:06, 31.64s/trial, best loss: -0.5061] 42%|████▏     | 42/100 [30:19<35:06, 36.32s/trial, best loss: -0.5061] 43%|████▎     | 43/100 [31:13<39:25, 41.50s/trial, best loss: -0.5061] 44%|████▍     | 44/100 [32:05<41:56, 44.94s/trial, best loss: -0.5061] 45%|████▌     | 45/100 [32:51<41:27, 45.22s/trial, best loss: -0.5061] 46%|████▌     | 46/100 [33:27<38:00, 42.23s/trial, best loss: -0.5061] 47%|████▋     | 47/100 [33:49<32:06, 36.35s/trial, best loss: -0.5061] 48%|████▊     | 48/100 [34:28<32:02, 36.96s/trial, best loss: -0.5061] 49%|████▉     | 49/100 [34:51<28:04, 33.03s/trial, best loss: -0.5061] 50%|█████     | 50/100 [35:48<33:24, 40.09s/trial, best loss: -0.5061] 51%|█████     | 51/100 [36:32<33:41, 41.25s/trial, best loss: -0.5061] 52%|█████▏    | 52/100 [37:42<39:57, 49.94s/trial, best loss: -0.5061] 53%|█████▎    | 53/100 [38:39<40:46, 52.06s/trial, best loss: -0.5061] 54%|█████▍    | 54/100 [39:24<38:19, 49.98s/trial, best loss: -0.5061] 55%|█████▌    | 55/100 [40:05<35:26, 47.25s/trial, best loss: -0.5061] 56%|█████▌    | 56/100 [40:43<32:36, 44.47s/trial, best loss: -0.5061] 57%|█████▋    | 57/100 [41:32<32:54, 45.91s/trial, best loss: -0.5061] 58%|█████▊    | 58/100 [42:12<30:49, 44.04s/trial, best loss: -0.5061] 59%|█████▉    | 59/100 [42:40<26:43, 39.12s/trial, best loss: -0.5061] 60%|██████    | 60/100 [43:08<23:52, 35.82s/trial, best loss: -0.5061] 61%|██████    | 61/100 [44:20<30:18, 46.63s/trial, best loss: -0.5061] 62%|██████▏   | 62/100 [45:16<31:23, 49.56s/trial, best loss: -0.5061] 63%|██████▎   | 63/100 [45:49<27:26, 44.51s/trial, best loss: -0.5061] 64%|██████▍   | 64/100 [46:21<24:30, 40.84s/trial, best loss: -0.5061] 65%|██████▌   | 65/100 [47:09<25:02, 42.92s/trial, best loss: -0.5061] 66%|██████▌   | 66/100 [47:49<23:49, 42.04s/trial, best loss: -0.5086] 67%|██████▋   | 67/100 [48:26<22:19, 40.60s/trial, best loss: -0.5086] 68%|██████▊   | 68/100 [48:56<19:55, 37.37s/trial, best loss: -0.5086] 69%|██████▉   | 69/100 [49:26<18:08, 35.13s/trial, best loss: -0.5098] 70%|███████   | 70/100 [50:05<18:13, 36.44s/trial, best loss: -0.5098] 71%|███████   | 71/100 [50:56<19:40, 40.72s/trial, best loss: -0.5098] 72%|███████▏  | 72/100 [51:32<18:23, 39.40s/trial, best loss: -0.5098] 73%|███████▎  | 73/100 [52:13<17:56, 39.87s/trial, best loss: -0.5098] 74%|███████▍  | 74/100 [52:47<16:29, 38.04s/trial, best loss: -0.5098] 75%|███████▌  | 75/100 [53:21<15:15, 36.64s/trial, best loss: -0.5098] 76%|███████▌  | 76/100 [53:49<13:38, 34.10s/trial, best loss: -0.5098] 77%|███████▋  | 77/100 [54:29<13:45, 35.88s/trial, best loss: -0.5098] 78%|███████▊  | 78/100 [54:56<12:11, 33.26s/trial, best loss: -0.5098] 79%|███████▉  | 79/100 [55:16<10:16, 29.36s/trial, best loss: -0.5098] 80%|████████  | 80/100 [55:54<10:40, 32.03s/trial, best loss: -0.5098] 81%|████████  | 81/100 [56:29<10:22, 32.74s/trial, best loss: -0.5098] 82%|████████▏ | 82/100 [57:01<09:45, 32.55s/trial, best loss: -0.5098] 83%|████████▎ | 83/100 [57:50<10:37, 37.47s/trial, best loss: -0.5098] 84%|████████▍ | 84/100 [58:29<10:07, 37.96s/trial, best loss: -0.5098] 85%|████████▌ | 85/100 [59:14<09:59, 39.97s/trial, best loss: -0.5098] 86%|████████▌ | 86/100 [1:00:05<10:08, 43.49s/trial, best loss: -0.5098] 87%|████████▋ | 87/100 [1:00:42<08:59, 41.46s/trial, best loss: -0.5098] 88%|████████▊ | 88/100 [1:01:16<07:50, 39.17s/trial, best loss: -0.5098] 89%|████████▉ | 89/100 [1:01:42<06:28, 35.28s/trial, best loss: -0.5098] 90%|█████████ | 90/100 [1:02:08<05:25, 32.58s/trial, best loss: -0.5098] 91%|█████████ | 91/100 [1:02:50<05:17, 35.30s/trial, best loss: -0.5098] 92%|█████████▏| 92/100 [1:03:12<04:10, 31.35s/trial, best loss: -0.5098] 93%|█████████▎| 93/100 [1:04:16<04:47, 41.12s/trial, best loss: -0.5098] 94%|█████████▍| 94/100 [1:04:56<04:05, 40.83s/trial, best loss: -0.5098] 95%|█████████▌| 95/100 [1:05:36<03:23, 40.65s/trial, best loss: -0.5098] 96%|█████████▌| 96/100 [1:06:04<02:26, 36.60s/trial, best loss: -0.5098] 97%|█████████▋| 97/100 [1:06:32<01:42, 34.22s/trial, best loss: -0.5098] 98%|█████████▊| 98/100 [1:07:07<01:09, 34.51s/trial, best loss: -0.5098] 99%|█████████▉| 99/100 [1:07:39<00:33, 33.62s/trial, best loss: -0.5098]100%|██████████| 100/100 [1:08:01<00:00, 30.09s/trial, best loss: -0.5098]100%|██████████| 100/100 [1:08:01<00:00, 40.81s/trial, best loss: -0.5098]

최적화 완료. 최적 파라미터: {'colsample_bytree': 0.7188993723348515, 'gamma': 0.8312229248711611, 'learning_rate': 0.13636264607406778, 'max_depth': 4.0, 'min_child_weight': 4.0, 'reg_alpha': 0.8193564485724522, 'reg_lambda': 0.796595038878536, 'subsample': 0.6408013744463261}
최적 CSI 점수: 0.5098 (loss: -0.5098)

최적화 과정 요약:
  - 총 시도 횟수: 100
  - 성공한 시도: 100
  - 최초 CSI: 0.4842
  - 최종 CSI: 0.4940
  - 최고 CSI: 0.5098
  - 최저 CSI: 0.4835
  - 평균 CSI: 0.4974

최적화 Trials 객체가 ../optimization_history/xgb_pure_daejeon_trials.pkl에 저장되었습니다.
최종 모델 학습 시작...
Fold 1 학습 중... (학습 연도: [2018, 2019], 검증 연도: 2020)
Fold 1 검증 CSI: 0.4542
Fold 2 학습 중... (학습 연도: [2018, 2020], 검증 연도: 2019)
Fold 2 검증 CSI: 0.4836
Fold 3 학습 중... (학습 연도: [2019, 2020], 검증 연도: 2018)
Fold 3 검증 CSI: 0.5916
모델 저장 중...
모델이 ../save_model/xgb_optima/xgb_pure_daejeon.pkl에 저장되었습니다.

✓ 완료: xgb_pure/XGB_pure_daejeon.py (소요 시간: 4107초)

----------------------------------------
실행 중: xgb_pure/XGB_pure_gwangju.py
시작 시간: 2025-12-23 15:52:48
----------------------------------------
데이터 로딩 중...
하이퍼파라미터 최적화 시작...
  0%|          | 0/100 [00:00<?, ?trial/s, best loss=?]  1%|          | 1/100 [00:47<1:18:28, 47.56s/trial, best loss: -0.4935]  2%|▏         | 2/100 [01:17<1:00:19, 36.93s/trial, best loss: -0.4935]  3%|▎         | 3/100 [01:46<53:57, 33.38s/trial, best loss: -0.4935]    4%|▍         | 4/100 [02:23<55:51, 34.91s/trial, best loss: -0.4935]  5%|▌         | 5/100 [03:16<1:05:22, 41.29s/trial, best loss: -0.4935]  6%|▌         | 6/100 [04:16<1:14:42, 47.69s/trial, best loss: -0.4935]  7%|▋         | 7/100 [05:07<1:15:47, 48.90s/trial, best loss: -0.4935]  8%|▊         | 8/100 [05:53<1:13:42, 48.07s/trial, best loss: -0.4935]  9%|▉         | 9/100 [06:21<1:03:26, 41.83s/trial, best loss: -0.4935] 10%|█         | 10/100 [06:47<55:02, 36.70s/trial, best loss: -0.4935]  11%|█         | 11/100 [07:27<56:03, 37.79s/trial, best loss: -0.4935] 12%|█▏        | 12/100 [07:57<52:08, 35.55s/trial, best loss: -0.4935] 13%|█▎        | 13/100 [08:26<48:22, 33.37s/trial, best loss: -0.4947] 14%|█▍        | 14/100 [08:46<42:11, 29.44s/trial, best loss: -0.4947] 15%|█▌        | 15/100 [09:14<40:59, 28.94s/trial, best loss: -0.4947] 16%|█▌        | 16/100 [09:41<39:38, 28.32s/trial, best loss: -0.4947] 17%|█▋        | 17/100 [10:11<39:56, 28.87s/trial, best loss: -0.496]  18%|█▊        | 18/100 [10:46<41:51, 30.62s/trial, best loss: -0.496] 19%|█▉        | 19/100 [11:48<54:09, 40.12s/trial, best loss: -0.496] 20%|██        | 20/100 [12:06<44:51, 33.64s/trial, best loss: -0.496] 21%|██        | 21/100 [12:38<43:25, 32.98s/trial, best loss: -0.496] 22%|██▏       | 22/100 [13:06<40:49, 31.41s/trial, best loss: -0.496] 23%|██▎       | 23/100 [13:31<37:49, 29.47s/trial, best loss: -0.5014] 24%|██▍       | 24/100 [14:08<40:23, 31.89s/trial, best loss: -0.5014] 25%|██▌       | 25/100 [14:45<41:45, 33.41s/trial, best loss: -0.5014] 26%|██▌       | 26/100 [15:38<48:30, 39.33s/trial, best loss: -0.5014] 27%|██▋       | 27/100 [16:34<53:46, 44.19s/trial, best loss: -0.5014] 28%|██▊       | 28/100 [17:02<47:21, 39.47s/trial, best loss: -0.5014] 29%|██▉       | 29/100 [17:43<47:18, 39.98s/trial, best loss: -0.5014] 30%|███       | 30/100 [18:34<50:13, 43.05s/trial, best loss: -0.5014] 31%|███       | 31/100 [19:08<46:30, 40.45s/trial, best loss: -0.5014] 32%|███▏      | 32/100 [19:49<45:58, 40.57s/trial, best loss: -0.5014] 33%|███▎      | 33/100 [20:25<43:53, 39.30s/trial, best loss: -0.5014] 34%|███▍      | 34/100 [20:59<41:29, 37.72s/trial, best loss: -0.5014] 35%|███▌      | 35/100 [21:53<46:05, 42.54s/trial, best loss: -0.5014] 36%|███▌      | 36/100 [22:12<37:55, 35.56s/trial, best loss: -0.5014] 37%|███▋      | 37/100 [22:38<34:12, 32.58s/trial, best loss: -0.5014] 38%|███▊      | 38/100 [23:34<40:52, 39.56s/trial, best loss: -0.5014] 39%|███▉      | 39/100 [24:31<45:45, 45.01s/trial, best loss: -0.5014] 40%|████      | 40/100 [25:15<44:44, 44.74s/trial, best loss: -0.5014] 41%|████      | 41/100 [25:43<38:51, 39.52s/trial, best loss: -0.5014] 42%|████▏     | 42/100 [26:12<35:15, 36.47s/trial, best loss: -0.5014] 43%|████▎     | 43/100 [26:35<30:44, 32.37s/trial, best loss: -0.5014] 44%|████▍     | 44/100 [27:10<31:03, 33.27s/trial, best loss: -0.5014] 45%|████▌     | 45/100 [28:18<40:02, 43.68s/trial, best loss: -0.5014] 46%|████▌     | 46/100 [28:58<38:09, 42.39s/trial, best loss: -0.5014] 47%|████▋     | 47/100 [29:33<35:36, 40.32s/trial, best loss: -0.5014] 48%|████▊     | 48/100 [30:12<34:31, 39.83s/trial, best loss: -0.5014] 49%|████▉     | 49/100 [30:58<35:27, 41.72s/trial, best loss: -0.5014] 50%|█████     | 50/100 [31:44<35:54, 43.09s/trial, best loss: -0.5014] 51%|█████     | 51/100 [32:05<29:45, 36.44s/trial, best loss: -0.5014] 52%|█████▏    | 52/100 [32:32<26:49, 33.53s/trial, best loss: -0.5014] 53%|█████▎    | 53/100 [33:02<25:25, 32.45s/trial, best loss: -0.5014] 54%|█████▍    | 54/100 [33:29<23:36, 30.80s/trial, best loss: -0.5014] 55%|█████▌    | 55/100 [33:59<22:56, 30.60s/trial, best loss: -0.5014] 56%|█████▌    | 56/100 [35:02<29:32, 40.28s/trial, best loss: -0.5014] 57%|█████▋    | 57/100 [35:35<27:23, 38.22s/trial, best loss: -0.5014] 58%|█████▊    | 58/100 [36:18<27:43, 39.61s/trial, best loss: -0.5014] 59%|█████▉    | 59/100 [37:05<28:27, 41.66s/trial, best loss: -0.5014] 60%|██████    | 60/100 [37:32<24:56, 37.40s/trial, best loss: -0.5014] 61%|██████    | 61/100 [38:20<26:27, 40.71s/trial, best loss: -0.5014] 62%|██████▏   | 62/100 [38:52<24:05, 38.04s/trial, best loss: -0.5014] 63%|██████▎   | 63/100 [39:14<20:26, 33.16s/trial, best loss: -0.5016] 64%|██████▍   | 64/100 [39:57<21:39, 36.10s/trial, best loss: -0.5016] 65%|██████▌   | 65/100 [40:23<19:20, 33.14s/trial, best loss: -0.5016] 66%|██████▌   | 66/100 [40:45<16:52, 29.78s/trial, best loss: -0.5016] 67%|██████▋   | 67/100 [41:09<15:21, 27.92s/trial, best loss: -0.5016] 68%|██████▊   | 68/100 [41:39<15:19, 28.74s/trial, best loss: -0.5016] 69%|██████▉   | 69/100 [42:13<15:33, 30.12s/trial, best loss: -0.5016] 70%|███████   | 70/100 [42:35<13:50, 27.67s/trial, best loss: -0.5016] 71%|███████   | 71/100 [42:57<12:33, 25.98s/trial, best loss: -0.5016] 72%|███████▏  | 72/100 [43:22<12:02, 25.79s/trial, best loss: -0.5016] 73%|███████▎  | 73/100 [43:49<11:48, 26.25s/trial, best loss: -0.5016] 74%|███████▍  | 74/100 [44:09<10:29, 24.21s/trial, best loss: -0.5016] 75%|███████▌  | 75/100 [44:34<10:15, 24.62s/trial, best loss: -0.5016] 76%|███████▌  | 76/100 [45:14<11:35, 28.98s/trial, best loss: -0.5016] 77%|███████▋  | 77/100 [45:51<12:06, 31.58s/trial, best loss: -0.5016] 78%|███████▊  | 78/100 [46:16<10:51, 29.60s/trial, best loss: -0.5016] 79%|███████▉  | 79/100 [46:46<10:21, 29.59s/trial, best loss: -0.5016] 80%|████████  | 80/100 [47:07<09:01, 27.09s/trial, best loss: -0.5016] 81%|████████  | 81/100 [47:32<08:24, 26.54s/trial, best loss: -0.5016] 82%|████████▏ | 82/100 [47:57<07:48, 26.04s/trial, best loss: -0.5016] 83%|████████▎ | 83/100 [48:35<08:22, 29.57s/trial, best loss: -0.5016] 84%|████████▍ | 84/100 [49:03<07:46, 29.17s/trial, best loss: -0.5016] 85%|████████▌ | 85/100 [49:44<08:10, 32.73s/trial, best loss: -0.5016] 86%|████████▌ | 86/100 [50:18<07:42, 33.01s/trial, best loss: -0.5016] 87%|████████▋ | 87/100 [50:42<06:36, 30.47s/trial, best loss: -0.5016] 88%|████████▊ | 88/100 [51:09<05:50, 29.25s/trial, best loss: -0.5016] 89%|████████▉ | 89/100 [51:29<04:50, 26.42s/trial, best loss: -0.5016] 90%|█████████ | 90/100 [52:03<04:48, 28.81s/trial, best loss: -0.5016] 91%|█████████ | 91/100 [52:37<04:33, 30.38s/trial, best loss: -0.5016] 92%|█████████▏| 92/100 [53:00<03:45, 28.21s/trial, best loss: -0.5016] 93%|█████████▎| 93/100 [53:22<03:04, 26.37s/trial, best loss: -0.5016] 94%|█████████▍| 94/100 [53:54<02:48, 28.09s/trial, best loss: -0.5016] 95%|█████████▌| 95/100 [54:16<02:11, 26.21s/trial, best loss: -0.5016] 96%|█████████▌| 96/100 [54:55<01:59, 29.92s/trial, best loss: -0.5016] 97%|█████████▋| 97/100 [55:24<01:29, 29.77s/trial, best loss: -0.5016] 98%|█████████▊| 98/100 [55:58<01:01, 30.93s/trial, best loss: -0.5016] 99%|█████████▉| 99/100 [56:27<00:30, 30.45s/trial, best loss: -0.5016]100%|██████████| 100/100 [56:53<00:00, 29.09s/trial, best loss: -0.5016]100%|██████████| 100/100 [56:53<00:00, 34.14s/trial, best loss: -0.5016]

최적화 완료. 최적 파라미터: {'colsample_bytree': 0.9713207386536029, 'gamma': 2.2482753887012703, 'learning_rate': 0.16732973947259167, 'max_depth': 8.0, 'min_child_weight': 3.0, 'reg_alpha': 0.2664406256084806, 'reg_lambda': 0.7263114796775476, 'subsample': 0.6483131273031051}
최적 CSI 점수: 0.5016 (loss: -0.5016)

최적화 과정 요약:
  - 총 시도 횟수: 100
  - 성공한 시도: 100
  - 최초 CSI: 0.4935
  - 최종 CSI: 0.4949
  - 최고 CSI: 0.5016
  - 최저 CSI: 0.4691
  - 평균 CSI: 0.4904

최적화 Trials 객체가 ../optimization_history/xgb_pure_gwangju_trials.pkl에 저장되었습니다.
최종 모델 학습 시작...
Fold 1 학습 중... (학습 연도: [2018, 2019], 검증 연도: 2020)
Fold 1 검증 CSI: 0.3974
Fold 2 학습 중... (학습 연도: [2018, 2020], 검증 연도: 2019)
Fold 2 검증 CSI: 0.5611
Fold 3 학습 중... (학습 연도: [2019, 2020], 검증 연도: 2018)
Fold 3 검증 CSI: 0.5463
모델 저장 중...
모델이 ../save_model/xgb_optima/xgb_pure_gwangju.pkl에 저장되었습니다.

✓ 완료: xgb_pure/XGB_pure_gwangju.py (소요 시간: 3436초)

----------------------------------------
실행 중: xgb_pure/XGB_pure_incheon.py
시작 시간: 2025-12-23 16:50:04
----------------------------------------
데이터 로딩 중...
하이퍼파라미터 최적화 시작...
  0%|          | 0/100 [00:00<?, ?trial/s, best loss=?]  1%|          | 1/100 [00:53<1:27:55, 53.29s/trial, best loss: -0.5505]  2%|▏         | 2/100 [01:26<1:07:31, 41.34s/trial, best loss: -0.5505]  3%|▎         | 3/100 [02:07<1:06:23, 41.07s/trial, best loss: -0.5597]  4%|▍         | 4/100 [02:55<1:10:35, 44.12s/trial, best loss: -0.5597]  5%|▌         | 5/100 [03:26<1:02:25, 39.43s/trial, best loss: -0.5597]  6%|▌         | 6/100 [04:15<1:06:42, 42.58s/trial, best loss: -0.5597]  7%|▋         | 7/100 [05:02<1:08:00, 43.88s/trial, best loss: -0.5597]  8%|▊         | 8/100 [05:36<1:02:39, 40.86s/trial, best loss: -0.5597]  9%|▉         | 9/100 [05:59<53:40, 35.39s/trial, best loss: -0.5597]   10%|█         | 10/100 [06:50<1:00:10, 40.12s/trial, best loss: -0.5597] 11%|█         | 11/100 [07:53<1:09:54, 47.13s/trial, best loss: -0.5597] 12%|█▏        | 12/100 [08:22<1:00:48, 41.46s/trial, best loss: -0.5613] 13%|█▎        | 13/100 [09:42<1:17:12, 53.25s/trial, best loss: -0.5613] 14%|█▍        | 14/100 [10:14<1:07:00, 46.75s/trial, best loss: -0.5613] 15%|█▌        | 15/100 [11:17<1:13:14, 51.70s/trial, best loss: -0.5613] 16%|█▌        | 16/100 [12:02<1:09:38, 49.74s/trial, best loss: -0.5615] 17%|█▋        | 17/100 [12:29<59:09, 42.77s/trial, best loss: -0.5615]   18%|█▊        | 18/100 [13:03<54:49, 40.12s/trial, best loss: -0.5615] 19%|█▉        | 19/100 [14:21<1:09:29, 51.48s/trial, best loss: -0.5615] 20%|██        | 20/100 [14:48<59:01, 44.27s/trial, best loss: -0.5615]   21%|██        | 21/100 [15:23<54:43, 41.56s/trial, best loss: -0.5624] 22%|██▏       | 22/100 [15:51<48:41, 37.46s/trial, best loss: -0.5624] 23%|██▎       | 23/100 [16:49<56:00, 43.64s/trial, best loss: -0.5624] 24%|██▍       | 24/100 [17:22<51:18, 40.51s/trial, best loss: -0.5624] 25%|██▌       | 25/100 [17:55<47:45, 38.20s/trial, best loss: -0.5624] 26%|██▌       | 26/100 [19:07<59:26, 48.20s/trial, best loss: -0.5624] 27%|██▋       | 27/100 [19:50<56:59, 46.84s/trial, best loss: -0.5649] 28%|██▊       | 28/100 [20:27<52:28, 43.74s/trial, best loss: -0.5649] 29%|██▉       | 29/100 [20:57<46:55, 39.66s/trial, best loss: -0.5649] 30%|███       | 30/100 [21:41<47:55, 41.08s/trial, best loss: -0.5649] 31%|███       | 31/100 [22:28<49:06, 42.71s/trial, best loss: -0.5649] 32%|███▏      | 32/100 [23:30<55:05, 48.60s/trial, best loss: -0.5649] 33%|███▎      | 33/100 [24:12<51:56, 46.51s/trial, best loss: -0.5649] 34%|███▍      | 34/100 [25:00<51:43, 47.02s/trial, best loss: -0.5649] 35%|███▌      | 35/100 [25:36<47:26, 43.79s/trial, best loss: -0.5649] 36%|███▌      | 36/100 [26:49<55:59, 52.49s/trial, best loss: -0.5649] 37%|███▋      | 37/100 [27:44<55:56, 53.28s/trial, best loss: -0.5649] 38%|███▊      | 38/100 [28:13<47:19, 45.79s/trial, best loss: -0.5649] 39%|███▉      | 39/100 [28:38<40:11, 39.54s/trial, best loss: -0.5649] 40%|████      | 40/100 [29:05<36:01, 36.03s/trial, best loss: -0.5649] 41%|████      | 41/100 [30:11<43:59, 44.74s/trial, best loss: -0.5649] 42%|████▏     | 42/100 [30:45<40:22, 41.76s/trial, best loss: -0.5649] 43%|████▎     | 43/100 [31:24<38:45, 40.79s/trial, best loss: -0.5649] 44%|████▍     | 44/100 [32:18<41:53, 44.88s/trial, best loss: -0.5649] 45%|████▌     | 45/100 [32:59<40:07, 43.77s/trial, best loss: -0.5649] 46%|████▌     | 46/100 [34:04<45:00, 50.00s/trial, best loss: -0.5649] 47%|████▋     | 47/100 [34:57<45:04, 51.03s/trial, best loss: -0.5649] 48%|████▊     | 48/100 [35:26<38:21, 44.26s/trial, best loss: -0.5649] 49%|████▉     | 49/100 [36:01<35:21, 41.59s/trial, best loss: -0.5649] 50%|█████     | 50/100 [36:54<37:33, 45.06s/trial, best loss: -0.5649] 51%|█████     | 51/100 [38:07<43:34, 53.36s/trial, best loss: -0.5649] 52%|█████▏    | 52/100 [38:58<42:04, 52.60s/trial, best loss: -0.5649] 53%|█████▎    | 53/100 [40:04<44:20, 56.60s/trial, best loss: -0.5649] 54%|█████▍    | 54/100 [40:57<42:40, 55.67s/trial, best loss: -0.5649] 55%|█████▌    | 55/100 [41:46<40:13, 53.64s/trial, best loss: -0.5649] 56%|█████▌    | 56/100 [42:24<35:46, 48.79s/trial, best loss: -0.5649] 57%|█████▋    | 57/100 [43:07<33:43, 47.07s/trial, best loss: -0.5649] 58%|█████▊    | 58/100 [44:00<34:09, 48.80s/trial, best loss: -0.5649] 59%|█████▉    | 59/100 [44:30<29:29, 43.16s/trial, best loss: -0.5649] 60%|██████    | 60/100 [45:39<33:59, 50.99s/trial, best loss: -0.5649] 61%|██████    | 61/100 [46:28<32:43, 50.35s/trial, best loss: -0.5649] 62%|██████▏   | 62/100 [47:23<32:46, 51.74s/trial, best loss: -0.5649] 63%|██████▎   | 63/100 [48:00<29:14, 47.42s/trial, best loss: -0.5649] 64%|██████▍   | 64/100 [48:38<26:43, 44.55s/trial, best loss: -0.5649] 65%|██████▌   | 65/100 [49:09<23:40, 40.59s/trial, best loss: -0.5649] 66%|██████▌   | 66/100 [50:04<25:28, 44.96s/trial, best loss: -0.5649] 67%|██████▋   | 67/100 [50:52<25:12, 45.85s/trial, best loss: -0.5649] 68%|██████▊   | 68/100 [51:28<22:49, 42.80s/trial, best loss: -0.5649] 69%|██████▉   | 69/100 [52:20<23:34, 45.61s/trial, best loss: -0.5649] 70%|███████   | 70/100 [53:00<21:59, 43.99s/trial, best loss: -0.5649] 71%|███████   | 71/100 [53:47<21:40, 44.85s/trial, best loss: -0.5649] 72%|███████▏  | 72/100 [54:42<22:18, 47.81s/trial, best loss: -0.5649] 73%|███████▎  | 73/100 [55:32<21:51, 48.57s/trial, best loss: -0.5649] 74%|███████▍  | 74/100 [56:33<22:38, 52.25s/trial, best loss: -0.5649] 75%|███████▌  | 75/100 [56:59<18:24, 44.18s/trial, best loss: -0.5649] 76%|███████▌  | 76/100 [57:33<16:28, 41.17s/trial, best loss: -0.5649] 77%|███████▋  | 77/100 [58:14<15:45, 41.11s/trial, best loss: -0.5649] 78%|███████▊  | 78/100 [59:22<18:04, 49.31s/trial, best loss: -0.5649] 79%|███████▉  | 79/100 [1:00:00<16:05, 46.00s/trial, best loss: -0.5649] 80%|████████  | 80/100 [1:00:44<15:04, 45.21s/trial, best loss: -0.5649] 81%|████████  | 81/100 [1:01:30<14:25, 45.54s/trial, best loss: -0.5649] 82%|████████▏ | 82/100 [1:02:33<15:13, 50.75s/trial, best loss: -0.5649] 83%|████████▎ | 83/100 [1:02:56<12:03, 42.58s/trial, best loss: -0.5649] 84%|████████▍ | 84/100 [1:03:40<11:27, 42.99s/trial, best loss: -0.5649] 85%|████████▌ | 85/100 [1:04:11<09:47, 39.20s/trial, best loss: -0.5649] 86%|████████▌ | 86/100 [1:05:10<10:33, 45.24s/trial, best loss: -0.566]  87%|████████▋ | 87/100 [1:06:25<11:41, 54.00s/trial, best loss: -0.566] 88%|████████▊ | 88/100 [1:07:50<12:41, 63.47s/trial, best loss: -0.566] 89%|████████▉ | 89/100 [1:08:39<10:50, 59.14s/trial, best loss: -0.566] 90%|█████████ | 90/100 [1:09:56<10:45, 64.52s/trial, best loss: -0.566] 91%|█████████ | 91/100 [1:11:01<09:40, 64.51s/trial, best loss: -0.566] 92%|█████████▏| 92/100 [1:12:08<08:42, 65.32s/trial, best loss: -0.566] 93%|█████████▎| 93/100 [1:12:52<06:53, 59.00s/trial, best loss: -0.566] 94%|█████████▍| 94/100 [1:13:48<05:48, 58.16s/trial, best loss: -0.566] 95%|█████████▌| 95/100 [1:14:21<04:12, 50.42s/trial, best loss: -0.566] 96%|█████████▌| 96/100 [1:15:16<03:27, 51.81s/trial, best loss: -0.566] 97%|█████████▋| 97/100 [1:16:20<02:46, 55.51s/trial, best loss: -0.566] 98%|█████████▊| 98/100 [1:17:48<02:10, 65.28s/trial, best loss: -0.566] 99%|█████████▉| 99/100 [1:18:56<01:06, 66.09s/trial, best loss: -0.566]100%|██████████| 100/100 [1:19:39<00:00, 59.26s/trial, best loss: -0.566]100%|██████████| 100/100 [1:19:39<00:00, 47.80s/trial, best loss: -0.566]

최적화 완료. 최적 파라미터: {'colsample_bytree': 0.7546508432340249, 'gamma': 1.043370422174196, 'learning_rate': 0.015864658027101238, 'max_depth': 11.0, 'min_child_weight': 6.0, 'reg_alpha': 0.7662203770275335, 'reg_lambda': 0.5754328276715727, 'subsample': 0.6332898543620008}
최적 CSI 점수: 0.5660 (loss: -0.5660)

최적화 과정 요약:
  - 총 시도 횟수: 100
  - 성공한 시도: 100
  - 최초 CSI: 0.5505
  - 최종 CSI: 0.5555
  - 최고 CSI: 0.5660
  - 최저 CSI: 0.5428
  - 평균 CSI: 0.5571

최적화 Trials 객체가 ../optimization_history/xgb_pure_incheon_trials.pkl에 저장되었습니다.
최종 모델 학습 시작...
Fold 1 학습 중... (학습 연도: [2018, 2019], 검증 연도: 2020)
Fold 1 검증 CSI: 0.4917
Fold 2 학습 중... (학습 연도: [2018, 2020], 검증 연도: 2019)
Fold 2 검증 CSI: 0.6194
Fold 3 학습 중... (학습 연도: [2019, 2020], 검증 연도: 2018)
Fold 3 검증 CSI: 0.5870
모델 저장 중...
모델이 ../save_model/xgb_optima/xgb_pure_incheon.pkl에 저장되었습니다.

✓ 완료: xgb_pure/XGB_pure_incheon.py (소요 시간: 4853초)

----------------------------------------
실행 중: xgb_pure/XGB_pure_seoul.py
시작 시간: 2025-12-23 18:10:57
----------------------------------------
데이터 로딩 중...
하이퍼파라미터 최적화 시작...
  0%|          | 0/100 [00:00<?, ?trial/s, best loss=?]  1%|          | 1/100 [00:20<33:04, 20.04s/trial, best loss: -0.5629]  2%|▏         | 2/100 [00:41<33:57, 20.79s/trial, best loss: -0.5629]  3%|▎         | 3/100 [01:13<42:08, 26.06s/trial, best loss: -0.5629]  4%|▍         | 4/100 [01:47<46:23, 29.00s/trial, best loss: -0.5629]  5%|▌         | 5/100 [02:19<48:04, 30.37s/trial, best loss: -0.5629]  6%|▌         | 6/100 [02:54<49:41, 31.72s/trial, best loss: -0.5629]  7%|▋         | 7/100 [03:21<46:45, 30.17s/trial, best loss: -0.5629]  8%|▊         | 8/100 [03:52<46:51, 30.56s/trial, best loss: -0.5629]  9%|▉         | 9/100 [04:12<41:09, 27.13s/trial, best loss: -0.5629] 10%|█         | 10/100 [05:06<53:25, 35.61s/trial, best loss: -0.5629] 11%|█         | 11/100 [05:45<54:21, 36.64s/trial, best loss: -0.5629] 12%|█▏        | 12/100 [06:50<1:06:13, 45.16s/trial, best loss: -0.5629] 13%|█▎        | 13/100 [07:34<1:05:01, 44.84s/trial, best loss: -0.5629] 14%|█▍        | 14/100 [08:00<56:10, 39.19s/trial, best loss: -0.5629]   15%|█▌        | 15/100 [09:01<1:04:49, 45.75s/trial, best loss: -0.5629] 16%|█▌        | 16/100 [09:54<1:06:59, 47.85s/trial, best loss: -0.5629] 17%|█▋        | 17/100 [10:42<1:06:05, 47.78s/trial, best loss: -0.5629] 18%|█▊        | 18/100 [11:18<1:00:36, 44.34s/trial, best loss: -0.5629] 19%|█▉        | 19/100 [12:08<1:02:13, 46.09s/trial, best loss: -0.5629] 20%|██        | 20/100 [12:37<54:31, 40.89s/trial, best loss: -0.5629]   21%|██        | 21/100 [13:03<48:08, 36.57s/trial, best loss: -0.5629] 22%|██▏       | 22/100 [13:30<43:39, 33.58s/trial, best loss: -0.5629] 23%|██▎       | 23/100 [13:55<39:39, 30.90s/trial, best loss: -0.5706] 24%|██▍       | 24/100 [14:18<36:15, 28.63s/trial, best loss: -0.5711] 25%|██▌       | 25/100 [14:44<34:54, 27.93s/trial, best loss: -0.5711] 26%|██▌       | 26/100 [15:04<31:32, 25.57s/trial, best loss: -0.5711] 27%|██▋       | 27/100 [15:32<32:00, 26.31s/trial, best loss: -0.5722] 28%|██▊       | 28/100 [16:19<38:59, 32.49s/trial, best loss: -0.5722] 29%|██▉       | 29/100 [16:42<34:51, 29.46s/trial, best loss: -0.5722] 30%|███       | 30/100 [17:10<34:00, 29.15s/trial, best loss: -0.5722] 31%|███       | 31/100 [17:46<36:02, 31.33s/trial, best loss: -0.5722] 32%|███▏      | 32/100 [18:11<33:12, 29.30s/trial, best loss: -0.5722] 33%|███▎      | 33/100 [18:53<36:48, 32.96s/trial, best loss: -0.5722] 34%|███▍      | 34/100 [19:13<32:12, 29.29s/trial, best loss: -0.5722] 35%|███▌      | 35/100 [19:42<31:37, 29.19s/trial, best loss: -0.5722] 36%|███▌      | 36/100 [20:02<28:13, 26.46s/trial, best loss: -0.5722] 37%|███▋      | 37/100 [20:23<25:49, 24.59s/trial, best loss: -0.5722] 38%|███▊      | 38/100 [20:45<24:50, 24.05s/trial, best loss: -0.5722] 39%|███▉      | 39/100 [21:12<25:13, 24.81s/trial, best loss: -0.5722] 40%|████      | 40/100 [21:52<29:22, 29.38s/trial, best loss: -0.5722] 41%|████      | 41/100 [22:14<26:39, 27.11s/trial, best loss: -0.5722] 42%|████▏     | 42/100 [22:38<25:28, 26.35s/trial, best loss: -0.5722] 43%|████▎     | 43/100 [23:03<24:38, 25.94s/trial, best loss: -0.5722] 44%|████▍     | 44/100 [23:35<25:52, 27.71s/trial, best loss: -0.5722] 45%|████▌     | 45/100 [24:13<28:19, 30.89s/trial, best loss: -0.5722] 46%|████▌     | 46/100 [24:42<27:14, 30.27s/trial, best loss: -0.5722] 47%|████▋     | 47/100 [25:20<28:37, 32.41s/trial, best loss: -0.5722] 48%|████▊     | 48/100 [25:50<27:28, 31.70s/trial, best loss: -0.5722] 49%|████▉     | 49/100 [26:36<30:44, 36.18s/trial, best loss: -0.5722] 50%|█████     | 50/100 [27:10<29:27, 35.34s/trial, best loss: -0.5722] 51%|█████     | 51/100 [27:40<27:32, 33.72s/trial, best loss: -0.5722] 52%|█████▏    | 52/100 [28:09<25:56, 32.43s/trial, best loss: -0.5722] 53%|█████▎    | 53/100 [28:37<24:16, 30.99s/trial, best loss: -0.5722] 54%|█████▍    | 54/100 [29:20<26:40, 34.80s/trial, best loss: -0.5722] 55%|█████▌    | 55/100 [30:11<29:36, 39.49s/trial, best loss: -0.5722] 56%|█████▌    | 56/100 [30:33<25:02, 34.16s/trial, best loss: -0.5722] 57%|█████▋    | 57/100 [31:03<23:43, 33.10s/trial, best loss: -0.5722] 58%|█████▊    | 58/100 [31:36<23:08, 33.05s/trial, best loss: -0.5722] 59%|█████▉    | 59/100 [32:15<23:49, 34.86s/trial, best loss: -0.5722] 60%|██████    | 60/100 [32:56<24:23, 36.59s/trial, best loss: -0.5722] 61%|██████    | 61/100 [33:36<24:32, 37.76s/trial, best loss: -0.5722] 62%|██████▏   | 62/100 [34:02<21:37, 34.14s/trial, best loss: -0.5722] 63%|██████▎   | 63/100 [34:28<19:37, 31.82s/trial, best loss: -0.5722] 64%|██████▍   | 64/100 [35:07<20:22, 33.95s/trial, best loss: -0.5722] 65%|██████▌   | 65/100 [35:37<19:00, 32.58s/trial, best loss: -0.5722] 66%|██████▌   | 66/100 [35:58<16:32, 29.20s/trial, best loss: -0.5722] 67%|██████▋   | 67/100 [36:32<16:53, 30.72s/trial, best loss: -0.5722] 68%|██████▊   | 68/100 [37:01<16:01, 30.04s/trial, best loss: -0.5722] 69%|██████▉   | 69/100 [37:23<14:14, 27.57s/trial, best loss: -0.5722] 70%|███████   | 70/100 [37:54<14:21, 28.71s/trial, best loss: -0.5722] 71%|███████   | 71/100 [38:21<13:35, 28.11s/trial, best loss: -0.5722] 72%|███████▏  | 72/100 [38:49<13:08, 28.17s/trial, best loss: -0.5722] 73%|███████▎  | 73/100 [39:15<12:25, 27.61s/trial, best loss: -0.5722] 74%|███████▍  | 74/100 [39:57<13:47, 31.84s/trial, best loss: -0.5722] 75%|███████▌  | 75/100 [40:27<13:02, 31.32s/trial, best loss: -0.5722] 76%|███████▌  | 76/100 [40:54<12:02, 30.11s/trial, best loss: -0.5722] 77%|███████▋  | 77/100 [41:34<12:36, 32.89s/trial, best loss: -0.5722] 78%|███████▊  | 78/100 [41:59<11:14, 30.64s/trial, best loss: -0.5722] 79%|███████▉  | 79/100 [42:21<09:51, 28.15s/trial, best loss: -0.5722] 80%|████████  | 80/100 [42:40<08:27, 25.37s/trial, best loss: -0.5722] 81%|████████  | 81/100 [43:15<08:53, 28.08s/trial, best loss: -0.5722] 82%|████████▏ | 82/100 [43:43<08:28, 28.23s/trial, best loss: -0.5722] 83%|████████▎ | 83/100 [44:07<07:37, 26.90s/trial, best loss: -0.5722] 84%|████████▍ | 84/100 [44:27<06:36, 24.78s/trial, best loss: -0.5722] 85%|████████▌ | 85/100 [44:57<06:34, 26.31s/trial, best loss: -0.5722] 86%|████████▌ | 86/100 [45:53<08:12, 35.16s/trial, best loss: -0.5722] 87%|████████▋ | 87/100 [46:46<08:46, 40.52s/trial, best loss: -0.5722] 88%|████████▊ | 88/100 [47:34<08:32, 42.71s/trial, best loss: -0.5722] 89%|████████▉ | 89/100 [48:17<07:51, 42.87s/trial, best loss: -0.5722] 90%|█████████ | 90/100 [48:53<06:47, 40.78s/trial, best loss: -0.5722] 91%|█████████ | 91/100 [49:49<06:49, 45.46s/trial, best loss: -0.5722] 92%|█████████▏| 92/100 [50:26<05:43, 42.95s/trial, best loss: -0.5722] 93%|█████████▎| 93/100 [50:58<04:36, 39.56s/trial, best loss: -0.5722] 94%|█████████▍| 94/100 [51:27<03:38, 36.38s/trial, best loss: -0.5722] 95%|█████████▌| 95/100 [52:29<03:40, 44.17s/trial, best loss: -0.5722] 96%|█████████▌| 96/100 [52:48<02:26, 36.61s/trial, best loss: -0.5722] 97%|█████████▋| 97/100 [53:22<01:47, 35.68s/trial, best loss: -0.5722] 98%|█████████▊| 98/100 [53:57<01:10, 35.47s/trial, best loss: -0.5722] 99%|█████████▉| 99/100 [54:26<00:33, 33.64s/trial, best loss: -0.5722]100%|██████████| 100/100 [54:59<00:00, 33.43s/trial, best loss: -0.5722]100%|██████████| 100/100 [54:59<00:00, 32.99s/trial, best loss: -0.5722]

최적화 완료. 최적 파라미터: {'colsample_bytree': 0.9998832589057977, 'gamma': 1.1284338309478381, 'learning_rate': 0.07547053757720854, 'max_depth': 11.0, 'min_child_weight': 3.0, 'reg_alpha': 0.005163550196038334, 'reg_lambda': 0.7838372117209551, 'subsample': 0.6965117137201219}
최적 CSI 점수: 0.5722 (loss: -0.5722)

최적화 과정 요약:
  - 총 시도 횟수: 100
  - 성공한 시도: 100
  - 최초 CSI: 0.5629
  - 최종 CSI: 0.5570
  - 최고 CSI: 0.5722
  - 최저 CSI: 0.5455
  - 평균 CSI: 0.5620

최적화 Trials 객체가 ../optimization_history/xgb_pure_seoul_trials.pkl에 저장되었습니다.
최종 모델 학습 시작...
Fold 1 학습 중... (학습 연도: [2018, 2019], 검증 연도: 2020)
Fold 1 검증 CSI: 0.4971
Fold 2 학습 중... (학습 연도: [2018, 2020], 검증 연도: 2019)
Fold 2 검증 CSI: 0.6238
Fold 3 학습 중... (학습 연도: [2019, 2020], 검증 연도: 2018)
Fold 3 검증 CSI: 0.5957
모델 저장 중...
모델이 ../save_model/xgb_optima/xgb_pure_seoul.pkl에 저장되었습니다.

✓ 완료: xgb_pure/XGB_pure_seoul.py (소요 시간: 3329초)

./run_xgb_pure.sh: line 84: unexpected EOF while looking for matching `"'
