nohup: ignoring input
/bin/bash: /opt/conda/lib/libtinfo.so.6: no version information available (required by /bin/bash)
==========================================
XGB Pure 파일 실행 시작
시작 시간: 2025-12-27 02:09:40
GPU: 0번 (os.environ['CUDA_VISIBLE_DEVICES'] = '0')
==========================================

----------------------------------------
실행 중: xgb_pure/XGB_pure_busan.py
시작 시간: 2025-12-27 02:09:40
----------------------------------------
데이터 로딩 중...
하이퍼파라미터 최적화 시작...
  0%|          | 0/100 [00:00<?, ?trial/s, best loss=?]  1%|          | 1/100 [00:27<44:54, 27.21s/trial, best loss: -0.4829]  2%|▏         | 2/100 [01:03<53:26, 32.72s/trial, best loss: -0.4829]  3%|▎         | 3/100 [01:24<43:59, 27.21s/trial, best loss: -0.4845]  4%|▍         | 4/100 [02:15<58:21, 36.47s/trial, best loss: -0.4845]  5%|▌         | 5/100 [02:52<58:14, 36.78s/trial, best loss: -0.4864]  6%|▌         | 6/100 [03:21<53:46, 34.32s/trial, best loss: -0.4864]  7%|▋         | 7/100 [03:53<52:00, 33.56s/trial, best loss: -0.4864]  8%|▊         | 8/100 [04:13<44:44, 29.18s/trial, best loss: -0.4864]  9%|▉         | 9/100 [05:07<55:55, 36.87s/trial, best loss: -0.4864] 10%|█         | 10/100 [05:57<1:01:12, 40.81s/trial, best loss: -0.4864] 11%|█         | 11/100 [06:52<1:07:16, 45.36s/trial, best loss: -0.4864] 12%|█▏        | 12/100 [07:29<1:02:40, 42.74s/trial, best loss: -0.4864] 13%|█▎        | 13/100 [08:10<1:01:16, 42.26s/trial, best loss: -0.4864] 14%|█▍        | 14/100 [08:50<59:22, 41.42s/trial, best loss: -0.4864]   15%|█▌        | 15/100 [09:15<51:45, 36.53s/trial, best loss: -0.4864] 16%|█▌        | 16/100 [09:43<47:29, 33.92s/trial, best loss: -0.4864] 17%|█▋        | 17/100 [10:08<43:27, 31.41s/trial, best loss: -0.4916] 18%|█▊        | 18/100 [10:32<39:43, 29.07s/trial, best loss: -0.4916] 19%|█▉        | 19/100 [11:12<43:44, 32.40s/trial, best loss: -0.4916] 20%|██        | 20/100 [11:54<46:54, 35.19s/trial, best loss: -0.4916] 21%|██        | 21/100 [12:25<44:48, 34.04s/trial, best loss: -0.4916] 22%|██▏       | 22/100 [13:36<58:26, 44.96s/trial, best loss: -0.4916] 23%|██▎       | 23/100 [14:35<1:03:03, 49.14s/trial, best loss: -0.4916] 24%|██▍       | 24/100 [15:21<1:01:16, 48.38s/trial, best loss: -0.4916] 25%|██▌       | 25/100 [15:51<53:39, 42.93s/trial, best loss: -0.4916]   26%|██▌       | 26/100 [16:29<50:54, 41.27s/trial, best loss: -0.4916] 27%|██▋       | 27/100 [16:53<44:04, 36.23s/trial, best loss: -0.4916] 28%|██▊       | 28/100 [17:40<47:19, 39.43s/trial, best loss: -0.4916] 29%|██▉       | 29/100 [18:08<42:39, 36.05s/trial, best loss: -0.4916] 30%|███       | 30/100 [18:38<39:58, 34.26s/trial, best loss: -0.4916] 31%|███       | 31/100 [19:03<35:55, 31.24s/trial, best loss: -0.4916] 32%|███▏      | 32/100 [19:40<37:32, 33.12s/trial, best loss: -0.4916] 33%|███▎      | 33/100 [20:11<36:09, 32.37s/trial, best loss: -0.4916] 34%|███▍      | 34/100 [20:41<34:58, 31.80s/trial, best loss: -0.4916] 35%|███▌      | 35/100 [21:24<37:56, 35.02s/trial, best loss: -0.4916] 36%|███▌      | 36/100 [22:08<40:20, 37.83s/trial, best loss: -0.4916] 37%|███▋      | 37/100 [22:46<39:48, 37.91s/trial, best loss: -0.4916] 38%|███▊      | 38/100 [23:26<39:40, 38.40s/trial, best loss: -0.4916] 39%|███▉      | 39/100 [23:59<37:37, 37.00s/trial, best loss: -0.4916] 40%|████      | 40/100 [24:27<34:12, 34.21s/trial, best loss: -0.4916] 41%|████      | 41/100 [25:21<39:26, 40.11s/trial, best loss: -0.4916] 42%|████▏     | 42/100 [25:58<37:49, 39.13s/trial, best loss: -0.4916] 43%|████▎     | 43/100 [26:34<36:24, 38.33s/trial, best loss: -0.4916] 44%|████▍     | 44/100 [27:07<34:04, 36.50s/trial, best loss: -0.4916] 45%|████▌     | 45/100 [27:29<29:43, 32.43s/trial, best loss: -0.4916] 46%|████▌     | 46/100 [28:19<33:44, 37.49s/trial, best loss: -0.4916] 47%|████▋     | 47/100 [29:00<34:05, 38.60s/trial, best loss: -0.4916] 48%|████▊     | 48/100 [29:39<33:36, 38.78s/trial, best loss: -0.4916] 49%|████▉     | 49/100 [30:04<29:31, 34.74s/trial, best loss: -0.4916] 50%|█████     | 50/100 [30:35<27:53, 33.48s/trial, best loss: -0.4916] 51%|█████     | 51/100 [31:16<29:09, 35.70s/trial, best loss: -0.4916] 52%|█████▏    | 52/100 [31:42<26:20, 32.92s/trial, best loss: -0.4916] 53%|█████▎    | 53/100 [32:11<24:47, 31.64s/trial, best loss: -0.4916] 54%|█████▍    | 54/100 [32:43<24:17, 31.68s/trial, best loss: -0.4916] 55%|█████▌    | 55/100 [33:15<23:47, 31.73s/trial, best loss: -0.4916] 56%|█████▌    | 56/100 [33:48<23:40, 32.29s/trial, best loss: -0.4916] 57%|█████▋    | 57/100 [34:17<22:23, 31.25s/trial, best loss: -0.4916] 58%|█████▊    | 58/100 [35:20<28:35, 40.84s/trial, best loss: -0.4916] 59%|█████▉    | 59/100 [35:54<26:31, 38.82s/trial, best loss: -0.4916] 60%|██████    | 60/100 [36:22<23:37, 35.44s/trial, best loss: -0.4916] 61%|██████    | 61/100 [37:03<24:06, 37.10s/trial, best loss: -0.4916] 62%|██████▏   | 62/100 [37:48<24:57, 39.41s/trial, best loss: -0.4916] 63%|██████▎   | 63/100 [38:34<25:37, 41.55s/trial, best loss: -0.4916] 64%|██████▍   | 64/100 [39:03<22:42, 37.84s/trial, best loss: -0.4916] 65%|██████▌   | 65/100 [39:40<21:54, 37.57s/trial, best loss: -0.4916] 66%|██████▌   | 66/100 [40:12<20:12, 35.66s/trial, best loss: -0.4916] 67%|██████▋   | 67/100 [40:44<19:04, 34.69s/trial, best loss: -0.4916] 68%|██████▊   | 68/100 [41:14<17:49, 33.41s/trial, best loss: -0.4916] 69%|██████▉   | 69/100 [41:46<17:03, 33.01s/trial, best loss: -0.4916] 70%|███████   | 70/100 [42:32<18:19, 36.65s/trial, best loss: -0.4916] 71%|███████   | 71/100 [43:09<17:52, 36.98s/trial, best loss: -0.4916] 72%|███████▏  | 72/100 [43:49<17:36, 37.72s/trial, best loss: -0.4916] 73%|███████▎  | 73/100 [44:35<18:06, 40.23s/trial, best loss: -0.4916] 74%|███████▍  | 74/100 [45:03<15:51, 36.58s/trial, best loss: -0.4916] 75%|███████▌  | 75/100 [45:46<16:04, 38.58s/trial, best loss: -0.4916] 76%|███████▌  | 76/100 [46:18<14:33, 36.40s/trial, best loss: -0.4948] 77%|███████▋  | 77/100 [46:55<14:02, 36.62s/trial, best loss: -0.4948] 78%|███████▊  | 78/100 [47:29<13:12, 36.02s/trial, best loss: -0.4949] 79%|███████▉  | 79/100 [47:55<11:31, 32.92s/trial, best loss: -0.4949] 80%|████████  | 80/100 [48:23<10:29, 31.47s/trial, best loss: -0.4949] 81%|████████  | 81/100 [48:52<09:43, 30.69s/trial, best loss: -0.4949] 82%|████████▏ | 82/100 [49:21<09:03, 30.22s/trial, best loss: -0.4949] 83%|████████▎ | 83/100 [50:02<09:28, 33.47s/trial, best loss: -0.4949] 84%|████████▍ | 84/100 [50:44<09:36, 36.02s/trial, best loss: -0.4949] 85%|████████▌ | 85/100 [51:32<09:53, 39.58s/trial, best loss: -0.4949] 86%|████████▌ | 86/100 [52:22<09:58, 42.74s/trial, best loss: -0.4949] 87%|████████▋ | 87/100 [53:10<09:35, 44.26s/trial, best loss: -0.4949] 88%|████████▊ | 88/100 [53:54<08:50, 44.18s/trial, best loss: -0.4949] 89%|████████▉ | 89/100 [54:28<07:34, 41.31s/trial, best loss: -0.4949] 90%|█████████ | 90/100 [55:13<07:03, 42.38s/trial, best loss: -0.4949] 91%|█████████ | 91/100 [56:04<06:43, 44.80s/trial, best loss: -0.4949] 92%|█████████▏| 92/100 [56:47<05:53, 44.22s/trial, best loss: -0.4949] 93%|█████████▎| 93/100 [57:32<05:11, 44.45s/trial, best loss: -0.4949] 94%|█████████▍| 94/100 [58:13<04:20, 43.40s/trial, best loss: -0.4949] 95%|█████████▌| 95/100 [58:47<03:23, 40.65s/trial, best loss: -0.4949] 96%|█████████▌| 96/100 [59:28<02:43, 40.79s/trial, best loss: -0.4949] 97%|█████████▋| 97/100 [1:00:41<02:31, 50.45s/trial, best loss: -0.4949] 98%|█████████▊| 98/100 [1:01:18<01:33, 46.56s/trial, best loss: -0.4949] 99%|█████████▉| 99/100 [1:02:08<00:47, 47.33s/trial, best loss: -0.4949]100%|██████████| 100/100 [1:03:01<00:00, 49.15s/trial, best loss: -0.4949]100%|██████████| 100/100 [1:03:01<00:00, 37.81s/trial, best loss: -0.4949]

최적화 완료. 최적 파라미터: {'colsample_bytree': 0.8651175745135303, 'gamma': 2.0220518303820976, 'learning_rate': 0.04196437449161767, 'max_depth': 7.0, 'min_child_weight': 17.0, 'reg_alpha': 0.9213159636887744, 'reg_lambda': 0.9407811453878014, 'subsample': 0.7200034080497129}
최적 CSI 점수: 0.4949 (loss: -0.4949)

최적화 과정 요약:
  - 총 시도 횟수: 100
  - 성공한 시도: 100
  - 최초 CSI: 0.4829
  - 최종 CSI: 0.4915
  - 최고 CSI: 0.4949
  - 최저 CSI: 0.4639
  - 평균 CSI: 0.4820

최적화 Trials 객체가 /workspace/visibility_prediction/Analysis_code/optimization_history/xgb_pure_busan_trials.pkl에 저장되었습니다.
최종 모델 학습 시작...
Fold 1 학습 중... (학습 연도: [2018, 2019], 검증 연도: 2020)
Fold 1 검증 CSI: 0.4090
Fold 2 학습 중... (학습 연도: [2018, 2020], 검증 연도: 2019)
Fold 2 검증 CSI: 0.5284
Fold 3 학습 중... (학습 연도: [2019, 2020], 검증 연도: 2018)
Fold 3 검증 CSI: 0.5474
모델 저장 중...
모델이 /workspace/visibility_prediction/Analysis_code/save_model/xgb_optima/xgb_pure_busan.pkl에 저장되었습니다.

✓ 완료: xgb_pure/XGB_pure_busan.py (소요 시간: 3823초)

----------------------------------------
실행 중: xgb_pure/XGB_pure_daegu.py
시작 시간: 2025-12-27 03:13:23
----------------------------------------
데이터 로딩 중...
하이퍼파라미터 최적화 시작...
  0%|          | 0/100 [00:00<?, ?trial/s, best loss=?]  1%|          | 1/100 [00:27<46:02, 27.91s/trial, best loss: -0.3762]  2%|▏         | 2/100 [01:15<1:04:02, 39.21s/trial, best loss: -0.3996]  3%|▎         | 3/100 [01:50<1:00:41, 37.54s/trial, best loss: -0.3996]  4%|▍         | 4/100 [02:17<53:32, 33.46s/trial, best loss: -0.3996]    5%|▌         | 5/100 [03:21<1:10:18, 44.41s/trial, best loss: -0.3996]  6%|▌         | 6/100 [04:33<1:23:59, 53.62s/trial, best loss: -0.3996]  7%|▋         | 7/100 [05:37<1:28:46, 57.28s/trial, best loss: -0.3996]  8%|▊         | 8/100 [06:13<1:17:02, 50.25s/trial, best loss: -0.4127]  9%|▉         | 9/100 [06:42<1:06:29, 43.84s/trial, best loss: -0.4127] 10%|█         | 10/100 [07:14<1:00:10, 40.12s/trial, best loss: -0.4127] 11%|█         | 11/100 [07:47<56:05, 37.81s/trial, best loss: -0.4132]   12%|█▏        | 12/100 [08:37<1:01:05, 41.65s/trial, best loss: -0.4132] 13%|█▎        | 13/100 [08:59<51:49, 35.74s/trial, best loss: -0.4132]   14%|█▍        | 14/100 [09:33<50:17, 35.09s/trial, best loss: -0.4145] 15%|█▌        | 15/100 [10:38<1:02:29, 44.12s/trial, best loss: -0.4266] 16%|█▌        | 16/100 [11:20<1:00:57, 43.54s/trial, best loss: -0.4266] 17%|█▋        | 17/100 [11:53<55:51, 40.37s/trial, best loss: -0.4266]   18%|█▊        | 18/100 [12:22<50:16, 36.78s/trial, best loss: -0.4266] 19%|█▉        | 19/100 [13:24<1:00:12, 44.59s/trial, best loss: -0.4266] 20%|██        | 20/100 [14:21<1:04:26, 48.33s/trial, best loss: -0.4266] 21%|██        | 21/100 [15:31<1:12:00, 54.69s/trial, best loss: -0.4266] 22%|██▏       | 22/100 [17:05<1:26:30, 66.54s/trial, best loss: -0.4266] 23%|██▎       | 23/100 [17:43<1:14:20, 57.93s/trial, best loss: -0.4366] 24%|██▍       | 24/100 [18:12<1:02:32, 49.37s/trial, best loss: -0.4366] 25%|██▌       | 25/100 [18:50<57:29, 45.99s/trial, best loss: -0.4371]   26%|██▌       | 26/100 [19:30<54:25, 44.13s/trial, best loss: -0.4371] 27%|██▋       | 27/100 [20:15<54:06, 44.47s/trial, best loss: -0.4371] 28%|██▊       | 28/100 [21:14<58:21, 48.64s/trial, best loss: -0.4371] 29%|██▉       | 29/100 [21:47<51:59, 43.94s/trial, best loss: -0.4371] 30%|███       | 30/100 [22:39<54:04, 46.35s/trial, best loss: -0.4371] 31%|███       | 31/100 [23:17<50:22, 43.81s/trial, best loss: -0.4371] 32%|███▏      | 32/100 [23:59<48:59, 43.23s/trial, best loss: -0.4371] 33%|███▎      | 33/100 [24:43<48:48, 43.70s/trial, best loss: -0.4371] 34%|███▍      | 34/100 [25:35<50:45, 46.15s/trial, best loss: -0.4371] 35%|███▌      | 35/100 [26:25<51:06, 47.17s/trial, best loss: -0.4371] 36%|███▌      | 36/100 [27:31<56:24, 52.88s/trial, best loss: -0.4371] 37%|███▋      | 37/100 [28:20<54:22, 51.78s/trial, best loss: -0.4371] 38%|███▊      | 38/100 [28:48<46:03, 44.57s/trial, best loss: -0.4371] 39%|███▉      | 39/100 [29:35<45:55, 45.17s/trial, best loss: -0.4371] 40%|████      | 40/100 [30:13<43:10, 43.18s/trial, best loss: -0.4371] 41%|████      | 41/100 [30:36<36:22, 37.00s/trial, best loss: -0.4371] 42%|████▏     | 42/100 [31:08<34:22, 35.55s/trial, best loss: -0.4371] 43%|████▎     | 43/100 [31:53<36:27, 38.37s/trial, best loss: -0.4371] 44%|████▍     | 44/100 [32:45<39:38, 42.48s/trial, best loss: -0.4371] 45%|████▌     | 45/100 [33:26<38:28, 41.97s/trial, best loss: -0.4371] 46%|████▌     | 46/100 [34:11<38:43, 43.02s/trial, best loss: -0.4371] 47%|████▋     | 47/100 [34:39<33:52, 38.35s/trial, best loss: -0.4371] 48%|████▊     | 48/100 [35:22<34:27, 39.76s/trial, best loss: -0.4371] 49%|████▉     | 49/100 [35:52<31:29, 37.04s/trial, best loss: -0.4371] 50%|█████     | 50/100 [36:31<31:15, 37.51s/trial, best loss: -0.4371] 51%|█████     | 51/100 [37:30<35:56, 44.01s/trial, best loss: -0.4371] 52%|█████▏    | 52/100 [38:31<39:12, 49.01s/trial, best loss: -0.4371] 53%|█████▎    | 53/100 [38:56<32:47, 41.87s/trial, best loss: -0.4371] 54%|█████▍    | 54/100 [39:54<35:48, 46.72s/trial, best loss: -0.4371] 55%|█████▌    | 55/100 [40:24<31:20, 41.79s/trial, best loss: -0.4371] 56%|█████▌    | 56/100 [41:15<32:41, 44.58s/trial, best loss: -0.4371] 57%|█████▋    | 57/100 [42:10<34:07, 47.62s/trial, best loss: -0.4371] 58%|█████▊    | 58/100 [43:28<39:37, 56.62s/trial, best loss: -0.4371] 59%|█████▉    | 59/100 [44:04<34:34, 50.59s/trial, best loss: -0.4371] 60%|██████    | 60/100 [44:44<31:33, 47.34s/trial, best loss: -0.4371] 61%|██████    | 61/100 [45:20<28:28, 43.82s/trial, best loss: -0.4371] 62%|██████▏   | 62/100 [46:10<29:01, 45.84s/trial, best loss: -0.4371] 63%|██████▎   | 63/100 [46:41<25:35, 41.49s/trial, best loss: -0.4371] 64%|██████▍   | 64/100 [47:29<25:53, 43.16s/trial, best loss: -0.4371] 65%|██████▌   | 65/100 [48:17<26:09, 44.85s/trial, best loss: -0.4371] 66%|██████▌   | 66/100 [48:57<24:34, 43.37s/trial, best loss: -0.4371] 67%|██████▋   | 67/100 [49:40<23:43, 43.14s/trial, best loss: -0.4389] 68%|██████▊   | 68/100 [50:24<23:13, 43.53s/trial, best loss: -0.4389] 69%|██████▉   | 69/100 [51:06<22:14, 43.04s/trial, best loss: -0.4389] 70%|███████   | 70/100 [52:19<25:57, 51.93s/trial, best loss: -0.4409] 71%|███████   | 71/100 [53:33<28:23, 58.74s/trial, best loss: -0.4409] 72%|███████▏  | 72/100 [54:47<29:26, 63.09s/trial, best loss: -0.4409] 73%|███████▎  | 73/100 [55:58<29:29, 65.54s/trial, best loss: -0.4409] 74%|███████▍  | 74/100 [56:59<27:50, 64.24s/trial, best loss: -0.4409] 75%|███████▌  | 75/100 [57:59<26:11, 62.87s/trial, best loss: -0.4409] 76%|███████▌  | 76/100 [59:32<28:48, 72.02s/trial, best loss: -0.4409] 77%|███████▋  | 77/100 [1:00:13<24:00, 62.65s/trial, best loss: -0.4409] 78%|███████▊  | 78/100 [1:01:33<24:51, 67.82s/trial, best loss: -0.4409] 79%|███████▉  | 79/100 [1:02:46<24:18, 69.44s/trial, best loss: -0.4409] 80%|████████  | 80/100 [1:03:25<20:06, 60.35s/trial, best loss: -0.4409] 81%|████████  | 81/100 [1:04:25<19:06, 60.32s/trial, best loss: -0.4409] 82%|████████▏ | 82/100 [1:05:48<20:05, 66.98s/trial, best loss: -0.4409] 83%|████████▎ | 83/100 [1:06:58<19:11, 67.74s/trial, best loss: -0.4409] 84%|████████▍ | 84/100 [1:08:26<19:41, 73.82s/trial, best loss: -0.4409] 85%|████████▌ | 85/100 [1:09:26<17:25, 69.71s/trial, best loss: -0.4409] 86%|████████▌ | 86/100 [1:10:10<14:27, 61.97s/trial, best loss: -0.4409] 87%|████████▋ | 87/100 [1:11:09<13:14, 61.10s/trial, best loss: -0.4409] 88%|████████▊ | 88/100 [1:11:54<11:17, 56.49s/trial, best loss: -0.4409] 89%|████████▉ | 89/100 [1:12:53<10:27, 57.04s/trial, best loss: -0.4409] 90%|█████████ | 90/100 [1:13:37<08:53, 53.36s/trial, best loss: -0.4409] 91%|█████████ | 91/100 [1:14:33<08:07, 54.14s/trial, best loss: -0.4409] 92%|█████████▏| 92/100 [1:15:36<07:33, 56.70s/trial, best loss: -0.4409] 93%|█████████▎| 93/100 [1:16:51<07:15, 62.28s/trial, best loss: -0.4409] 94%|█████████▍| 94/100 [1:17:34<05:38, 56.46s/trial, best loss: -0.4409] 95%|█████████▌| 95/100 [1:18:15<04:18, 51.67s/trial, best loss: -0.4409] 96%|█████████▌| 96/100 [1:19:01<03:20, 50.09s/trial, best loss: -0.4409] 97%|█████████▋| 97/100 [1:19:48<02:27, 49.12s/trial, best loss: -0.4409] 98%|█████████▊| 98/100 [1:20:35<01:36, 48.38s/trial, best loss: -0.4409] 99%|█████████▉| 99/100 [1:21:17<00:46, 46.65s/trial, best loss: -0.4409]100%|██████████| 100/100 [1:22:24<00:00, 52.76s/trial, best loss: -0.4409]100%|██████████| 100/100 [1:22:24<00:00, 49.45s/trial, best loss: -0.4409]

최적화 완료. 최적 파라미터: {'colsample_bytree': 0.8800494992202731, 'gamma': 0.28651615767316957, 'learning_rate': 0.025526450870185433, 'max_depth': 3.0, 'min_child_weight': 5.0, 'reg_alpha': 0.6787273055071508, 'reg_lambda': 0.6641153401816423, 'subsample': 0.7222783789369407}
최적 CSI 점수: 0.4409 (loss: -0.4409)

최적화 과정 요약:
  - 총 시도 횟수: 100
  - 성공한 시도: 100
  - 최초 CSI: 0.3762
  - 최종 CSI: 0.4260
  - 최고 CSI: 0.4409
  - 최저 CSI: 0.3762
  - 평균 CSI: 0.4143

최적화 Trials 객체가 /workspace/visibility_prediction/Analysis_code/optimization_history/xgb_pure_daegu_trials.pkl에 저장되었습니다.
최종 모델 학습 시작...
Fold 1 학습 중... (학습 연도: [2018, 2019], 검증 연도: 2020)
Fold 1 검증 CSI: 0.4967
Fold 2 학습 중... (학습 연도: [2018, 2020], 검증 연도: 2019)
Fold 2 검증 CSI: 0.4603
Fold 3 학습 중... (학습 연도: [2019, 2020], 검증 연도: 2018)
Fold 3 검증 CSI: 0.3656
모델 저장 중...
모델이 /workspace/visibility_prediction/Analysis_code/save_model/xgb_optima/xgb_pure_daegu.pkl에 저장되었습니다.

✓ 완료: xgb_pure/XGB_pure_daegu.py (소요 시간: 5024초)

==========================================
XGB Pure 파일 실행 완료
종료 시간: 2025-12-27 04:37:07
총 소요 시간: 2시간 27분 27초
성공: 2개
실패: 0개
==========================================
