nohup: ignoring input
/bin/bash: /opt/conda/lib/libtinfo.so.6: no version information available (required by /bin/bash)
==========================================
LGB SMOTENC CTGAN10000 파일 실행 시작
시작 시간: 2026-01-07 11:47:18
GPU: 1번 (CUDA_VISIBLE_DEVICES=1)
==========================================

----------------------------------------
실행 중: lgb_smotenc_ctgan10000/LGB_smotenc_ctgan10000_busan.py
시작 시간: 2026-01-07 11:47:18
----------------------------------------
데이터 로딩 중...
데이터 전처리 중...
하이퍼파라미터 최적화 시작...
  0%|          | 0/100 [00:00<?, ?trial/s, best loss=?]  1%|          | 1/100 [00:30<50:36, 30.67s/trial, best loss: -0.4514]  2%|▏         | 2/100 [01:01<50:16, 30.78s/trial, best loss: -0.4535]  3%|▎         | 3/100 [01:30<48:36, 30.06s/trial, best loss: -0.4535]  4%|▍         | 4/100 [01:58<46:49, 29.27s/trial, best loss: -0.4535]  5%|▌         | 5/100 [02:24<44:20, 28.01s/trial, best loss: -0.4569]  6%|▌         | 6/100 [02:53<44:36, 28.47s/trial, best loss: -0.4569]  7%|▋         | 7/100 [03:19<42:28, 27.41s/trial, best loss: -0.4569]  8%|▊         | 8/100 [04:00<48:46, 31.81s/trial, best loss: -0.4569]  9%|▉         | 9/100 [04:36<50:15, 33.14s/trial, best loss: -0.4569] 10%|█         | 10/100 [05:06<48:21, 32.24s/trial, best loss: -0.4575] 11%|█         | 11/100 [05:57<56:02, 37.78s/trial, best loss: -0.4575] 12%|█▏        | 12/100 [06:20<48:50, 33.30s/trial, best loss: -0.4633] 13%|█▎        | 13/100 [06:47<45:36, 31.45s/trial, best loss: -0.4633] 14%|█▍        | 14/100 [07:24<47:34, 33.20s/trial, best loss: -0.4633] 15%|█▌        | 15/100 [08:01<48:44, 34.41s/trial, best loss: -0.4633] 16%|█▌        | 16/100 [08:45<52:03, 37.18s/trial, best loss: -0.4633] 17%|█▋        | 17/100 [09:35<56:59, 41.19s/trial, best loss: -0.4633] 18%|█▊        | 18/100 [09:59<49:05, 35.92s/trial, best loss: -0.4633] 19%|█▉        | 19/100 [10:28<45:39, 33.83s/trial, best loss: -0.4633] 20%|██        | 20/100 [11:05<46:33, 34.91s/trial, best loss: -0.4633] 21%|██        | 21/100 [11:26<40:25, 30.70s/trial, best loss: -0.4633] 22%|██▏       | 22/100 [11:52<37:53, 29.15s/trial, best loss: -0.4633] 23%|██▎       | 23/100 [12:19<36:32, 28.47s/trial, best loss: -0.4633] 24%|██▍       | 24/100 [13:23<49:48, 39.33s/trial, best loss: -0.4633] 25%|██▌       | 25/100 [14:04<49:31, 39.62s/trial, best loss: -0.4633] 26%|██▌       | 26/100 [14:54<52:55, 42.92s/trial, best loss: -0.4633] 27%|██▋       | 27/100 [15:23<46:52, 38.53s/trial, best loss: -0.4633] 28%|██▊       | 28/100 [15:49<42:00, 35.01s/trial, best loss: -0.4633] 29%|██▉       | 29/100 [16:25<41:36, 35.17s/trial, best loss: -0.4633] 30%|███       | 30/100 [16:49<37:11, 31.87s/trial, best loss: -0.4633] 31%|███       | 31/100 [17:34<41:10, 35.80s/trial, best loss: -0.4633] 32%|███▏      | 32/100 [18:04<38:33, 34.02s/trial, best loss: -0.4633] 33%|███▎      | 33/100 [18:43<39:41, 35.55s/trial, best loss: -0.4633] 34%|███▍      | 34/100 [19:44<47:29, 43.17s/trial, best loss: -0.4633] 35%|███▌      | 35/100 [20:12<41:55, 38.70s/trial, best loss: -0.4633] 36%|███▌      | 36/100 [20:52<41:29, 38.89s/trial, best loss: -0.4633] 37%|███▋      | 37/100 [21:19<37:06, 35.34s/trial, best loss: -0.4633] 38%|███▊      | 38/100 [22:03<39:24, 38.14s/trial, best loss: -0.4633] 39%|███▉      | 39/100 [22:34<36:30, 35.91s/trial, best loss: -0.4633] 40%|████      | 40/100 [23:33<42:52, 42.88s/trial, best loss: -0.4633] 41%|████      | 41/100 [23:58<36:48, 37.43s/trial, best loss: -0.4633] 42%|████▏     | 42/100 [24:28<34:06, 35.29s/trial, best loss: -0.4633] 43%|████▎     | 43/100 [25:10<35:25, 37.29s/trial, best loss: -0.4633] 44%|████▍     | 44/100 [25:47<34:32, 37.02s/trial, best loss: -0.4633] 45%|████▌     | 45/100 [26:11<30:35, 33.37s/trial, best loss: -0.4633] 46%|████▌     | 46/100 [26:45<30:09, 33.51s/trial, best loss: -0.4633] 47%|████▋     | 47/100 [27:40<35:12, 39.86s/trial, best loss: -0.4633] 48%|████▊     | 48/100 [29:20<50:18, 58.05s/trial, best loss: -0.4633] 49%|████▉     | 49/100 [29:42<40:06, 47.19s/trial, best loss: -0.4633] 50%|█████     | 50/100 [30:20<36:55, 44.32s/trial, best loss: -0.4633] 51%|█████     | 51/100 [31:26<41:36, 50.94s/trial, best loss: -0.4633] 52%|█████▏    | 52/100 [32:06<38:09, 47.69s/trial, best loss: -0.4633] 53%|█████▎    | 53/100 [32:29<31:32, 40.27s/trial, best loss: -0.4633] 54%|█████▍    | 54/100 [33:29<35:26, 46.23s/trial, best loss: -0.4633] 55%|█████▌    | 55/100 [33:52<29:21, 39.15s/trial, best loss: -0.4633] 56%|█████▌    | 56/100 [34:15<25:12, 34.38s/trial, best loss: -0.4633] 57%|█████▋    | 57/100 [34:34<21:20, 29.78s/trial, best loss: -0.4633] 58%|█████▊    | 58/100 [34:58<19:29, 27.85s/trial, best loss: -0.4633] 59%|█████▉    | 59/100 [35:21<18:00, 26.35s/trial, best loss: -0.4633] 60%|██████    | 60/100 [35:45<17:07, 25.70s/trial, best loss: -0.4633] 61%|██████    | 61/100 [36:13<17:12, 26.48s/trial, best loss: -0.4633] 62%|██████▏   | 62/100 [36:48<18:28, 29.16s/trial, best loss: -0.4633] 63%|██████▎   | 63/100 [37:18<17:58, 29.14s/trial, best loss: -0.4633] 64%|██████▍   | 64/100 [37:53<18:38, 31.06s/trial, best loss: -0.4633] 65%|██████▌   | 65/100 [38:21<17:29, 30.00s/trial, best loss: -0.4633] 66%|██████▌   | 66/100 [39:07<19:43, 34.81s/trial, best loss: -0.4633] 67%|██████▋   | 67/100 [39:41<19:05, 34.73s/trial, best loss: -0.4671] 68%|██████▊   | 68/100 [40:08<17:19, 32.49s/trial, best loss: -0.4671] 69%|██████▉   | 69/100 [40:40<16:40, 32.29s/trial, best loss: -0.4671] 70%|███████   | 70/100 [41:20<17:12, 34.41s/trial, best loss: -0.4671] 71%|███████   | 71/100 [41:59<17:18, 35.81s/trial, best loss: -0.4671] 72%|███████▏  | 72/100 [42:31<16:15, 34.85s/trial, best loss: -0.4671] 73%|███████▎  | 73/100 [43:14<16:47, 37.31s/trial, best loss: -0.4671] 74%|███████▍  | 74/100 [43:45<15:19, 35.36s/trial, best loss: -0.4671] 75%|███████▌  | 75/100 [44:20<14:39, 35.18s/trial, best loss: -0.4671] 76%|███████▌  | 76/100 [44:56<14:09, 35.41s/trial, best loss: -0.4671] 77%|███████▋  | 77/100 [45:32<13:37, 35.55s/trial, best loss: -0.4671] 78%|███████▊  | 78/100 [46:11<13:29, 36.78s/trial, best loss: -0.4671] 79%|███████▉  | 79/100 [46:47<12:42, 36.29s/trial, best loss: -0.4671] 80%|████████  | 80/100 [47:29<12:44, 38.22s/trial, best loss: -0.4671] 81%|████████  | 81/100 [47:56<10:59, 34.70s/trial, best loss: -0.4671] 82%|████████▏ | 82/100 [48:41<11:18, 37.72s/trial, best loss: -0.4671] 83%|████████▎ | 83/100 [49:07<09:44, 34.38s/trial, best loss: -0.4671] 84%|████████▍ | 84/100 [49:35<08:38, 32.39s/trial, best loss: -0.4671] 85%|████████▌ | 85/100 [50:09<08:14, 32.96s/trial, best loss: -0.4671] 86%|████████▌ | 86/100 [50:41<07:37, 32.65s/trial, best loss: -0.4671] 87%|████████▋ | 87/100 [51:07<06:36, 30.48s/trial, best loss: -0.4671] 88%|████████▊ | 88/100 [51:43<06:25, 32.14s/trial, best loss: -0.4671] 89%|████████▉ | 89/100 [52:09<05:33, 30.31s/trial, best loss: -0.4671] 90%|█████████ | 90/100 [52:32<04:43, 28.33s/trial, best loss: -0.4671] 91%|█████████ | 91/100 [53:13<04:48, 32.04s/trial, best loss: -0.4671] 92%|█████████▏| 92/100 [53:42<04:08, 31.03s/trial, best loss: -0.4671] 93%|█████████▎| 93/100 [54:18<03:49, 32.72s/trial, best loss: -0.4671] 94%|█████████▍| 94/100 [54:52<03:18, 33.02s/trial, best loss: -0.4671] 95%|█████████▌| 95/100 [55:34<02:58, 35.62s/trial, best loss: -0.4671] 96%|█████████▌| 96/100 [55:59<02:10, 32.57s/trial, best loss: -0.4671] 97%|█████████▋| 97/100 [56:25<01:31, 30.62s/trial, best loss: -0.4671] 98%|█████████▊| 98/100 [56:56<01:01, 30.70s/trial, best loss: -0.4671] 99%|█████████▉| 99/100 [57:40<00:34, 34.58s/trial, best loss: -0.4671]100%|██████████| 100/100 [58:13<00:00, 34.12s/trial, best loss: -0.4671]100%|██████████| 100/100 [58:13<00:00, 34.93s/trial, best loss: -0.4671]
최적화 완료. 최적 파라미터: {'colsample_bytree': 0.6555796649499132, 'learning_rate': 0.05502227678581559, 'max_depth': 13.0, 'min_child_weight': 10.0, 'num_leaves': 127.0, 'reg_alpha': 0.359578277687443, 'reg_lambda': 0.4149933330373314, 'subsample': 0.7818449703859783}
최적 CSI 점수: 0.4671 (loss: -0.4671)

최적화 과정 요약:
  - 총 시도 횟수: 100
  - 성공한 시도: 100
  - 최초 CSI: 0.4514
  - 최종 CSI: 0.4476
  - 최고 CSI: 0.4671
  - 최저 CSI: 0.4044
  - 평균 CSI: 0.4506

최적화 Trials 객체가 /workspace/visibility_prediction/Analysis_code/optimization_history/lgb_smotenc_ctgan10000_busan_trials.pkl에 저장되었습니다.
최종 모델 학습 시작...
Fold 1 학습 중... (학습 연도: [2018, 2019], 검증 연도: 2020)
Fold 1 검증 CSI: 0.4073
Fold 2 학습 중... (학습 연도: [2018, 2020], 검증 연도: 2019)
Fold 2 검증 CSI: 0.4828
Fold 3 학습 중... (학습 연도: [2019, 2020], 검증 연도: 2018)
Fold 3 검증 CSI: 0.5015
모델 저장 중...
모델이 /workspace/visibility_prediction/Analysis_code/save_model/lgb_optima/lgb_smotenc_ctgan10000_busan.pkl에 저장되었습니다.

✓ 완료: lgb_smotenc_ctgan10000/LGB_smotenc_ctgan10000_busan.py (소요 시간: 3512초)

----------------------------------------
실행 중: lgb_smotenc_ctgan10000/LGB_smotenc_ctgan10000_daegu.py
시작 시간: 2026-01-07 12:45:50
----------------------------------------
데이터 로딩 중...
데이터 전처리 중...
하이퍼파라미터 최적화 시작...
  0%|          | 0/100 [00:00<?, ?trial/s, best loss=?]  1%|          | 1/100 [00:21<34:50, 21.12s/trial, best loss: -0.3793]  2%|▏         | 2/100 [01:09<1:00:21, 36.95s/trial, best loss: -0.4066]  3%|▎         | 3/100 [01:41<56:05, 34.70s/trial, best loss: -0.4066]    4%|▍         | 4/100 [02:01<46:22, 28.99s/trial, best loss: -0.4066]  5%|▌         | 5/100 [02:35<48:54, 30.89s/trial, best loss: -0.4142]  6%|▌         | 6/100 [03:07<48:47, 31.15s/trial, best loss: -0.4142]  7%|▋         | 7/100 [03:50<54:26, 35.12s/trial, best loss: -0.4142]  8%|▊         | 8/100 [04:14<48:15, 31.47s/trial, best loss: -0.4142]  9%|▉         | 9/100 [04:39<44:35, 29.41s/trial, best loss: -0.4142] 10%|█         | 10/100 [05:01<40:59, 27.33s/trial, best loss: -0.4142] 11%|█         | 11/100 [05:26<39:08, 26.38s/trial, best loss: -0.4142] 12%|█▏        | 12/100 [05:44<35:18, 24.07s/trial, best loss: -0.4142] 13%|█▎        | 13/100 [06:27<42:51, 29.56s/trial, best loss: -0.4142] 14%|█▍        | 14/100 [07:01<44:25, 31.00s/trial, best loss: -0.4142] 15%|█▌        | 15/100 [07:38<46:20, 32.72s/trial, best loss: -0.4142] 16%|█▌        | 16/100 [08:01<41:42, 29.80s/trial, best loss: -0.4142] 17%|█▋        | 17/100 [08:21<37:14, 26.92s/trial, best loss: -0.4142] 18%|█▊        | 18/100 [08:59<41:36, 30.45s/trial, best loss: -0.4142] 19%|█▉        | 19/100 [09:22<37:53, 28.07s/trial, best loss: -0.4142] 20%|██        | 20/100 [09:45<35:15, 26.44s/trial, best loss: -0.4142] 21%|██        | 21/100 [10:13<35:46, 27.18s/trial, best loss: -0.4142] 22%|██▏       | 22/100 [10:34<32:45, 25.20s/trial, best loss: -0.4142] 23%|██▎       | 23/100 [11:03<33:57, 26.46s/trial, best loss: -0.4142] 24%|██▍       | 24/100 [11:34<35:00, 27.64s/trial, best loss: -0.4142] 25%|██▌       | 25/100 [12:25<43:13, 34.58s/trial, best loss: -0.4142] 26%|██▌       | 26/100 [12:51<39:25, 31.96s/trial, best loss: -0.4142] 27%|██▋       | 27/100 [13:15<36:02, 29.62s/trial, best loss: -0.4142] 28%|██▊       | 28/100 [13:40<33:53, 28.24s/trial, best loss: -0.4142] 29%|██▉       | 29/100 [14:10<34:05, 28.80s/trial, best loss: -0.4142] 30%|███       | 30/100 [14:28<30:01, 25.73s/trial, best loss: -0.4142] 31%|███       | 31/100 [15:00<31:43, 27.59s/trial, best loss: -0.4142] 32%|███▏      | 32/100 [15:36<34:12, 30.18s/trial, best loss: -0.4142] 33%|███▎      | 33/100 [16:12<35:30, 31.79s/trial, best loss: -0.4142] 34%|███▍      | 34/100 [16:32<31:02, 28.22s/trial, best loss: -0.4142] 35%|███▌      | 35/100 [17:18<36:16, 33.48s/trial, best loss: -0.4142] 36%|███▌      | 36/100 [17:42<32:38, 30.60s/trial, best loss: -0.4142] 37%|███▋      | 37/100 [18:13<32:30, 30.97s/trial, best loss: -0.4142] 38%|███▊      | 38/100 [18:32<28:13, 27.31s/trial, best loss: -0.4142] 39%|███▉      | 39/100 [18:54<25:56, 25.52s/trial, best loss: -0.4142] 40%|████      | 40/100 [19:19<25:28, 25.47s/trial, best loss: -0.4142] 41%|████      | 41/100 [19:48<26:10, 26.62s/trial, best loss: -0.4142] 42%|████▏     | 42/100 [20:22<27:41, 28.65s/trial, best loss: -0.4142] 43%|████▎     | 43/100 [20:42<24:47, 26.10s/trial, best loss: -0.4142] 44%|████▍     | 44/100 [21:05<23:29, 25.17s/trial, best loss: -0.4142] 45%|████▌     | 45/100 [21:49<28:14, 30.80s/trial, best loss: -0.4142] 46%|████▌     | 46/100 [22:34<31:46, 35.30s/trial, best loss: -0.4142] 47%|████▋     | 47/100 [22:57<27:42, 31.36s/trial, best loss: -0.4142] 48%|████▊     | 48/100 [23:35<28:56, 33.39s/trial, best loss: -0.4142] 49%|████▉     | 49/100 [24:10<28:56, 34.06s/trial, best loss: -0.4142] 50%|█████     | 50/100 [24:38<26:53, 32.26s/trial, best loss: -0.4142] 51%|█████     | 51/100 [25:11<26:22, 32.30s/trial, best loss: -0.4142] 52%|█████▏    | 52/100 [25:33<23:28, 29.34s/trial, best loss: -0.4142] 53%|█████▎    | 53/100 [25:59<22:11, 28.33s/trial, best loss: -0.4142] 54%|█████▍    | 54/100 [26:19<19:40, 25.67s/trial, best loss: -0.4142] 55%|█████▌    | 55/100 [26:54<21:23, 28.52s/trial, best loss: -0.4142] 56%|█████▌    | 56/100 [27:22<20:47, 28.35s/trial, best loss: -0.4142] 57%|█████▋    | 57/100 [27:52<20:38, 28.80s/trial, best loss: -0.4142] 58%|█████▊    | 58/100 [28:27<21:29, 30.69s/trial, best loss: -0.4142] 59%|█████▉    | 59/100 [28:49<19:14, 28.15s/trial, best loss: -0.4142] 60%|██████    | 60/100 [29:15<18:24, 27.61s/trial, best loss: -0.4142] 61%|██████    | 61/100 [29:41<17:28, 26.89s/trial, best loss: -0.4142] 62%|██████▏   | 62/100 [30:04<16:17, 25.73s/trial, best loss: -0.4142] 63%|██████▎   | 63/100 [30:26<15:10, 24.60s/trial, best loss: -0.4142] 64%|██████▍   | 64/100 [31:15<19:08, 31.91s/trial, best loss: -0.4142] 65%|██████▌   | 65/100 [31:54<19:57, 34.22s/trial, best loss: -0.4142] 66%|██████▌   | 66/100 [32:44<21:59, 38.80s/trial, best loss: -0.4142] 67%|██████▋   | 67/100 [33:30<22:37, 41.13s/trial, best loss: -0.4142] 68%|██████▊   | 68/100 [34:26<24:18, 45.59s/trial, best loss: -0.4142] 69%|██████▉   | 69/100 [34:58<21:21, 41.35s/trial, best loss: -0.4142] 70%|███████   | 70/100 [35:31<19:30, 39.02s/trial, best loss: -0.4142] 71%|███████   | 71/100 [36:09<18:41, 38.67s/trial, best loss: -0.4142] 72%|███████▏  | 72/100 [36:40<16:59, 36.43s/trial, best loss: -0.4142] 73%|███████▎  | 73/100 [37:06<14:57, 33.26s/trial, best loss: -0.4142] 74%|███████▍  | 74/100 [37:49<15:41, 36.20s/trial, best loss: -0.4142] 75%|███████▌  | 75/100 [38:20<14:22, 34.51s/trial, best loss: -0.4142] 76%|███████▌  | 76/100 [38:47<12:53, 32.24s/trial, best loss: -0.4142] 77%|███████▋  | 77/100 [39:35<14:09, 36.94s/trial, best loss: -0.4142] 78%|███████▊  | 78/100 [39:55<11:44, 32.03s/trial, best loss: -0.4142] 79%|███████▉  | 79/100 [40:35<11:58, 34.23s/trial, best loss: -0.4142] 80%|████████  | 80/100 [41:02<10:45, 32.27s/trial, best loss: -0.4142] 81%|████████  | 81/100 [41:31<09:52, 31.18s/trial, best loss: -0.4142] 82%|████████▏ | 82/100 [41:59<09:06, 30.37s/trial, best loss: -0.4142] 83%|████████▎ | 83/100 [42:21<07:50, 27.66s/trial, best loss: -0.4142] 84%|████████▍ | 84/100 [42:56<07:58, 29.90s/trial, best loss: -0.4142] 85%|████████▌ | 85/100 [43:17<06:47, 27.18s/trial, best loss: -0.4142] 86%|████████▌ | 86/100 [44:10<08:11, 35.14s/trial, best loss: -0.4142] 87%|████████▋ | 87/100 [44:46<07:39, 35.34s/trial, best loss: -0.4142] 88%|████████▊ | 88/100 [45:24<07:14, 36.17s/trial, best loss: -0.4142] 89%|████████▉ | 89/100 [45:50<06:02, 32.99s/trial, best loss: -0.4142] 90%|█████████ | 90/100 [46:14<05:02, 30.21s/trial, best loss: -0.4142] 91%|█████████ | 91/100 [46:48<04:42, 31.38s/trial, best loss: -0.4142] 92%|█████████▏| 92/100 [47:23<04:20, 32.55s/trial, best loss: -0.4142] 93%|█████████▎| 93/100 [47:50<03:36, 30.98s/trial, best loss: -0.4142] 94%|█████████▍| 94/100 [48:19<03:01, 30.20s/trial, best loss: -0.4142] 95%|█████████▌| 95/100 [48:41<02:19, 27.91s/trial, best loss: -0.4163] 96%|█████████▌| 96/100 [49:06<01:47, 26.84s/trial, best loss: -0.4163] 97%|█████████▋| 97/100 [49:57<01:42, 34.28s/trial, best loss: -0.4163] 98%|█████████▊| 98/100 [50:26<01:05, 32.70s/trial, best loss: -0.4163] 99%|█████████▉| 99/100 [50:47<00:29, 29.03s/trial, best loss: -0.4163]100%|██████████| 100/100 [51:18<00:00, 29.84s/trial, best loss: -0.4163]100%|██████████| 100/100 [51:18<00:00, 30.79s/trial, best loss: -0.4163]
최적화 완료. 최적 파라미터: {'colsample_bytree': 0.7330478958779382, 'learning_rate': 0.060404685378996605, 'max_depth': 13.0, 'min_child_weight': 6.0, 'num_leaves': 56.0, 'reg_alpha': 0.052115420713460175, 'reg_lambda': 0.09284806516180041, 'subsample': 0.8262925625416521}
최적 CSI 점수: 0.4163 (loss: -0.4163)

최적화 과정 요약:
  - 총 시도 횟수: 100
  - 성공한 시도: 100
  - 최초 CSI: 0.3793
  - 최종 CSI: 0.4050
  - 최고 CSI: 0.4163
  - 최저 CSI: 0.3683
  - 평균 CSI: 0.3983

최적화 Trials 객체가 /workspace/visibility_prediction/Analysis_code/optimization_history/lgb_smotenc_ctgan10000_daegu_trials.pkl에 저장되었습니다.
최종 모델 학습 시작...
Fold 1 학습 중... (학습 연도: [2018, 2019], 검증 연도: 2020)
Fold 1 검증 CSI: 0.4081
Fold 2 학습 중... (학습 연도: [2018, 2020], 검증 연도: 2019)
Fold 2 검증 CSI: 0.4394
Fold 3 학습 중... (학습 연도: [2019, 2020], 검증 연도: 2018)
Fold 3 검증 CSI: 0.3368
모델 저장 중...
모델이 /workspace/visibility_prediction/Analysis_code/save_model/lgb_optima/lgb_smotenc_ctgan10000_daegu.pkl에 저장되었습니다.

✓ 완료: lgb_smotenc_ctgan10000/LGB_smotenc_ctgan10000_daegu.py (소요 시간: 3092초)

----------------------------------------
실행 중: lgb_smotenc_ctgan10000/LGB_smotenc_ctgan10000_daejeon.py
시작 시간: 2026-01-07 13:37:22
----------------------------------------
데이터 로딩 중...
데이터 전처리 중...
하이퍼파라미터 최적화 시작...
  0%|          | 0/100 [00:00<?, ?trial/s, best loss=?]  1%|          | 1/100 [00:28<47:14, 28.63s/trial, best loss: -0.4757]  2%|▏         | 2/100 [01:01<51:05, 31.28s/trial, best loss: -0.4769]  3%|▎         | 3/100 [01:37<54:04, 33.45s/trial, best loss: -0.4769]  4%|▍         | 4/100 [02:11<53:40, 33.54s/trial, best loss: -0.4777]  5%|▌         | 5/100 [03:31<1:19:37, 50.29s/trial, best loss: -0.4777]  6%|▌         | 6/100 [04:08<1:11:38, 45.73s/trial, best loss: -0.4828]  7%|▋         | 7/100 [05:25<1:26:50, 56.03s/trial, best loss: -0.4828]  8%|▊         | 8/100 [06:00<1:15:41, 49.36s/trial, best loss: -0.4828]  9%|▉         | 9/100 [06:34<1:07:42, 44.65s/trial, best loss: -0.4828] 10%|█         | 10/100 [07:08<1:01:45, 41.18s/trial, best loss: -0.4828] 11%|█         | 11/100 [07:31<53:06, 35.81s/trial, best loss: -0.4828]   12%|█▏        | 12/100 [08:04<51:09, 34.88s/trial, best loss: -0.4828] 13%|█▎        | 13/100 [08:45<53:14, 36.72s/trial, best loss: -0.4846] 14%|█▍        | 14/100 [09:22<52:33, 36.66s/trial, best loss: -0.4846] 15%|█▌        | 15/100 [09:56<50:59, 36.00s/trial, best loss: -0.4846] 16%|█▌        | 16/100 [10:22<46:00, 32.86s/trial, best loss: -0.4846] 17%|█▋        | 17/100 [10:52<44:26, 32.12s/trial, best loss: -0.4846] 18%|█▊        | 18/100 [12:03<59:43, 43.70s/trial, best loss: -0.4846] 19%|█▉        | 19/100 [12:24<50:03, 37.09s/trial, best loss: -0.4846] 20%|██        | 20/100 [12:47<43:41, 32.77s/trial, best loss: -0.4846] 21%|██        | 21/100 [13:48<54:14, 41.20s/trial, best loss: -0.4846] 22%|██▏       | 22/100 [14:49<1:01:21, 47.20s/trial, best loss: -0.4846] 23%|██▎       | 23/100 [16:04<1:11:14, 55.51s/trial, best loss: -0.4846] 24%|██▍       | 24/100 [16:54<1:08:01, 53.70s/trial, best loss: -0.4846] 25%|██▌       | 25/100 [17:39<1:03:50, 51.07s/trial, best loss: -0.4846] 26%|██▌       | 26/100 [19:19<1:21:08, 65.78s/trial, best loss: -0.4846] 27%|██▋       | 27/100 [20:14<1:16:13, 62.65s/trial, best loss: -0.4846] 28%|██▊       | 28/100 [20:56<1:07:47, 56.49s/trial, best loss: -0.4861] 29%|██▉       | 29/100 [21:47<1:04:55, 54.87s/trial, best loss: -0.4861] 30%|███       | 30/100 [22:47<1:05:54, 56.49s/trial, best loss: -0.4861] 31%|███       | 31/100 [23:32<1:00:44, 52.81s/trial, best loss: -0.4861] 32%|███▏      | 32/100 [24:10<54:51, 48.41s/trial, best loss: -0.4861]   33%|███▎      | 33/100 [24:52<51:54, 46.48s/trial, best loss: -0.4861] 34%|███▍      | 34/100 [25:16<43:49, 39.84s/trial, best loss: -0.4861] 35%|███▌      | 35/100 [26:01<44:39, 41.22s/trial, best loss: -0.4861] 36%|███▌      | 36/100 [26:58<49:08, 46.06s/trial, best loss: -0.4861] 37%|███▋      | 37/100 [28:04<54:39, 52.05s/trial, best loss: -0.4861] 38%|███▊      | 38/100 [28:47<50:59, 49.35s/trial, best loss: -0.4861] 39%|███▉      | 39/100 [29:22<45:51, 45.11s/trial, best loss: -0.4861] 40%|████      | 40/100 [29:56<41:46, 41.78s/trial, best loss: -0.4861] 41%|████      | 41/100 [30:36<40:28, 41.17s/trial, best loss: -0.4861] 42%|████▏     | 42/100 [31:15<39:02, 40.39s/trial, best loss: -0.4861] 43%|████▎     | 43/100 [32:04<40:59, 43.15s/trial, best loss: -0.4861] 44%|████▍     | 44/100 [32:39<37:55, 40.64s/trial, best loss: -0.4861] 45%|████▌     | 45/100 [33:11<34:46, 37.94s/trial, best loss: -0.4861] 46%|████▌     | 46/100 [33:47<33:37, 37.36s/trial, best loss: -0.4861] 47%|████▋     | 47/100 [34:41<37:32, 42.50s/trial, best loss: -0.4861] 48%|████▊     | 48/100 [35:16<34:56, 40.32s/trial, best loss: -0.4861] 49%|████▉     | 49/100 [36:17<39:34, 46.56s/trial, best loss: -0.4861] 50%|█████     | 50/100 [37:02<38:15, 45.91s/trial, best loss: -0.4861] 51%|█████     | 51/100 [37:25<31:53, 39.05s/trial, best loss: -0.4861] 52%|█████▏    | 52/100 [37:52<28:18, 35.39s/trial, best loss: -0.4861] 53%|█████▎    | 53/100 [38:21<26:18, 33.58s/trial, best loss: -0.4861] 54%|█████▍    | 54/100 [39:27<33:04, 43.15s/trial, best loss: -0.4861] 55%|█████▌    | 55/100 [41:00<43:40, 58.23s/trial, best loss: -0.4861] 56%|█████▌    | 56/100 [41:35<37:37, 51.31s/trial, best loss: -0.4861] 57%|█████▋    | 57/100 [42:10<33:07, 46.23s/trial, best loss: -0.4861] 58%|█████▊    | 58/100 [43:01<33:25, 47.74s/trial, best loss: -0.4861] 59%|█████▉    | 59/100 [43:43<31:27, 46.04s/trial, best loss: -0.4861] 60%|██████    | 60/100 [44:26<30:09, 45.23s/trial, best loss: -0.4861] 61%|██████    | 61/100 [45:11<29:22, 45.18s/trial, best loss: -0.4861] 62%|██████▏   | 62/100 [46:23<33:38, 53.12s/trial, best loss: -0.4861] 63%|██████▎   | 63/100 [46:56<29:06, 47.21s/trial, best loss: -0.4861] 64%|██████▍   | 64/100 [47:24<24:46, 41.30s/trial, best loss: -0.4861] 65%|██████▌   | 65/100 [48:56<32:55, 56.44s/trial, best loss: -0.4861] 66%|██████▌   | 66/100 [49:37<29:27, 51.97s/trial, best loss: -0.4861] 67%|██████▋   | 67/100 [50:21<27:12, 49.47s/trial, best loss: -0.4861] 68%|██████▊   | 68/100 [50:58<24:20, 45.65s/trial, best loss: -0.4861] 69%|██████▉   | 69/100 [51:42<23:26, 45.38s/trial, best loss: -0.4861] 70%|███████   | 70/100 [52:23<21:58, 43.96s/trial, best loss: -0.4861] 71%|███████   | 71/100 [53:16<22:31, 46.59s/trial, best loss: -0.4861] 72%|███████▏  | 72/100 [53:49<19:53, 42.63s/trial, best loss: -0.4861] 73%|███████▎  | 73/100 [54:21<17:44, 39.43s/trial, best loss: -0.4861] 74%|███████▍  | 74/100 [55:16<19:07, 44.12s/trial, best loss: -0.4861] 75%|███████▌  | 75/100 [55:52<17:20, 41.62s/trial, best loss: -0.4861] 76%|███████▌  | 76/100 [56:29<16:10, 40.42s/trial, best loss: -0.4861] 77%|███████▋  | 77/100 [57:19<16:30, 43.09s/trial, best loss: -0.4861] 78%|███████▊  | 78/100 [57:55<15:00, 40.91s/trial, best loss: -0.4861] 79%|███████▉  | 79/100 [58:33<14:05, 40.27s/trial, best loss: -0.4861] 80%|████████  | 80/100 [59:09<12:56, 38.82s/trial, best loss: -0.4861] 81%|████████  | 81/100 [59:42<11:44, 37.10s/trial, best loss: -0.4861] 82%|████████▏ | 82/100 [1:00:23<11:29, 38.30s/trial, best loss: -0.4861] 83%|████████▎ | 83/100 [1:01:15<11:59, 42.35s/trial, best loss: -0.4861] 84%|████████▍ | 84/100 [1:02:03<11:46, 44.17s/trial, best loss: -0.4861] 85%|████████▌ | 85/100 [1:02:35<10:07, 40.51s/trial, best loss: -0.4861] 86%|████████▌ | 86/100 [1:03:24<10:02, 43.02s/trial, best loss: -0.4861] 87%|████████▋ | 87/100 [1:03:56<08:36, 39.73s/trial, best loss: -0.4861] 88%|████████▊ | 88/100 [1:04:48<08:41, 43.43s/trial, best loss: -0.4861] 89%|████████▉ | 89/100 [1:05:22<07:27, 40.68s/trial, best loss: -0.4861] 90%|█████████ | 90/100 [1:05:52<06:14, 37.40s/trial, best loss: -0.4861] 91%|█████████ | 91/100 [1:06:34<05:48, 38.73s/trial, best loss: -0.4861] 92%|█████████▏| 92/100 [1:07:25<05:40, 42.52s/trial, best loss: -0.4861] 93%|█████████▎| 93/100 [1:08:03<04:48, 41.15s/trial, best loss: -0.4861] 94%|█████████▍| 94/100 [1:09:26<05:21, 53.61s/trial, best loss: -0.4861] 95%|█████████▌| 95/100 [1:10:10<04:13, 50.77s/trial, best loss: -0.4861] 96%|█████████▌| 96/100 [1:11:48<04:18, 64.74s/trial, best loss: -0.4861] 97%|█████████▋| 97/100 [1:12:52<03:13, 64.58s/trial, best loss: -0.4861] 98%|█████████▊| 98/100 [1:13:14<01:43, 51.90s/trial, best loss: -0.4861] 99%|█████████▉| 99/100 [1:14:05<00:51, 51.70s/trial, best loss: -0.4861]100%|██████████| 100/100 [1:15:01<00:00, 52.96s/trial, best loss: -0.4861]100%|██████████| 100/100 [1:15:01<00:00, 45.02s/trial, best loss: -0.4861]
최적화 완료. 최적 파라미터: {'colsample_bytree': 0.6750409944037143, 'learning_rate': 0.03954857575901899, 'max_depth': 9.0, 'min_child_weight': 7.0, 'num_leaves': 36.0, 'reg_alpha': 0.6285423710598178, 'reg_lambda': 0.8325547037753689, 'subsample': 0.6484531011488139}
최적 CSI 점수: 0.4861 (loss: -0.4861)

최적화 과정 요약:
  - 총 시도 횟수: 100
  - 성공한 시도: 100
  - 최초 CSI: 0.4757
  - 최종 CSI: 0.4722
  - 최고 CSI: 0.4861
  - 최저 CSI: 0.4589
  - 평균 CSI: 0.4755

최적화 Trials 객체가 /workspace/visibility_prediction/Analysis_code/optimization_history/lgb_smotenc_ctgan10000_daejeon_trials.pkl에 저장되었습니다.
최종 모델 학습 시작...
Fold 1 학습 중... (학습 연도: [2018, 2019], 검증 연도: 2020)
Fold 1 검증 CSI: 0.4427
Fold 2 학습 중... (학습 연도: [2018, 2020], 검증 연도: 2019)
Fold 2 검증 CSI: 0.4800
Fold 3 학습 중... (학습 연도: [2019, 2020], 검증 연도: 2018)
Fold 3 검증 CSI: 0.5242
모델 저장 중...
모델이 /workspace/visibility_prediction/Analysis_code/save_model/lgb_optima/lgb_smotenc_ctgan10000_daejeon.pkl에 저장되었습니다.

✓ 완료: lgb_smotenc_ctgan10000/LGB_smotenc_ctgan10000_daejeon.py (소요 시간: 4524초)

----------------------------------------
실행 중: lgb_smotenc_ctgan10000/LGB_smotenc_ctgan10000_gwangju.py
시작 시간: 2026-01-07 14:52:46
----------------------------------------
데이터 로딩 중...
데이터 전처리 중...
하이퍼파라미터 최적화 시작...
  0%|          | 0/100 [00:00<?, ?trial/s, best loss=?]  1%|          | 1/100 [00:37<1:02:15, 37.73s/trial, best loss: -0.4758]  2%|▏         | 2/100 [00:57<44:26, 27.21s/trial, best loss: -0.4758]    3%|▎         | 3/100 [01:36<52:18, 32.35s/trial, best loss: -0.4793]  4%|▍         | 4/100 [01:56<44:21, 27.72s/trial, best loss: -0.4793]  5%|▌         | 5/100 [02:19<41:11, 26.01s/trial, best loss: -0.4793]  6%|▌         | 6/100 [02:44<39:58, 25.52s/trial, best loss: -0.4793]  7%|▋         | 7/100 [03:15<42:36, 27.49s/trial, best loss: -0.4848]  8%|▊         | 8/100 [03:49<45:10, 29.46s/trial, best loss: -0.4965]  9%|▉         | 9/100 [04:58<1:03:23, 41.80s/trial, best loss: -0.4965] 10%|█         | 10/100 [05:21<54:00, 36.01s/trial, best loss: -0.4965]  11%|█         | 11/100 [06:02<55:32, 37.44s/trial, best loss: -0.4965] 12%|█▏        | 12/100 [06:59<1:03:45, 43.47s/trial, best loss: -0.4965] 13%|█▎        | 13/100 [07:28<56:57, 39.28s/trial, best loss: -0.4965]   14%|█▍        | 14/100 [07:55<50:39, 35.34s/trial, best loss: -0.4965] 15%|█▌        | 15/100 [08:49<58:08, 41.04s/trial, best loss: -0.4965] 16%|█▌        | 16/100 [09:16<51:42, 36.93s/trial, best loss: -0.4965] 17%|█▋        | 17/100 [09:54<51:24, 37.17s/trial, best loss: -0.4965] 18%|█▊        | 18/100 [10:27<49:05, 35.93s/trial, best loss: -0.4965] 19%|█▉        | 19/100 [11:20<55:28, 41.10s/trial, best loss: -0.4965] 20%|██        | 20/100 [12:03<55:36, 41.71s/trial, best loss: -0.4965] 21%|██        | 21/100 [12:45<54:57, 41.73s/trial, best loss: -0.4965] 22%|██▏       | 22/100 [13:15<49:45, 38.28s/trial, best loss: -0.4965] 23%|██▎       | 23/100 [14:06<53:53, 41.99s/trial, best loss: -0.4965] 24%|██▍       | 24/100 [14:44<51:29, 40.65s/trial, best loss: -0.4965] 25%|██▌       | 25/100 [15:13<46:27, 37.17s/trial, best loss: -0.4965] 26%|██▌       | 26/100 [15:43<43:17, 35.11s/trial, best loss: -0.4965] 27%|██▋       | 27/100 [16:37<49:41, 40.84s/trial, best loss: -0.4965] 28%|██▊       | 28/100 [17:12<47:01, 39.18s/trial, best loss: -0.4965] 29%|██▉       | 29/100 [17:44<43:32, 36.80s/trial, best loss: -0.4965] 30%|███       | 30/100 [18:24<44:18, 37.98s/trial, best loss: -0.4965] 31%|███       | 31/100 [19:08<45:42, 39.75s/trial, best loss: -0.4965] 32%|███▏      | 32/100 [19:43<43:22, 38.27s/trial, best loss: -0.4965] 33%|███▎      | 33/100 [20:26<44:11, 39.57s/trial, best loss: -0.4965] 34%|███▍      | 34/100 [20:52<39:09, 35.61s/trial, best loss: -0.4965] 35%|███▌      | 35/100 [21:16<34:41, 32.02s/trial, best loss: -0.4965] 36%|███▌      | 36/100 [21:40<31:48, 29.82s/trial, best loss: -0.4965] 37%|███▋      | 37/100 [22:19<33:55, 32.31s/trial, best loss: -0.4965] 38%|███▊      | 38/100 [23:19<42:02, 40.68s/trial, best loss: -0.4965] 39%|███▉      | 39/100 [24:57<58:47, 57.82s/trial, best loss: -0.4965] 40%|████      | 40/100 [25:19<47:20, 47.35s/trial, best loss: -0.4965] 41%|████      | 41/100 [25:46<40:28, 41.16s/trial, best loss: -0.4965] 42%|████▏     | 42/100 [26:32<40:59, 42.40s/trial, best loss: -0.4965] 43%|████▎     | 43/100 [26:58<35:52, 37.75s/trial, best loss: -0.4965] 44%|████▍     | 44/100 [27:31<33:40, 36.09s/trial, best loss: -0.4965] 45%|████▌     | 45/100 [27:52<29:02, 31.68s/trial, best loss: -0.4965] 46%|████▌     | 46/100 [28:19<27:19, 30.35s/trial, best loss: -0.4965] 47%|████▋     | 47/100 [28:50<26:57, 30.52s/trial, best loss: -0.4965] 48%|████▊     | 48/100 [29:29<28:36, 33.02s/trial, best loss: -0.4965] 49%|████▉     | 49/100 [30:07<29:15, 34.42s/trial, best loss: -0.4965] 50%|█████     | 50/100 [30:43<29:04, 34.88s/trial, best loss: -0.4965] 51%|█████     | 51/100 [31:06<25:38, 31.40s/trial, best loss: -0.4965] 52%|█████▏    | 52/100 [31:43<26:34, 33.23s/trial, best loss: -0.4965] 53%|█████▎    | 53/100 [32:50<33:51, 43.22s/trial, best loss: -0.4965] 54%|█████▍    | 54/100 [33:10<27:50, 36.31s/trial, best loss: -0.4965] 55%|█████▌    | 55/100 [33:40<25:47, 34.40s/trial, best loss: -0.4965] 56%|█████▌    | 56/100 [34:21<26:35, 36.27s/trial, best loss: -0.4965] 57%|█████▋    | 57/100 [35:20<30:57, 43.19s/trial, best loss: -0.4965] 58%|█████▊    | 58/100 [35:54<28:20, 40.49s/trial, best loss: -0.4965] 59%|█████▉    | 59/100 [36:26<25:56, 37.97s/trial, best loss: -0.4965] 60%|██████    | 60/100 [36:52<22:52, 34.32s/trial, best loss: -0.4965] 61%|██████    | 61/100 [37:46<26:09, 40.25s/trial, best loss: -0.4965] 62%|██████▏   | 62/100 [38:17<23:38, 37.32s/trial, best loss: -0.4965] 63%|██████▎   | 63/100 [38:43<21:03, 34.15s/trial, best loss: -0.4965] 64%|██████▍   | 64/100 [39:19<20:39, 34.44s/trial, best loss: -0.4965] 65%|██████▌   | 65/100 [40:02<21:41, 37.20s/trial, best loss: -0.4965] 66%|██████▌   | 66/100 [40:39<21:00, 37.08s/trial, best loss: -0.4965] 67%|██████▋   | 67/100 [41:24<21:43, 39.50s/trial, best loss: -0.4965] 68%|██████▊   | 68/100 [42:01<20:34, 38.57s/trial, best loss: -0.4965] 69%|██████▉   | 69/100 [42:36<19:25, 37.59s/trial, best loss: -0.4965] 70%|███████   | 70/100 [43:10<18:13, 36.45s/trial, best loss: -0.4965] 71%|███████   | 71/100 [43:52<18:24, 38.09s/trial, best loss: -0.4965] 72%|███████▏  | 72/100 [44:24<16:58, 36.38s/trial, best loss: -0.4965] 73%|███████▎  | 73/100 [44:59<16:10, 35.96s/trial, best loss: -0.4965] 74%|███████▍  | 74/100 [45:33<15:17, 35.28s/trial, best loss: -0.4965] 75%|███████▌  | 75/100 [46:10<14:56, 35.85s/trial, best loss: -0.4965] 76%|███████▌  | 76/100 [46:46<14:20, 35.84s/trial, best loss: -0.4965] 77%|███████▋  | 77/100 [47:28<14:29, 37.78s/trial, best loss: -0.4965] 78%|███████▊  | 78/100 [48:23<15:41, 42.82s/trial, best loss: -0.4965] 79%|███████▉  | 79/100 [49:11<15:32, 44.41s/trial, best loss: -0.4965] 80%|████████  | 80/100 [49:51<14:24, 43.21s/trial, best loss: -0.4965] 81%|████████  | 81/100 [50:28<13:07, 41.45s/trial, best loss: -0.4965] 82%|████████▏ | 82/100 [51:12<12:38, 42.11s/trial, best loss: -0.4965] 83%|████████▎ | 83/100 [52:09<13:12, 46.62s/trial, best loss: -0.4965] 84%|████████▍ | 84/100 [52:44<11:26, 42.92s/trial, best loss: -0.4965] 85%|████████▌ | 85/100 [53:24<10:33, 42.20s/trial, best loss: -0.4965] 86%|████████▌ | 86/100 [54:17<10:35, 45.40s/trial, best loss: -0.4965] 87%|████████▋ | 87/100 [55:15<10:40, 49.23s/trial, best loss: -0.4965] 88%|████████▊ | 88/100 [56:19<10:43, 53.59s/trial, best loss: -0.4965] 89%|████████▉ | 89/100 [57:22<10:19, 56.35s/trial, best loss: -0.4965] 90%|█████████ | 90/100 [58:12<09:06, 54.61s/trial, best loss: -0.4965] 91%|█████████ | 91/100 [58:55<07:38, 50.97s/trial, best loss: -0.4965] 92%|█████████▏| 92/100 [59:45<06:46, 50.77s/trial, best loss: -0.4965] 93%|█████████▎| 93/100 [1:00:16<05:14, 44.99s/trial, best loss: -0.4965] 94%|█████████▍| 94/100 [1:00:59<04:25, 44.26s/trial, best loss: -0.4965] 95%|█████████▌| 95/100 [1:01:44<03:42, 44.43s/trial, best loss: -0.4965] 96%|█████████▌| 96/100 [1:02:14<02:40, 40.13s/trial, best loss: -0.4965] 97%|█████████▋| 97/100 [1:02:47<01:54, 38.11s/trial, best loss: -0.4965] 98%|█████████▊| 98/100 [1:03:15<01:10, 35.00s/trial, best loss: -0.4965] 99%|█████████▉| 99/100 [1:03:40<00:32, 32.06s/trial, best loss: -0.4965]100%|██████████| 100/100 [1:04:15<00:00, 32.77s/trial, best loss: -0.4965]100%|██████████| 100/100 [1:04:15<00:00, 38.55s/trial, best loss: -0.4965]
최적화 완료. 최적 파라미터: {'colsample_bytree': 0.9224384724220873, 'learning_rate': 0.03667771104825487, 'max_depth': 11.0, 'min_child_weight': 9.0, 'num_leaves': 72.0, 'reg_alpha': 0.982696427608006, 'reg_lambda': 0.9497011554251636, 'subsample': 0.7791371793317851}
최적 CSI 점수: 0.4965 (loss: -0.4965)

최적화 과정 요약:
  - 총 시도 횟수: 100
  - 성공한 시도: 100
  - 최초 CSI: 0.4758
  - 최종 CSI: 0.4871
  - 최고 CSI: 0.4965
  - 최저 CSI: 0.4538
  - 평균 CSI: 0.4844

최적화 Trials 객체가 /workspace/visibility_prediction/Analysis_code/optimization_history/lgb_smotenc_ctgan10000_gwangju_trials.pkl에 저장되었습니다.
최종 모델 학습 시작...
Fold 1 학습 중... (학습 연도: [2018, 2019], 검증 연도: 2020)
Fold 1 검증 CSI: 0.4008
Fold 2 학습 중... (학습 연도: [2018, 2020], 검증 연도: 2019)
Fold 2 검증 CSI: 0.5628
Fold 3 학습 중... (학습 연도: [2019, 2020], 검증 연도: 2018)
Fold 3 검증 CSI: 0.5121
모델 저장 중...
모델이 /workspace/visibility_prediction/Analysis_code/save_model/lgb_optima/lgb_smotenc_ctgan10000_gwangju.pkl에 저장되었습니다.

✓ 완료: lgb_smotenc_ctgan10000/LGB_smotenc_ctgan10000_gwangju.py (소요 시간: 3876초)

----------------------------------------
실행 중: lgb_smotenc_ctgan10000/LGB_smotenc_ctgan10000_incheon.py
시작 시간: 2026-01-07 15:57:22
----------------------------------------
데이터 로딩 중...
데이터 전처리 중...
하이퍼파라미터 최적화 시작...
  0%|          | 0/100 [00:00<?, ?trial/s, best loss=?]  1%|          | 1/100 [00:27<45:05, 27.33s/trial, best loss: -0.5498]  2%|▏         | 2/100 [00:58<47:52, 29.31s/trial, best loss: -0.5507]  3%|▎         | 3/100 [01:57<1:09:20, 42.89s/trial, best loss: -0.5519]  4%|▍         | 4/100 [02:31<1:03:34, 39.73s/trial, best loss: -0.5535]  5%|▌         | 5/100 [03:31<1:14:25, 47.00s/trial, best loss: -0.5566]  6%|▌         | 6/100 [04:07<1:07:38, 43.18s/trial, best loss: -0.5566]  7%|▋         | 7/100 [04:28<55:32, 35.83s/trial, best loss: -0.5566]    8%|▊         | 8/100 [05:04<55:10, 35.98s/trial, best loss: -0.5566]  9%|▉         | 9/100 [06:01<1:04:29, 42.52s/trial, best loss: -0.5566] 10%|█         | 10/100 [06:45<1:04:30, 43.01s/trial, best loss: -0.5606] 11%|█         | 11/100 [07:27<1:03:29, 42.81s/trial, best loss: -0.5606] 12%|█▏        | 12/100 [08:37<1:14:45, 50.98s/trial, best loss: -0.5606] 13%|█▎        | 13/100 [09:00<1:01:36, 42.49s/trial, best loss: -0.5606] 14%|█▍        | 14/100 [09:32<56:13, 39.23s/trial, best loss: -0.5606]   15%|█▌        | 15/100 [10:11<55:42, 39.32s/trial, best loss: -0.5606] 16%|█▌        | 16/100 [10:40<50:39, 36.18s/trial, best loss: -0.5606] 17%|█▋        | 17/100 [11:16<49:46, 35.99s/trial, best loss: -0.5606] 18%|█▊        | 18/100 [11:46<47:00, 34.40s/trial, best loss: -0.5606] 19%|█▉        | 19/100 [12:10<41:54, 31.05s/trial, best loss: -0.5606] 20%|██        | 20/100 [13:05<51:15, 38.45s/trial, best loss: -0.5606] 21%|██        | 21/100 [14:24<1:06:20, 50.39s/trial, best loss: -0.5606] 22%|██▏       | 22/100 [15:35<1:13:41, 56.68s/trial, best loss: -0.5606] 23%|██▎       | 23/100 [16:45<1:18:03, 60.82s/trial, best loss: -0.5606] 24%|██▍       | 24/100 [18:03<1:23:18, 65.76s/trial, best loss: -0.5606] 25%|██▌       | 25/100 [18:43<1:12:49, 58.26s/trial, best loss: -0.5606] 26%|██▌       | 26/100 [19:10<59:59, 48.64s/trial, best loss: -0.5606]   27%|██▋       | 27/100 [20:05<1:01:31, 50.56s/trial, best loss: -0.5606] 28%|██▊       | 28/100 [20:46<57:19, 47.78s/trial, best loss: -0.5606]   29%|██▉       | 29/100 [21:19<51:26, 43.48s/trial, best loss: -0.5606] 30%|███       | 30/100 [22:27<59:17, 50.83s/trial, best loss: -0.5606] 31%|███       | 31/100 [23:32<1:03:13, 54.98s/trial, best loss: -0.5606] 32%|███▏      | 32/100 [24:16<58:41, 51.79s/trial, best loss: -0.5606]   33%|███▎      | 33/100 [25:32<1:05:37, 58.77s/trial, best loss: -0.5606] 34%|███▍      | 34/100 [26:36<1:06:36, 60.55s/trial, best loss: -0.5606] 35%|███▌      | 35/100 [27:00<53:38, 49.51s/trial, best loss: -0.5606]   36%|███▌      | 36/100 [27:27<45:38, 42.79s/trial, best loss: -0.5606] 37%|███▋      | 37/100 [28:17<47:09, 44.91s/trial, best loss: -0.5606] 38%|███▊      | 38/100 [28:54<43:54, 42.49s/trial, best loss: -0.5606] 39%|███▉      | 39/100 [29:37<43:25, 42.72s/trial, best loss: -0.5606] 40%|████      | 40/100 [30:23<43:34, 43.57s/trial, best loss: -0.5606] 41%|████      | 41/100 [31:19<46:46, 47.57s/trial, best loss: -0.5606] 42%|████▏     | 42/100 [32:10<46:55, 48.55s/trial, best loss: -0.5606] 43%|████▎     | 43/100 [32:33<38:50, 40.89s/trial, best loss: -0.5606] 44%|████▍     | 44/100 [33:41<45:32, 48.80s/trial, best loss: -0.5606] 45%|████▌     | 45/100 [34:25<43:28, 47.43s/trial, best loss: -0.5606] 46%|████▌     | 46/100 [35:12<42:36, 47.34s/trial, best loss: -0.5606] 47%|████▋     | 47/100 [36:32<50:28, 57.14s/trial, best loss: -0.5606] 48%|████▊     | 48/100 [37:08<44:05, 50.88s/trial, best loss: -0.5606] 49%|████▉     | 49/100 [37:39<38:00, 44.72s/trial, best loss: -0.5606] 50%|█████     | 50/100 [38:24<37:31, 45.04s/trial, best loss: -0.5606] 51%|█████     | 51/100 [39:12<37:27, 45.86s/trial, best loss: -0.5606] 52%|█████▏    | 52/100 [39:38<31:57, 39.95s/trial, best loss: -0.5606] 53%|█████▎    | 53/100 [40:16<30:41, 39.18s/trial, best loss: -0.5606] 54%|█████▍    | 54/100 [41:20<35:42, 46.58s/trial, best loss: -0.5606] 55%|█████▌    | 55/100 [41:58<33:03, 44.08s/trial, best loss: -0.5606] 56%|█████▌    | 56/100 [42:39<31:38, 43.14s/trial, best loss: -0.5606] 57%|█████▋    | 57/100 [43:23<31:06, 43.41s/trial, best loss: -0.5606] 58%|█████▊    | 58/100 [44:30<35:19, 50.46s/trial, best loss: -0.5606] 59%|█████▉    | 59/100 [45:34<37:23, 54.72s/trial, best loss: -0.5606] 60%|██████    | 60/100 [46:01<30:55, 46.38s/trial, best loss: -0.5606] 61%|██████    | 61/100 [46:39<28:31, 43.88s/trial, best loss: -0.5606] 62%|██████▏   | 62/100 [47:13<25:52, 40.85s/trial, best loss: -0.5606] 63%|██████▎   | 63/100 [48:22<30:19, 49.18s/trial, best loss: -0.5606] 64%|██████▍   | 64/100 [49:29<32:47, 54.64s/trial, best loss: -0.5606] 65%|██████▌   | 65/100 [49:53<26:27, 45.36s/trial, best loss: -0.5606] 66%|██████▌   | 66/100 [50:54<28:24, 50.14s/trial, best loss: -0.5606] 67%|██████▋   | 67/100 [51:54<29:10, 53.04s/trial, best loss: -0.5606] 68%|██████▊   | 68/100 [53:01<30:36, 57.39s/trial, best loss: -0.5606] 69%|██████▉   | 69/100 [54:20<32:57, 63.79s/trial, best loss: -0.5606] 70%|███████   | 70/100 [55:41<34:23, 68.77s/trial, best loss: -0.5606] 71%|███████   | 71/100 [57:12<36:29, 75.49s/trial, best loss: -0.5606] 72%|███████▏  | 72/100 [57:40<28:37, 61.32s/trial, best loss: -0.5606] 73%|███████▎  | 73/100 [58:31<26:09, 58.14s/trial, best loss: -0.5606] 74%|███████▍  | 74/100 [59:16<23:28, 54.16s/trial, best loss: -0.5606] 75%|███████▌  | 75/100 [1:00:10<22:33, 54.13s/trial, best loss: -0.5606] 76%|███████▌  | 76/100 [1:01:38<25:47, 64.48s/trial, best loss: -0.5606] 77%|███████▋  | 77/100 [1:02:09<20:48, 54.29s/trial, best loss: -0.5606] 78%|███████▊  | 78/100 [1:02:50<18:30, 50.49s/trial, best loss: -0.5606] 79%|███████▉  | 79/100 [1:03:38<17:20, 49.52s/trial, best loss: -0.5606] 80%|████████  | 80/100 [1:04:34<17:08, 51.44s/trial, best loss: -0.5606] 81%|████████  | 81/100 [1:05:08<14:39, 46.32s/trial, best loss: -0.5606] 82%|████████▏ | 82/100 [1:05:56<14:03, 46.89s/trial, best loss: -0.5606] 83%|████████▎ | 83/100 [1:07:12<15:44, 55.56s/trial, best loss: -0.5606] 84%|████████▍ | 84/100 [1:08:03<14:26, 54.17s/trial, best loss: -0.5606] 85%|████████▌ | 85/100 [1:09:08<14:21, 57.41s/trial, best loss: -0.5606] 86%|████████▌ | 86/100 [1:10:02<13:09, 56.37s/trial, best loss: -0.5606] 87%|████████▋ | 87/100 [1:10:41<11:04, 51.09s/trial, best loss: -0.5606] 88%|████████▊ | 88/100 [1:11:16<09:17, 46.47s/trial, best loss: -0.5606] 89%|████████▉ | 89/100 [1:11:52<07:56, 43.35s/trial, best loss: -0.5606] 90%|█████████ | 90/100 [1:12:35<07:12, 43.23s/trial, best loss: -0.5606] 91%|█████████ | 91/100 [1:13:31<07:04, 47.13s/trial, best loss: -0.5606] 92%|█████████▏| 92/100 [1:14:07<05:49, 43.68s/trial, best loss: -0.5606] 93%|█████████▎| 93/100 [1:15:09<05:43, 49.12s/trial, best loss: -0.5606] 94%|█████████▍| 94/100 [1:16:20<05:34, 55.72s/trial, best loss: -0.5606] 95%|█████████▌| 95/100 [1:17:14<04:35, 55.10s/trial, best loss: -0.5606] 96%|█████████▌| 96/100 [1:18:12<03:44, 56.13s/trial, best loss: -0.5606] 97%|█████████▋| 97/100 [1:18:51<02:32, 50.92s/trial, best loss: -0.5606] 98%|█████████▊| 98/100 [1:19:34<01:37, 48.66s/trial, best loss: -0.5606] 99%|█████████▉| 99/100 [1:20:13<00:45, 45.74s/trial, best loss: -0.5606]100%|██████████| 100/100 [1:21:31<00:00, 55.26s/trial, best loss: -0.5606]100%|██████████| 100/100 [1:21:31<00:00, 48.91s/trial, best loss: -0.5606]
최적화 완료. 최적 파라미터: {'colsample_bytree': 0.7139214173258402, 'learning_rate': 0.043177718999506065, 'max_depth': 15.0, 'min_child_weight': 7.0, 'num_leaves': 148.0, 'reg_alpha': 0.20519911145316594, 'reg_lambda': 0.5236480016049754, 'subsample': 0.6224202634803356}
최적 CSI 점수: 0.5606 (loss: -0.5606)

최적화 과정 요약:
  - 총 시도 횟수: 100
  - 성공한 시도: 100
  - 최초 CSI: 0.5498
  - 최종 CSI: 0.5557
  - 최고 CSI: 0.5606
  - 최저 CSI: 0.5395
  - 평균 CSI: 0.5531

최적화 Trials 객체가 /workspace/visibility_prediction/Analysis_code/optimization_history/lgb_smotenc_ctgan10000_incheon_trials.pkl에 저장되었습니다.
최종 모델 학습 시작...
Fold 1 학습 중... (학습 연도: [2018, 2019], 검증 연도: 2020)
Fold 1 검증 CSI: 0.4882
Fold 2 학습 중... (학습 연도: [2018, 2020], 검증 연도: 2019)
Fold 2 검증 CSI: 0.6154
Fold 3 학습 중... (학습 연도: [2019, 2020], 검증 연도: 2018)
Fold 3 검증 CSI: 0.5766
모델 저장 중...
모델이 /workspace/visibility_prediction/Analysis_code/save_model/lgb_optima/lgb_smotenc_ctgan10000_incheon.pkl에 저장되었습니다.

✓ 완료: lgb_smotenc_ctgan10000/LGB_smotenc_ctgan10000_incheon.py (소요 시간: 4920초)

----------------------------------------
실행 중: lgb_smotenc_ctgan10000/LGB_smotenc_ctgan10000_seoul.py
시작 시간: 2026-01-07 17:19:22
----------------------------------------
데이터 로딩 중...
데이터 전처리 중...
하이퍼파라미터 최적화 시작...
  0%|          | 0/100 [00:00<?, ?trial/s, best loss=?]  1%|          | 1/100 [00:20<33:49, 20.50s/trial, best loss: -0.5401]  2%|▏         | 2/100 [00:47<40:01, 24.50s/trial, best loss: -0.5435]  3%|▎         | 3/100 [02:01<1:15:36, 46.77s/trial, best loss: -0.5522]  4%|▍         | 4/100 [02:34<1:06:41, 41.68s/trial, best loss: -0.5522]  5%|▌         | 5/100 [03:02<58:09, 36.73s/trial, best loss: -0.5522]    6%|▌         | 6/100 [03:34<54:38, 34.88s/trial, best loss: -0.5522]  7%|▋         | 7/100 [04:17<58:22, 37.66s/trial, best loss: -0.5522]  8%|▊         | 8/100 [04:39<49:59, 32.60s/trial, best loss: -0.5522]  9%|▉         | 9/100 [05:00<44:13, 29.16s/trial, best loss: -0.5522] 10%|█         | 10/100 [05:55<55:21, 36.91s/trial, best loss: -0.5522] 11%|█         | 11/100 [06:36<56:47, 38.28s/trial, best loss: -0.5522] 12%|█▏        | 12/100 [07:03<51:15, 34.95s/trial, best loss: -0.555]  13%|█▎        | 13/100 [08:06<1:02:50, 43.34s/trial, best loss: -0.555] 14%|█▍        | 14/100 [08:40<58:12, 40.61s/trial, best loss: -0.555]   15%|█▌        | 15/100 [10:11<1:18:47, 55.61s/trial, best loss: -0.555] 16%|█▌        | 16/100 [10:50<1:10:55, 50.66s/trial, best loss: -0.555] 17%|█▋        | 17/100 [11:31<1:06:03, 47.76s/trial, best loss: -0.555] 18%|█▊        | 18/100 [12:08<1:00:41, 44.41s/trial, best loss: -0.555] 19%|█▉        | 19/100 [13:13<1:08:25, 50.69s/trial, best loss: -0.555] 20%|██        | 20/100 [13:46<1:00:26, 45.33s/trial, best loss: -0.555] 21%|██        | 21/100 [14:10<51:12, 38.90s/trial, best loss: -0.555]   22%|██▏       | 22/100 [14:51<51:40, 39.76s/trial, best loss: -0.555] 23%|██▎       | 23/100 [15:15<44:47, 34.90s/trial, best loss: -0.555] 24%|██▍       | 24/100 [15:39<40:15, 31.78s/trial, best loss: -0.555] 25%|██▌       | 25/100 [16:03<36:28, 29.18s/trial, best loss: -0.555] 26%|██▌       | 26/100 [16:26<34:03, 27.61s/trial, best loss: -0.555] 27%|██▋       | 27/100 [16:49<31:40, 26.04s/trial, best loss: -0.555] 28%|██▊       | 28/100 [17:18<32:14, 26.87s/trial, best loss: -0.555] 29%|██▉       | 29/100 [17:41<30:26, 25.73s/trial, best loss: -0.555] 30%|███       | 30/100 [18:07<30:17, 25.96s/trial, best loss: -0.555] 31%|███       | 31/100 [18:30<28:41, 24.95s/trial, best loss: -0.555] 32%|███▏      | 32/100 [19:09<33:05, 29.19s/trial, best loss: -0.555] 33%|███▎      | 33/100 [19:36<31:53, 28.55s/trial, best loss: -0.555] 34%|███▍      | 34/100 [20:04<31:06, 28.27s/trial, best loss: -0.555] 35%|███▌      | 35/100 [20:30<29:58, 27.68s/trial, best loss: -0.555] 36%|███▌      | 36/100 [21:04<31:29, 29.53s/trial, best loss: -0.555] 37%|███▋      | 37/100 [21:31<30:16, 28.84s/trial, best loss: -0.555] 38%|███▊      | 38/100 [22:18<35:18, 34.17s/trial, best loss: -0.555] 39%|███▉      | 39/100 [23:04<38:30, 37.88s/trial, best loss: -0.555] 40%|████      | 40/100 [23:51<40:39, 40.67s/trial, best loss: -0.555] 41%|████      | 41/100 [25:08<50:31, 51.37s/trial, best loss: -0.555] 42%|████▏     | 42/100 [25:47<46:14, 47.83s/trial, best loss: -0.555] 43%|████▎     | 43/100 [26:23<41:53, 44.09s/trial, best loss: -0.555] 44%|████▍     | 44/100 [26:55<37:54, 40.62s/trial, best loss: -0.555] 45%|████▌     | 45/100 [27:58<43:27, 47.41s/trial, best loss: -0.555] 46%|████▌     | 46/100 [28:24<36:49, 40.91s/trial, best loss: -0.555] 47%|████▋     | 47/100 [29:32<43:23, 49.11s/trial, best loss: -0.555] 48%|████▊     | 48/100 [30:19<41:56, 48.39s/trial, best loss: -0.555] 49%|████▉     | 49/100 [31:05<40:29, 47.64s/trial, best loss: -0.555] 50%|█████     | 50/100 [31:51<39:15, 47.11s/trial, best loss: -0.555] 51%|█████     | 51/100 [32:22<34:31, 42.28s/trial, best loss: -0.555] 52%|█████▏    | 52/100 [34:00<47:11, 59.00s/trial, best loss: -0.555] 53%|█████▎    | 53/100 [34:57<45:40, 58.32s/trial, best loss: -0.555] 54%|█████▍    | 54/100 [35:24<37:41, 49.16s/trial, best loss: -0.555] 55%|█████▌    | 55/100 [35:53<32:20, 43.12s/trial, best loss: -0.555] 56%|█████▌    | 56/100 [36:38<32:01, 43.67s/trial, best loss: -0.555] 57%|█████▋    | 57/100 [37:25<31:54, 44.53s/trial, best loss: -0.555] 58%|█████▊    | 58/100 [38:04<29:58, 42.81s/trial, best loss: -0.555] 59%|█████▉    | 59/100 [39:00<31:59, 46.83s/trial, best loss: -0.555] 60%|██████    | 60/100 [39:39<29:46, 44.65s/trial, best loss: -0.555] 61%|██████    | 61/100 [40:11<26:26, 40.67s/trial, best loss: -0.555] 62%|██████▏   | 62/100 [40:43<24:14, 38.27s/trial, best loss: -0.555] 63%|██████▎   | 63/100 [41:15<22:22, 36.30s/trial, best loss: -0.555] 64%|██████▍   | 64/100 [41:39<19:36, 32.67s/trial, best loss: -0.555] 65%|██████▌   | 65/100 [42:06<18:04, 30.98s/trial, best loss: -0.555] 66%|██████▌   | 66/100 [42:54<20:18, 35.84s/trial, best loss: -0.555] 67%|██████▋   | 67/100 [43:40<21:30, 39.09s/trial, best loss: -0.555] 68%|██████▊   | 68/100 [44:13<19:49, 37.17s/trial, best loss: -0.555] 69%|██████▉   | 69/100 [44:59<20:35, 39.86s/trial, best loss: -0.555] 70%|███████   | 70/100 [45:41<20:15, 40.52s/trial, best loss: -0.555] 71%|███████   | 71/100 [46:40<22:14, 46.01s/trial, best loss: -0.555] 72%|███████▏  | 72/100 [47:28<21:46, 46.68s/trial, best loss: -0.555] 73%|███████▎  | 73/100 [48:04<19:33, 43.45s/trial, best loss: -0.555] 74%|███████▍  | 74/100 [48:43<18:15, 42.15s/trial, best loss: -0.555] 75%|███████▌  | 75/100 [49:22<17:12, 41.28s/trial, best loss: -0.555] 76%|███████▌  | 76/100 [50:38<20:39, 51.64s/trial, best loss: -0.555] 77%|███████▋  | 77/100 [51:35<20:20, 53.05s/trial, best loss: -0.555] 78%|███████▊  | 78/100 [52:19<18:26, 50.30s/trial, best loss: -0.555] 79%|███████▉  | 79/100 [53:11<17:51, 51.01s/trial, best loss: -0.555] 80%|████████  | 80/100 [54:14<18:12, 54.61s/trial, best loss: -0.555] 81%|████████  | 81/100 [55:11<17:30, 55.31s/trial, best loss: -0.555] 82%|████████▏ | 82/100 [56:04<16:22, 54.59s/trial, best loss: -0.555] 83%|████████▎ | 83/100 [56:53<14:56, 52.76s/trial, best loss: -0.555] 84%|████████▍ | 84/100 [57:16<11:45, 44.10s/trial, best loss: -0.555] 85%|████████▌ | 85/100 [57:57<10:44, 42.99s/trial, best loss: -0.555] 86%|████████▌ | 86/100 [58:40<10:04, 43.15s/trial, best loss: -0.555] 87%|████████▋ | 87/100 [59:08<08:18, 38.36s/trial, best loss: -0.555] 88%|████████▊ | 88/100 [59:59<08:27, 42.30s/trial, best loss: -0.555] 89%|████████▉ | 89/100 [1:00:25<06:51, 37.44s/trial, best loss: -0.555] 90%|█████████ | 90/100 [1:01:09<06:34, 39.41s/trial, best loss: -0.555] 91%|█████████ | 91/100 [1:01:49<05:57, 39.67s/trial, best loss: -0.555] 92%|█████████▏| 92/100 [1:02:22<05:00, 37.61s/trial, best loss: -0.555] 93%|█████████▎| 93/100 [1:02:51<04:05, 35.10s/trial, best loss: -0.555] 94%|█████████▍| 94/100 [1:03:16<03:11, 31.99s/trial, best loss: -0.555] 95%|█████████▌| 95/100 [1:03:43<02:31, 30.34s/trial, best loss: -0.555] 96%|█████████▌| 96/100 [1:04:05<01:51, 27.94s/trial, best loss: -0.5553] 97%|█████████▋| 97/100 [1:04:26<01:17, 25.72s/trial, best loss: -0.5553] 98%|█████████▊| 98/100 [1:04:48<00:49, 24.70s/trial, best loss: -0.5553] 99%|█████████▉| 99/100 [1:05:10<00:23, 23.89s/trial, best loss: -0.5553]100%|██████████| 100/100 [1:05:32<00:00, 23.24s/trial, best loss: -0.5553]100%|██████████| 100/100 [1:05:32<00:00, 39.32s/trial, best loss: -0.5553]
최적화 완료. 최적 파라미터: {'colsample_bytree': 0.9769370950862077, 'learning_rate': 0.1764000566930516, 'max_depth': 12.0, 'min_child_weight': 10.0, 'num_leaves': 91.0, 'reg_alpha': 0.6762919971030734, 'reg_lambda': 0.03005966611480329, 'subsample': 0.9604108699036754}
최적 CSI 점수: 0.5553 (loss: -0.5553)

최적화 과정 요약:
  - 총 시도 횟수: 100
  - 성공한 시도: 100
  - 최초 CSI: 0.5401
  - 최종 CSI: 0.5426
  - 최고 CSI: 0.5553
  - 최저 CSI: 0.5338
  - 평균 CSI: 0.5466

최적화 Trials 객체가 /workspace/visibility_prediction/Analysis_code/optimization_history/lgb_smotenc_ctgan10000_seoul_trials.pkl에 저장되었습니다.
최종 모델 학습 시작...
Fold 1 학습 중... (학습 연도: [2018, 2019], 검증 연도: 2020)
Fold 1 검증 CSI: 0.4694
Fold 2 학습 중... (학습 연도: [2018, 2020], 검증 연도: 2019)
Fold 2 검증 CSI: 0.6066
Fold 3 학습 중... (학습 연도: [2019, 2020], 검증 연도: 2018)
Fold 3 검증 CSI: 0.5771
모델 저장 중...
모델이 /workspace/visibility_prediction/Analysis_code/save_model/lgb_optima/lgb_smotenc_ctgan10000_seoul.pkl에 저장되었습니다.

✓ 완료: lgb_smotenc_ctgan10000/LGB_smotenc_ctgan10000_seoul.py (소요 시간: 3943초)

==========================================
LGB SMOTENC CTGAN10000 파일 실행 완료
종료 시간: 2026-01-07 18:25:05
총 소요 시간: 6시간 37분 47초
성공: 6개
실패: 0개
==========================================
