nohup: ignoring input
/bin/bash: /opt/conda/lib/libtinfo.so.6: no version information available (required by /bin/bash)
==========================================
LGB Pure 파일 실행 시작
시작 시간: 2025-12-27 16:01:58
GPU: 1번 (os.environ['CUDA_VISIBLE_DEVICES'] = '1')
==========================================

----------------------------------------
실행 중: lgb_pure/LGB_pure_busan.py
시작 시간: 2025-12-27 16:01:58
----------------------------------------
데이터 로딩 중...
데이터 전처리 중...
하이퍼파라미터 최적화 시작...

  0%|          | 0/100 [00:00<?, ?trial/s, best loss=?]1 warning generated.
1 warning generated.
1 warning generated.
1 warning generated.
1 warning generated.
1 warning generated.
1 warning generated.
1 warning generated.
1 warning generated.
1 warning generated.
1 warning generated.
1 warning generated.
1 warning generated.
1 warning generated.
1 warning generated.
1 warning generated.
1 warning generated.
1 warning generated.
1 warning generated.
1 warning generated.
1 warning generated.
1 warning generated.
1 warning generated.
1 warning generated.
1 warning generated.
1 warning generated.
1 warning generated.
1 warning generated.
1 warning generated.
1 warning generated.
1 warning generated.
1 warning generated.
1 warning generated.
  1%|          | 1/100 [06:43<11:05:49, 403.54s/trial, best loss: -0.4676]  2%|▏         | 2/100 [10:57<8:35:16, 315.47s/trial, best loss: -0.4676]   3%|▎         | 3/100 [18:08<9:55:16, 368.21s/trial, best loss: -0.4676]  4%|▍         | 4/100 [21:23<8:00:00, 300.01s/trial, best loss: -0.4676]  5%|▌         | 5/100 [26:07<7:45:43, 294.15s/trial, best loss: -0.4676]  6%|▌         | 6/100 [30:34<7:26:07, 284.76s/trial, best loss: -0.4676]  7%|▋         | 7/100 [33:51<6:37:16, 256.30s/trial, best loss: -0.4676]  8%|▊         | 8/100 [39:39<7:17:34, 285.38s/trial, best loss: -0.4676]  9%|▉         | 9/100 [42:56<6:30:59, 257.79s/trial, best loss: -0.4789] 10%|█         | 10/100 [47:32<6:35:15, 263.51s/trial, best loss: -0.4789] 11%|█         | 11/100 [51:50<6:28:18, 261.78s/trial, best loss: -0.4789] 12%|█▏        | 12/100 [55:26<6:03:31, 247.86s/trial, best loss: -0.4789] 13%|█▎        | 13/100 [58:10<5:22:33, 222.45s/trial, best loss: -0.4789] 14%|█▍        | 14/100 [1:01:52<5:18:27, 222.18s/trial, best loss: -0.4789] 15%|█▌        | 15/100 [1:05:27<5:11:49, 220.11s/trial, best loss: -0.4789] 16%|█▌        | 16/100 [1:09:13<5:10:41, 221.92s/trial, best loss: -0.4789] 17%|█▋        | 17/100 [1:14:41<5:50:51, 253.64s/trial, best loss: -0.4789] 18%|█▊        | 18/100 [1:18:13<5:29:30, 241.10s/trial, best loss: -0.4789] 19%|█▉        | 19/100 [1:22:54<5:41:54, 253.26s/trial, best loss: -0.4789] 20%|██        | 20/100 [1:27:55<5:56:46, 267.58s/trial, best loss: -0.4789] 21%|██        | 21/100 [1:34:43<6:47:53, 309.80s/trial, best loss: -0.4789] 22%|██▏       | 22/100 [1:39:11<6:26:17, 297.15s/trial, best loss: -0.4789] 23%|██▎       | 23/100 [1:44:31<6:29:59, 303.89s/trial, best loss: -0.4789] 24%|██▍       | 24/100 [1:49:49<6:30:20, 308.17s/trial, best loss: -0.4789] 25%|██▌       | 25/100 [1:53:39<5:55:53, 284.71s/trial, best loss: -0.4789] 26%|██▌       | 26/100 [2:02:48<7:28:58, 364.04s/trial, best loss: -0.4789] 27%|██▋       | 27/100 [2:10:19<7:54:50, 390.29s/trial, best loss: -0.4789] 28%|██▊       | 28/100 [2:15:53<7:28:04, 373.40s/trial, best loss: -0.4789] 29%|██▉       | 29/100 [2:18:25<6:03:01, 306.78s/trial, best loss: -0.4789] 30%|███       | 30/100 [2:22:59<5:46:25, 296.93s/trial, best loss: -0.4789] 31%|███       | 31/100 [2:30:15<6:29:29, 338.69s/trial, best loss: -0.4789] 32%|███▏      | 32/100 [2:37:08<6:49:04, 360.95s/trial, best loss: -0.4789] 33%|███▎      | 33/100 [2:40:47<5:55:32, 318.39s/trial, best loss: -0.4789] 34%|███▍      | 34/100 [2:44:30<5:18:49, 289.85s/trial, best loss: -0.4789] 35%|███▌      | 35/100 [2:57:09<7:46:31, 430.64s/trial, best loss: -0.4789] 36%|███▌      | 36/100 [3:00:26<6:24:32, 360.51s/trial, best loss: -0.4789] 37%|███▋      | 37/100 [3:04:29<5:41:24, 325.16s/trial, best loss: -0.4789] 38%|███▊      | 38/100 [3:07:29<4:51:11, 281.80s/trial, best loss: -0.4789] 39%|███▉      | 39/100 [3:10:35<4:17:06, 252.90s/trial, best loss: -0.4789] 40%|████      | 40/100 [3:15:15<4:21:09, 261.16s/trial, best loss: -0.4789] 41%|████      | 41/100 [3:20:18<4:29:10, 273.74s/trial, best loss: -0.4789] 42%|████▏     | 42/100 [3:24:27<4:17:18, 266.18s/trial, best loss: -0.48]   43%|████▎     | 43/100 [3:28:37<4:08:14, 261.30s/trial, best loss: -0.48] 44%|████▍     | 44/100 [3:32:37<3:57:51, 254.84s/trial, best loss: -0.48] 45%|████▌     | 45/100 [3:35:58<3:38:53, 238.78s/trial, best loss: -0.48] 46%|████▌     | 46/100 [3:40:25<3:42:33, 247.28s/trial, best loss: -0.48] 47%|████▋     | 47/100 [3:43:38<3:24:05, 231.05s/trial, best loss: -0.48] 48%|████▊     | 48/100 [3:46:54<3:11:05, 220.48s/trial, best loss: -0.48] 49%|████▉     | 49/100 [3:49:47<2:55:23, 206.33s/trial, best loss: -0.48] 50%|█████     | 50/100 [3:54:27<3:10:13, 228.27s/trial, best loss: -0.48] 51%|█████     | 51/100 [3:59:21<3:22:39, 248.16s/trial, best loss: -0.48] 52%|█████▏    | 52/100 [4:03:06<3:12:52, 241.09s/trial, best loss: -0.48] 53%|█████▎    | 53/100 [4:06:30<3:00:14, 230.09s/trial, best loss: -0.48] 54%|█████▍    | 54/100 [4:09:27<2:44:03, 214.00s/trial, best loss: -0.48] 55%|█████▌    | 55/100 [4:11:47<2:23:57, 191.95s/trial, best loss: -0.48] 56%|█████▌    | 56/100 [4:14:25<2:13:07, 181.54s/trial, best loss: -0.48] 57%|█████▋    | 57/100 [4:19:42<2:39:25, 222.45s/trial, best loss: -0.48] 58%|█████▊    | 58/100 [4:24:31<2:49:37, 242.33s/trial, best loss: -0.48] 59%|█████▉    | 59/100 [4:28:53<2:49:41, 248.33s/trial, best loss: -0.48] 60%|██████    | 60/100 [4:31:46<2:30:26, 225.66s/trial, best loss: -0.48] 61%|██████    | 61/100 [4:34:24<2:13:27, 205.31s/trial, best loss: -0.48] 62%|██████▏   | 62/100 [4:38:13<2:14:30, 212.39s/trial, best loss: -0.48] 63%|██████▎   | 63/100 [4:43:06<2:25:48, 236.46s/trial, best loss: -0.48] 64%|██████▍   | 64/100 [4:46:31<2:16:11, 226.99s/trial, best loss: -0.48] 65%|██████▌   | 65/100 [4:53:33<2:46:32, 285.50s/trial, best loss: -0.48] 66%|██████▌   | 66/100 [4:56:45<2:26:00, 257.67s/trial, best loss: -0.48] 67%|██████▋   | 67/100 [5:00:32<2:16:39, 248.47s/trial, best loss: -0.48] 68%|██████▊   | 68/100 [5:04:03<2:06:33, 237.29s/trial, best loss: -0.4849] 69%|██████▉   | 69/100 [5:07:50<2:00:53, 233.98s/trial, best loss: -0.4849] 70%|███████   | 70/100 [5:11:31<1:55:07, 230.24s/trial, best loss: -0.4849] 71%|███████   | 71/100 [5:14:30<1:43:50, 214.85s/trial, best loss: -0.4849] 72%|███████▏  | 72/100 [5:17:38<1:36:31, 206.83s/trial, best loss: -0.4849] 73%|███████▎  | 73/100 [5:21:24<1:35:40, 212.60s/trial, best loss: -0.4849] 74%|███████▍  | 74/100 [5:24:57<1:32:05, 212.50s/trial, best loss: -0.4849] 75%|███████▌  | 75/100 [5:28:22<1:27:42, 210.49s/trial, best loss: -0.4849] 76%|███████▌  | 76/100 [5:32:22<1:27:43, 219.30s/trial, best loss: -0.4849] 77%|███████▋  | 77/100 [5:35:47<1:22:26, 215.04s/trial, best loss: -0.4849] 78%|███████▊  | 78/100 [5:38:30<1:13:07, 199.42s/trial, best loss: -0.4849] 79%|███████▉  | 79/100 [5:42:38<1:14:50, 213.84s/trial, best loss: -0.4849] 80%|████████  | 80/100 [5:47:27<1:18:49, 236.48s/trial, best loss: -0.4849] 81%|████████  | 81/100 [5:53:23<1:26:11, 272.19s/trial, best loss: -0.4849] 82%|████████▏ | 82/100 [5:57:36<1:19:56, 266.46s/trial, best loss: -0.4849] 83%|████████▎ | 83/100 [6:01:09<1:10:59, 250.55s/trial, best loss: -0.4849] 84%|████████▍ | 84/100 [6:06:22<1:11:48, 269.25s/trial, best loss: -0.4849] 85%|████████▌ | 85/100 [6:10:00<1:03:27, 253.87s/trial, best loss: -0.4849] 86%|████████▌ | 86/100 [6:14:06<58:41, 251.56s/trial, best loss: -0.4849]   87%|████████▋ | 87/100 [6:18:11<54:05, 249.66s/trial, best loss: -0.4849] 88%|████████▊ | 88/100 [6:21:46<47:49, 239.16s/trial, best loss: -0.4849] 89%|████████▉ | 89/100 [6:26:02<44:46, 244.20s/trial, best loss: -0.4849] 90%|█████████ | 90/100 [6:29:35<39:09, 234.92s/trial, best loss: -0.4849] 91%|█████████ | 91/100 [6:32:51<33:28, 223.18s/trial, best loss: -0.4849] 92%|█████████▏| 92/100 [6:36:05<28:35, 214.44s/trial, best loss: -0.4849] 93%|█████████▎| 93/100 [6:38:59<23:36, 202.33s/trial, best loss: -0.4849] 94%|█████████▍| 94/100 [6:42:09<19:51, 198.60s/trial, best loss: -0.4849] 95%|█████████▌| 95/100 [6:45:36<16:44, 200.95s/trial, best loss: -0.4849] 96%|█████████▌| 96/100 [6:50:50<15:40, 235.02s/trial, best loss: -0.4849] 97%|█████████▋| 97/100 [6:54:29<11:30, 230.21s/trial, best loss: -0.4849] 98%|█████████▊| 98/100 [6:57:15<07:01, 210.85s/trial, best loss: -0.4849] 99%|█████████▉| 99/100 [7:03:18<04:16, 256.57s/trial, best loss: -0.4849]100%|██████████| 100/100 [7:07:45<00:00, 259.71s/trial, best loss: -0.4849]100%|██████████| 100/100 [7:07:45<00:00, 256.66s/trial, best loss: -0.4849]

최적화 완료. 최적 파라미터: {'colsample_bytree': 0.9406061312055983, 'learning_rate': 0.17468151642796886, 'max_depth': 6.0, 'min_child_weight': 17.0, 'num_leaves': 138.0, 'reg_alpha': 0.4593420461637059, 'reg_lambda': 0.5948987302333338, 'subsample': 0.6557839186758097}
최적 CSI 점수: 0.4849 (loss: -0.4849)

최적화 과정 요약:
  - 총 시도 횟수: 100
  - 성공한 시도: 100
  - 최초 CSI: 0.4676
  - 최종 CSI: 0.4718
  - 최고 CSI: 0.4849
  - 최저 CSI: 0.4314
  - 평균 CSI: 0.4661

최적화 Trials 객체가 /workspace/visibility_prediction/Analysis_code/optimization_history/lgb_pure_busan_trials.pkl에 저장되었습니다.
최종 모델 학습 시작...
Fold 1 학습 중... (학습 연도: [2018, 2019], 검증 연도: 2020)
Fold 1 검증 CSI: 0.3911
Fold 2 학습 중... (학습 연도: [2018, 2020], 검증 연도: 2019)
Fold 2 검증 CSI: 0.5193
Fold 3 학습 중... (학습 연도: [2019, 2020], 검증 연도: 2018)
Fold 3 검증 CSI: 0.5177
모델 저장 중...
모델이 /workspace/visibility_prediction/Analysis_code/save_model/lgb_optima/lgb_pure_busan.pkl에 저장되었습니다.

✓ 완료: lgb_pure/LGB_pure_busan.py (소요 시간: 25719초)

==========================================
LGB Pure 파일 실행 완료
종료 시간: 2025-12-27 23:10:37
총 소요 시간: 7시간 8분 39초
성공: 1개
실패: 0개
==========================================
