nohup: ignoring input
/bin/bash: /opt/conda/lib/libtinfo.so.6: no version information available (required by /bin/bash)
==========================================
LGB SMOTE 파일 실행 시작
시작 시간: 2025-12-27 13:17:48
GPU: 1번 (os.environ['CUDA_VISIBLE_DEVICES'] = '1')
==========================================

----------------------------------------
실행 중: lgb_smote/LGB_smote_busan.py
시작 시간: 2025-12-27 13:17:48
----------------------------------------
데이터 로딩 중...
데이터 전처리 중...
하이퍼파라미터 최적화 시작...

  0%|          | 0/100 [00:00<?, ?trial/s, best loss=?]
  1%|          | 1/100 [00:25<41:20, 25.05s/trial, best loss: -0.4627]
  2%|▏         | 2/100 [00:49<39:53, 24.42s/trial, best loss: -0.4627]
  3%|▎         | 3/100 [01:10<37:12, 23.02s/trial, best loss: -0.4627]
  4%|▍         | 4/100 [01:59<53:29, 33.44s/trial, best loss: -0.4627]
  5%|▌         | 5/100 [02:21<46:21, 29.27s/trial, best loss: -0.4627]
  6%|▌         | 6/100 [02:53<47:13, 30.14s/trial, best loss: -0.468] 
  7%|▋         | 7/100 [03:45<57:43, 37.24s/trial, best loss: -0.4703]
  8%|▊         | 8/100 [04:45<1:08:05, 44.41s/trial, best loss: -0.4703]
  9%|▉         | 9/100 [05:05<55:46, 36.77s/trial, best loss: -0.4703]  
 10%|█         | 10/100 [05:42<55:36, 37.08s/trial, best loss: -0.4703]
 11%|█         | 11/100 [06:08<49:36, 33.44s/trial, best loss: -0.4703]
 12%|█▏        | 12/100 [06:46<51:16, 34.96s/trial, best loss: -0.4703]
 13%|█▎        | 13/100 [07:18<49:14, 33.96s/trial, best loss: -0.472] 
 14%|█▍        | 14/100 [07:48<47:10, 32.91s/trial, best loss: -0.472]
 15%|█▌        | 15/100 [08:11<42:15, 29.83s/trial, best loss: -0.472]
 16%|█▌        | 16/100 [08:35<39:26, 28.17s/trial, best loss: -0.472]
 17%|█▋        | 17/100 [09:17<44:37, 32.25s/trial, best loss: -0.472]
 18%|█▊        | 18/100 [09:50<44:20, 32.44s/trial, best loss: -0.472]
 19%|█▉        | 19/100 [10:33<48:18, 35.78s/trial, best loss: -0.472]
 20%|██        | 20/100 [11:15<50:13, 37.67s/trial, best loss: -0.4759]
 21%|██        | 21/100 [11:57<51:10, 38.87s/trial, best loss: -0.4759]
 22%|██▏       | 22/100 [12:37<51:03, 39.28s/trial, best loss: -0.4759]
 23%|██▎       | 23/100 [13:16<50:17, 39.19s/trial, best loss: -0.4759]
 24%|██▍       | 24/100 [14:01<51:41, 40.81s/trial, best loss: -0.4759]
 25%|██▌       | 25/100 [14:55<56:02, 44.83s/trial, best loss: -0.4759]
 26%|██▌       | 26/100 [15:28<50:45, 41.16s/trial, best loss: -0.4759]
 27%|██▋       | 27/100 [15:56<45:24, 37.32s/trial, best loss: -0.4759]
 28%|██▊       | 28/100 [16:40<47:01, 39.19s/trial, best loss: -0.4761]
 29%|██▉       | 29/100 [17:30<50:25, 42.62s/trial, best loss: -0.4761]
 30%|███       | 30/100 [18:02<45:59, 39.43s/trial, best loss: -0.4761]
 31%|███       | 31/100 [18:39<44:31, 38.71s/trial, best loss: -0.4761]
 32%|███▏      | 32/100 [19:22<45:15, 39.93s/trial, best loss: -0.4761]
 33%|███▎      | 33/100 [20:13<48:14, 43.21s/trial, best loss: -0.4761]
 34%|███▍      | 34/100 [20:39<41:54, 38.10s/trial, best loss: -0.4761]
 35%|███▌      | 35/100 [21:36<47:15, 43.63s/trial, best loss: -0.4761]
 36%|███▌      | 36/100 [22:12<44:19, 41.56s/trial, best loss: -0.4761]
 37%|███▋      | 37/100 [22:44<40:22, 38.44s/trial, best loss: -0.4761]
 38%|███▊      | 38/100 [23:10<35:58, 34.82s/trial, best loss: -0.4761]
 39%|███▉      | 39/100 [23:48<36:19, 35.74s/trial, best loss: -0.4761]
 40%|████      | 40/100 [24:09<31:29, 31.49s/trial, best loss: -0.4761]
 41%|████      | 41/100 [25:15<40:55, 41.61s/trial, best loss: -0.4761]
 42%|████▏     | 42/100 [25:54<39:40, 41.04s/trial, best loss: -0.4761]
 43%|████▎     | 43/100 [26:27<36:35, 38.52s/trial, best loss: -0.4761]
 44%|████▍     | 44/100 [27:06<36:00, 38.58s/trial, best loss: -0.4761]
 45%|████▌     | 45/100 [27:30<31:25, 34.29s/trial, best loss: -0.4761]
 46%|████▌     | 46/100 [27:50<27:04, 30.09s/trial, best loss: -0.4761]
 47%|████▋     | 47/100 [28:24<27:40, 31.32s/trial, best loss: -0.4761]
 48%|████▊     | 48/100 [29:10<30:56, 35.70s/trial, best loss: -0.4761]
 49%|████▉     | 49/100 [30:11<36:42, 43.19s/trial, best loss: -0.4761]
 50%|█████     | 50/100 [30:45<33:44, 40.49s/trial, best loss: -0.4761]
 51%|█████     | 51/100 [31:19<31:21, 38.41s/trial, best loss: -0.4761]
 52%|█████▏    | 52/100 [31:43<27:18, 34.14s/trial, best loss: -0.4761]
 53%|█████▎    | 53/100 [32:27<29:03, 37.09s/trial, best loss: -0.4761]
 54%|█████▍    | 54/100 [33:06<28:50, 37.61s/trial, best loss: -0.4761]
 55%|█████▌    | 55/100 [33:32<25:38, 34.20s/trial, best loss: -0.4761]
 56%|█████▌    | 56/100 [33:59<23:26, 31.97s/trial, best loss: -0.4761]
 57%|█████▋    | 57/100 [34:38<24:28, 34.16s/trial, best loss: -0.4763]
 58%|█████▊    | 58/100 [35:31<27:49, 39.76s/trial, best loss: -0.4769]
 59%|█████▉    | 59/100 [36:30<31:11, 45.65s/trial, best loss: -0.4769]
 60%|██████    | 60/100 [37:24<32:08, 48.22s/trial, best loss: -0.4769]
 61%|██████    | 61/100 [38:11<31:07, 47.88s/trial, best loss: -0.4779]
 62%|██████▏   | 62/100 [38:59<30:16, 47.79s/trial, best loss: -0.4779]
 63%|██████▎   | 63/100 [39:18<24:08, 39.15s/trial, best loss: -0.4779]
 64%|██████▍   | 64/100 [40:08<25:31, 42.54s/trial, best loss: -0.4779]
 65%|██████▌   | 65/100 [41:06<27:25, 47.01s/trial, best loss: -0.4779]
 66%|██████▌   | 66/100 [41:49<25:58, 45.84s/trial, best loss: -0.4779]
 67%|██████▋   | 67/100 [42:28<24:01, 43.67s/trial, best loss: -0.4789]
 68%|██████▊   | 68/100 [43:12<23:25, 43.93s/trial, best loss: -0.4789]
 69%|██████▉   | 69/100 [43:58<23:03, 44.62s/trial, best loss: -0.4789]
 70%|███████   | 70/100 [44:54<23:59, 47.97s/trial, best loss: -0.4789]
 71%|███████   | 71/100 [45:37<22:22, 46.29s/trial, best loss: -0.4798]
 72%|███████▏  | 72/100 [46:19<21:02, 45.08s/trial, best loss: -0.4798]
 73%|███████▎  | 73/100 [47:00<19:43, 43.82s/trial, best loss: -0.4798]
 74%|███████▍  | 74/100 [47:36<18:02, 41.65s/trial, best loss: -0.4798]
 75%|███████▌  | 75/100 [48:07<16:01, 38.47s/trial, best loss: -0.4798]
 76%|███████▌  | 76/100 [48:51<15:59, 39.97s/trial, best loss: -0.4798]
 77%|███████▋  | 77/100 [49:28<14:57, 39.03s/trial, best loss: -0.4798]
 78%|███████▊  | 78/100 [50:03<13:51, 37.82s/trial, best loss: -0.4798]
 79%|███████▉  | 79/100 [50:49<14:08, 40.41s/trial, best loss: -0.4798]
 80%|████████  | 80/100 [51:29<13:23, 40.17s/trial, best loss: -0.4798]
 81%|████████  | 81/100 [52:18<13:35, 42.94s/trial, best loss: -0.4798]
 82%|████████▏ | 82/100 [53:01<12:51, 42.89s/trial, best loss: -0.4798]
 83%|████████▎ | 83/100 [53:33<11:13, 39.64s/trial, best loss: -0.4798]
 84%|████████▍ | 84/100 [54:06<10:00, 37.54s/trial, best loss: -0.4798]
 85%|████████▌ | 85/100 [54:52<10:04, 40.33s/trial, best loss: -0.4798]
 86%|████████▌ | 86/100 [55:34<09:31, 40.83s/trial, best loss: -0.4798]
 87%|████████▋ | 87/100 [56:05<08:10, 37.76s/trial, best loss: -0.4798]
 88%|████████▊ | 88/100 [56:36<07:09, 35.77s/trial, best loss: -0.4798]
 89%|████████▉ | 89/100 [57:06<06:12, 33.91s/trial, best loss: -0.4798]
 90%|█████████ | 90/100 [57:52<06:15, 37.54s/trial, best loss: -0.4798]
 91%|█████████ | 91/100 [58:33<05:47, 38.65s/trial, best loss: -0.4798]
 92%|█████████▏| 92/100 [59:07<04:58, 37.37s/trial, best loss: -0.4798]
 93%|█████████▎| 93/100 [59:50<04:32, 38.86s/trial, best loss: -0.4798]
 94%|█████████▍| 94/100 [1:00:18<03:34, 35.76s/trial, best loss: -0.4798]
 95%|█████████▌| 95/100 [1:00:52<02:56, 35.30s/trial, best loss: -0.4798]
 96%|█████████▌| 96/100 [1:01:27<02:20, 35.18s/trial, best loss: -0.4798]
 97%|█████████▋| 97/100 [1:02:06<01:48, 36.13s/trial, best loss: -0.4798]
 98%|█████████▊| 98/100 [1:02:49<01:16, 38.32s/trial, best loss: -0.4798]
 99%|█████████▉| 99/100 [1:03:55<00:46, 46.54s/trial, best loss: -0.4798]
100%|██████████| 100/100 [1:04:19<00:00, 39.91s/trial, best loss: -0.4798]
100%|██████████| 100/100 [1:04:19<00:00, 38.60s/trial, best loss: -0.4798]
최적화 완료. 최적 파라미터: {'colsample_bytree': 0.8798108126736107, 'learning_rate': 0.018973645502331604, 'max_depth': 15.0, 'min_child_weight': 12.0, 'num_leaves': 147.0, 'reg_alpha': 0.03444822116314217, 'reg_lambda': 0.19407225134838502, 'subsample': 0.7009485341014761}
최적 CSI 점수: 0.4798 (loss: -0.4798)

최적화 과정 요약:
  - 총 시도 횟수: 100
  - 성공한 시도: 100
  - 최초 CSI: 0.4627
  - 최종 CSI: 0.4698
  - 최고 CSI: 0.4798
  - 최저 CSI: 0.4550
  - 평균 CSI: 0.4683

최적화 Trials 객체가 /workspace/visibility_prediction/Analysis_code/optimization_history/lgb_smote_busan_trials.pkl에 저장되었습니다.
최종 모델 학습 시작...
Fold 1 학습 중... (학습 연도: [2018, 2019], 검증 연도: 2020)
Fold 1 검증 CSI: 0.4574
Fold 2 학습 중... (학습 연도: [2018, 2020], 검증 연도: 2019)
Fold 2 검증 CSI: 0.4773
Fold 3 학습 중... (학습 연도: [2019, 2020], 검증 연도: 2018)
Fold 3 검증 CSI: 0.4583
모델 저장 중...
모델이 /workspace/visibility_prediction/Analysis_code/save_model/lgb_optima/lgb_smote_busan.pkl에 저장되었습니다.

✓ 완료: lgb_smote/LGB_smote_busan.py (소요 시간: 3892초)

----------------------------------------
실행 중: lgb_smote/LGB_smote_daegu.py
시작 시간: 2025-12-27 14:22:40
----------------------------------------
데이터 로딩 중...
데이터 전처리 중...
하이퍼파라미터 최적화 시작...

  0%|          | 0/100 [00:00<?, ?trial/s, best loss=?]
  1%|          | 1/100 [00:25<42:30, 25.76s/trial, best loss: -0.4483]
  2%|▏         | 2/100 [00:45<35:48, 21.93s/trial, best loss: -0.4483]
  3%|▎         | 3/100 [01:10<38:23, 23.74s/trial, best loss: -0.4552]
  4%|▍         | 4/100 [01:32<36:30, 22.82s/trial, best loss: -0.4594]
  5%|▌         | 5/100 [01:58<38:08, 24.09s/trial, best loss: -0.4594]
  6%|▌         | 6/100 [02:43<48:35, 31.02s/trial, best loss: -0.4594]
  7%|▋         | 7/100 [03:02<42:05, 27.16s/trial, best loss: -0.4594]
  8%|▊         | 8/100 [03:32<42:57, 28.02s/trial, best loss: -0.4624]
  9%|▉         | 9/100 [03:57<41:10, 27.14s/trial, best loss: -0.4624]
 10%|█         | 10/100 [04:30<43:41, 29.13s/trial, best loss: -0.4624]
 11%|█         | 11/100 [05:04<45:24, 30.62s/trial, best loss: -0.4624]
 12%|█▏        | 12/100 [05:39<46:49, 31.92s/trial, best loss: -0.4624]
 13%|█▎        | 13/100 [06:18<49:23, 34.06s/trial, best loss: -0.4624]
 14%|█▍        | 14/100 [06:52<48:33, 33.87s/trial, best loss: -0.4624]
 15%|█▌        | 15/100 [07:27<48:28, 34.22s/trial, best loss: -0.4624]
 16%|█▌        | 16/100 [07:49<42:46, 30.56s/trial, best loss: -0.4624]
 17%|█▋        | 17/100 [08:22<43:07, 31.18s/trial, best loss: -0.4624]
 18%|█▊        | 18/100 [09:24<55:39, 40.73s/trial, best loss: -0.4624]
 19%|█▉        | 19/100 [09:48<48:04, 35.61s/trial, best loss: -0.4624]
 20%|██        | 20/100 [10:33<51:14, 38.43s/trial, best loss: -0.4624]
 21%|██        | 21/100 [11:02<46:43, 35.48s/trial, best loss: -0.4624]
 22%|██▏       | 22/100 [11:30<43:12, 33.24s/trial, best loss: -0.4624]
 23%|██▎       | 23/100 [12:09<44:47, 34.90s/trial, best loss: -0.4624]
 24%|██▍       | 24/100 [12:42<43:35, 34.41s/trial, best loss: -0.4624]
 25%|██▌       | 25/100 [13:09<40:19, 32.26s/trial, best loss: -0.4624]
 26%|██▌       | 26/100 [13:26<34:17, 27.80s/trial, best loss: -0.4624]
 27%|██▋       | 27/100 [14:07<38:28, 31.63s/trial, best loss: -0.4637]
 28%|██▊       | 28/100 [14:41<38:37, 32.19s/trial, best loss: -0.4637]
 29%|██▉       | 29/100 [15:03<34:38, 29.28s/trial, best loss: -0.4637]
 30%|███       | 30/100 [15:47<39:10, 33.58s/trial, best loss: -0.4637]
 31%|███       | 31/100 [16:25<40:07, 34.90s/trial, best loss: -0.4637]
 32%|███▏      | 32/100 [16:50<36:10, 31.92s/trial, best loss: -0.4653]
 33%|███▎      | 33/100 [17:12<32:25, 29.03s/trial, best loss: -0.4658]
 34%|███▍      | 34/100 [17:35<29:59, 27.27s/trial, best loss: -0.4658]
 35%|███▌      | 35/100 [18:04<30:04, 27.76s/trial, best loss: -0.4658]
 36%|███▌      | 36/100 [18:39<31:57, 29.97s/trial, best loss: -0.4658]
 37%|███▋      | 37/100 [18:57<27:41, 26.37s/trial, best loss: -0.4658]
 38%|███▊      | 38/100 [19:17<25:14, 24.43s/trial, best loss: -0.4658]
 39%|███▉      | 39/100 [19:42<24:58, 24.57s/trial, best loss: -0.4658]
 40%|████      | 40/100 [20:02<23:11, 23.19s/trial, best loss: -0.4658]
 41%|████      | 41/100 [20:28<23:36, 24.01s/trial, best loss: -0.4658]
 42%|████▏     | 42/100 [20:54<23:57, 24.78s/trial, best loss: -0.4658]
 43%|████▎     | 43/100 [21:16<22:35, 23.78s/trial, best loss: -0.4658]
 44%|████▍     | 44/100 [21:38<21:49, 23.39s/trial, best loss: -0.4658]
 45%|████▌     | 45/100 [22:09<23:33, 25.70s/trial, best loss: -0.4658]
 46%|████▌     | 46/100 [22:28<21:16, 23.63s/trial, best loss: -0.4658]
 47%|████▋     | 47/100 [22:53<21:08, 23.94s/trial, best loss: -0.4658]
 48%|████▊     | 48/100 [23:14<20:06, 23.20s/trial, best loss: -0.4658]
 49%|████▉     | 49/100 [23:38<19:51, 23.36s/trial, best loss: -0.4658]
 50%|█████     | 50/100 [24:05<20:18, 24.38s/trial, best loss: -0.4658]
 51%|█████     | 51/100 [24:42<23:05, 28.28s/trial, best loss: -0.4658]
 52%|█████▏    | 52/100 [24:59<19:55, 24.90s/trial, best loss: -0.4658]
 53%|█████▎    | 53/100 [25:20<18:37, 23.77s/trial, best loss: -0.4658]
 54%|█████▍    | 54/100 [25:51<19:50, 25.89s/trial, best loss: -0.4658]
 55%|█████▌    | 55/100 [26:12<18:20, 24.46s/trial, best loss: -0.4658]
 56%|█████▌    | 56/100 [26:51<21:11, 28.91s/trial, best loss: -0.4658]
 57%|█████▋    | 57/100 [27:14<19:22, 27.04s/trial, best loss: -0.4658]
 58%|█████▊    | 58/100 [27:45<19:41, 28.12s/trial, best loss: -0.4658]
 59%|█████▉    | 59/100 [28:23<21:14, 31.09s/trial, best loss: -0.4658]
 60%|██████    | 60/100 [28:48<19:34, 29.35s/trial, best loss: -0.4658]
 61%|██████    | 61/100 [29:21<19:51, 30.55s/trial, best loss: -0.4658]
 62%|██████▏   | 62/100 [29:43<17:36, 27.80s/trial, best loss: -0.4658]
 63%|██████▎   | 63/100 [30:16<18:04, 29.32s/trial, best loss: -0.4658]
 64%|██████▍   | 64/100 [30:45<17:35, 29.33s/trial, best loss: -0.4658]
 65%|██████▌   | 65/100 [31:05<15:30, 26.60s/trial, best loss: -0.4658]
 66%|██████▌   | 66/100 [31:39<16:12, 28.59s/trial, best loss: -0.4658]
 67%|██████▋   | 67/100 [32:23<18:20, 33.33s/trial, best loss: -0.4658]
 68%|██████▊   | 68/100 [33:05<19:10, 35.96s/trial, best loss: -0.4658]
 69%|██████▉   | 69/100 [33:34<17:34, 34.00s/trial, best loss: -0.4658]
 70%|███████   | 70/100 [34:21<18:56, 37.90s/trial, best loss: -0.4658]
 71%|███████   | 71/100 [34:48<16:36, 34.37s/trial, best loss: -0.4658]
 72%|███████▏  | 72/100 [35:11<14:34, 31.23s/trial, best loss: -0.4658]
 73%|███████▎  | 73/100 [35:37<13:15, 29.46s/trial, best loss: -0.4658]
 74%|███████▍  | 74/100 [36:23<14:57, 34.53s/trial, best loss: -0.4658]
 75%|███████▌  | 75/100 [37:01<14:46, 35.44s/trial, best loss: -0.4658]
 76%|███████▌  | 76/100 [37:33<13:49, 34.55s/trial, best loss: -0.4658]
 77%|███████▋  | 77/100 [38:09<13:19, 34.77s/trial, best loss: -0.4658]
 78%|███████▊  | 78/100 [38:33<11:40, 31.82s/trial, best loss: -0.4658]
 79%|███████▉  | 79/100 [38:54<09:55, 28.34s/trial, best loss: -0.4658]
 80%|████████  | 80/100 [39:33<10:32, 31.61s/trial, best loss: -0.4658]
 81%|████████  | 81/100 [40:22<11:40, 36.88s/trial, best loss: -0.4658]
 82%|████████▏ | 82/100 [40:44<09:40, 32.25s/trial, best loss: -0.4671]
 83%|████████▎ | 83/100 [41:07<08:21, 29.49s/trial, best loss: -0.4671]
 84%|████████▍ | 84/100 [41:36<07:50, 29.42s/trial, best loss: -0.4671]
 85%|████████▌ | 85/100 [41:59<06:52, 27.48s/trial, best loss: -0.4671]
 86%|████████▌ | 86/100 [42:18<05:51, 25.08s/trial, best loss: -0.4671]
 87%|████████▋ | 87/100 [42:39<05:07, 23.66s/trial, best loss: -0.4671]
 88%|████████▊ | 88/100 [43:04<04:48, 24.08s/trial, best loss: -0.4671]
 89%|████████▉ | 89/100 [43:25<04:14, 23.13s/trial, best loss: -0.4671]
 90%|█████████ | 90/100 [43:46<03:46, 22.65s/trial, best loss: -0.4671]
 91%|█████████ | 91/100 [44:04<03:10, 21.16s/trial, best loss: -0.4671]
 92%|█████████▏| 92/100 [44:33<03:09, 23.66s/trial, best loss: -0.4671]
 93%|█████████▎| 93/100 [44:56<02:42, 23.24s/trial, best loss: -0.4671]
 94%|█████████▍| 94/100 [45:26<02:32, 25.43s/trial, best loss: -0.4671]
 95%|█████████▌| 95/100 [45:47<02:00, 24.07s/trial, best loss: -0.4671]
 96%|█████████▌| 96/100 [46:11<01:36, 24.18s/trial, best loss: -0.4671]
 97%|█████████▋| 97/100 [46:38<01:14, 24.82s/trial, best loss: -0.4671]
 98%|█████████▊| 98/100 [47:00<00:48, 24.04s/trial, best loss: -0.4671]
 99%|█████████▉| 99/100 [47:19<00:22, 22.44s/trial, best loss: -0.4671]
100%|██████████| 100/100 [47:41<00:00, 22.56s/trial, best loss: -0.4671]
100%|██████████| 100/100 [47:41<00:00, 28.62s/trial, best loss: -0.4671]
최적화 완료. 최적 파라미터: {'colsample_bytree': 0.999946333457191, 'learning_rate': 0.07031680296643952, 'max_depth': 4.0, 'min_child_weight': 17.0, 'num_leaves': 32.0, 'reg_alpha': 0.055815317687804816, 'reg_lambda': 0.2293760134119255, 'subsample': 0.6363907923464539}
최적 CSI 점수: 0.4671 (loss: -0.4671)

최적화 과정 요약:
  - 총 시도 횟수: 100
  - 성공한 시도: 100
  - 최초 CSI: 0.4483
  - 최종 CSI: 0.4491
  - 최고 CSI: 0.4671
  - 최저 CSI: 0.4238
  - 평균 CSI: 0.4511

최적화 Trials 객체가 /workspace/visibility_prediction/Analysis_code/optimization_history/lgb_smote_daegu_trials.pkl에 저장되었습니다.
최종 모델 학습 시작...
Fold 1 학습 중... (학습 연도: [2018, 2019], 검증 연도: 2020)
Fold 1 검증 CSI: 0.3771
Fold 2 학습 중... (학습 연도: [2018, 2020], 검증 연도: 2019)
Fold 2 검증 CSI: 0.4659
Fold 3 학습 중... (학습 연도: [2019, 2020], 검증 연도: 2018)
Fold 3 검증 CSI: 0.5062
모델 저장 중...
모델이 /workspace/visibility_prediction/Analysis_code/save_model/lgb_optima/lgb_smote_daegu.pkl에 저장되었습니다.

✓ 완료: lgb_smote/LGB_smote_daegu.py (소요 시간: 2870초)

----------------------------------------
실행 중: lgb_smote/LGB_smote_daejeon.py
시작 시간: 2025-12-27 15:10:30
----------------------------------------
데이터 로딩 중...
데이터 전처리 중...
하이퍼파라미터 최적화 시작...

  0%|          | 0/100 [00:00<?, ?trial/s, best loss=?]
  1%|          | 1/100 [00:31<51:57, 31.49s/trial, best loss: -0.5211]
  2%|▏         | 2/100 [01:42<1:29:18, 54.68s/trial, best loss: -0.5265]
  3%|▎         | 3/100 [02:27<1:20:59, 50.10s/trial, best loss: -0.5265]
  4%|▍         | 4/100 [03:04<1:12:21, 45.22s/trial, best loss: -0.5265]
  5%|▌         | 5/100 [03:29<1:00:03, 37.94s/trial, best loss: -0.5265]
  6%|▌         | 6/100 [03:55<52:48, 33.70s/trial, best loss: -0.5265]  
  7%|▋         | 7/100 [04:22<48:58, 31.60s/trial, best loss: -0.5265]
  8%|▊         | 8/100 [04:41<42:10, 27.50s/trial, best loss: -0.5265]
  9%|▉         | 9/100 [05:04<39:50, 26.26s/trial, best loss: -0.5265]
 10%|█         | 10/100 [05:52<49:20, 32.89s/trial, best loss: -0.5265]
 11%|█         | 11/100 [06:19<45:58, 30.99s/trial, best loss: -0.5265]
 12%|█▏        | 12/100 [06:46<43:51, 29.90s/trial, best loss: -0.5265]
 13%|█▎        | 13/100 [07:18<44:18, 30.56s/trial, best loss: -0.5265]
 14%|█▍        | 14/100 [08:16<55:43, 38.87s/trial, best loss: -0.5265]
 15%|█▌        | 15/100 [08:36<46:44, 33.00s/trial, best loss: -0.5265]
 16%|█▌        | 16/100 [09:29<54:48, 39.14s/trial, best loss: -0.5265]
 17%|█▋        | 17/100 [10:14<56:42, 40.99s/trial, best loss: -0.5265]
 18%|█▊        | 18/100 [10:40<49:29, 36.22s/trial, best loss: -0.5265]
 19%|█▉        | 19/100 [11:02<43:19, 32.10s/trial, best loss: -0.5265]
 20%|██        | 20/100 [12:27<1:04:03, 48.05s/trial, best loss: -0.5265]
 21%|██        | 21/100 [12:50<53:21, 40.53s/trial, best loss: -0.5265]  
 22%|██▏       | 22/100 [14:19<1:11:21, 54.89s/trial, best loss: -0.5266]
 23%|██▎       | 23/100 [15:46<1:22:56, 64.62s/trial, best loss: -0.5273]
 24%|██▍       | 24/100 [17:15<1:31:15, 72.05s/trial, best loss: -0.5273]
 25%|██▌       | 25/100 [18:28<1:30:13, 72.18s/trial, best loss: -0.5295]
 26%|██▌       | 26/100 [19:25<1:23:36, 67.79s/trial, best loss: -0.5295]
 27%|██▋       | 27/100 [20:38<1:24:16, 69.27s/trial, best loss: -0.5317]
 28%|██▊       | 28/100 [21:34<1:18:22, 65.31s/trial, best loss: -0.5317]
 29%|██▉       | 29/100 [22:10<1:06:39, 56.34s/trial, best loss: -0.5317]
 30%|███       | 30/100 [23:00<1:03:44, 54.63s/trial, best loss: -0.5317]
 31%|███       | 31/100 [23:52<1:01:58, 53.89s/trial, best loss: -0.5317]
 32%|███▏      | 32/100 [24:33<56:37, 49.96s/trial, best loss: -0.5317]  
 33%|███▎      | 33/100 [25:33<59:03, 52.89s/trial, best loss: -0.5317]
 34%|███▍      | 34/100 [26:14<54:14, 49.31s/trial, best loss: -0.5317]
 35%|███▌      | 35/100 [26:58<51:47, 47.81s/trial, best loss: -0.5317]
 36%|███▌      | 36/100 [28:03<56:26, 52.91s/trial, best loss: -0.5317]
 37%|███▋      | 37/100 [28:22<44:54, 42.76s/trial, best loss: -0.5317]
 38%|███▊      | 38/100 [29:03<43:40, 42.27s/trial, best loss: -0.5317]
 39%|███▉      | 39/100 [29:38<40:48, 40.14s/trial, best loss: -0.5317]
 40%|████      | 40/100 [30:09<37:15, 37.26s/trial, best loss: -0.5317]
 41%|████      | 41/100 [30:32<32:27, 33.01s/trial, best loss: -0.5317]
 42%|████▏     | 42/100 [30:55<29:07, 30.13s/trial, best loss: -0.5317]
 43%|████▎     | 43/100 [31:22<27:33, 29.00s/trial, best loss: -0.5317]
 44%|████▍     | 44/100 [32:07<31:36, 33.86s/trial, best loss: -0.5317]
 45%|████▌     | 45/100 [32:33<28:54, 31.53s/trial, best loss: -0.5317]
 46%|████▌     | 46/100 [33:27<34:33, 38.39s/trial, best loss: -0.5317]
 47%|████▋     | 47/100 [34:36<41:53, 47.43s/trial, best loss: -0.5317]
 48%|████▊     | 48/100 [35:04<36:09, 41.73s/trial, best loss: -0.5317]
 49%|████▉     | 49/100 [35:28<30:54, 36.36s/trial, best loss: -0.5317]
 50%|█████     | 50/100 [35:52<27:03, 32.47s/trial, best loss: -0.5317]
 51%|█████     | 51/100 [36:14<24:00, 29.40s/trial, best loss: -0.5317]
 52%|█████▏    | 52/100 [36:42<23:15, 29.08s/trial, best loss: -0.5317]
 53%|█████▎    | 53/100 [37:11<22:41, 28.97s/trial, best loss: -0.5317]
 54%|█████▍    | 54/100 [37:38<21:50, 28.49s/trial, best loss: -0.5317]
 55%|█████▌    | 55/100 [38:05<20:52, 27.83s/trial, best loss: -0.5317]
 56%|█████▌    | 56/100 [38:39<21:55, 29.90s/trial, best loss: -0.5317]
 57%|█████▋    | 57/100 [39:03<20:04, 28.02s/trial, best loss: -0.5317]
 58%|█████▊    | 58/100 [39:43<22:12, 31.72s/trial, best loss: -0.5317]
 59%|█████▉    | 59/100 [40:08<20:09, 29.51s/trial, best loss: -0.5317]
 60%|██████    | 60/100 [40:28<17:52, 26.82s/trial, best loss: -0.5317]
 61%|██████    | 61/100 [40:52<16:50, 25.91s/trial, best loss: -0.5317]
 62%|██████▏   | 62/100 [41:23<17:22, 27.43s/trial, best loss: -0.5317]
 63%|██████▎   | 63/100 [42:10<20:37, 33.45s/trial, best loss: -0.5317]
 64%|██████▍   | 64/100 [42:39<19:12, 32.00s/trial, best loss: -0.5317]
 65%|██████▌   | 65/100 [43:17<19:42, 33.79s/trial, best loss: -
 70%|███████   | 70/100 [47:29<22:55, 45.86s/trial, best loss: -0.5317 71%|███████   | 71/100 [47:51<18:36, 38.50s/trial, best loss: -0.5317] 72%|███████▏  | 72/100 [48:22<17:01, 36.48s/trial, best loss: -0.5317] 73%|███████▎  | 73/100 [48:53<15:37, 34.73s/trial, best loss: -0.5317] 74%|███████▍  | 74/100 [49:26<14:47, 34.12s/trial, best loss: -0.5317] 75%|███████▌  | 75/100 [50:25<17:23, 41.75s/trial, best loss: -0.5317] 76%|███████▌  | 76/100 [52:48<28:45, 71.88s/trial, best loss: -0.5317] 77%|███████▋  | 77/100 [1:01:29<1:19:17, 206.83s/trial, best loss: -0.5317] 78%|███████▊  | 78/100 [1:09:01<1:42:46, 280.31s/trial, best loss: -0.5317] 79%|███████▉  | 79/100 [1:13:21<1:35:58, 274.20s/trial, best loss: -0.5317] 80%|████████  | 80/100 [1:18:55<1:37:20, 292.02s/trial, best loss: -0.5317] 81%|████████  | 81/100 [1:23:55<1:33:18, 294.68s/trial, best loss: -0.5317] 82%|████████▏ | 82/100 [1:34:51<2:00:55, 403.07s/trial, best loss: -0.5317] 83%|████████▎ | 83/100 [1:41:09<1:52:03, 395.51s/trial, best loss: -0.5317] 84%|████████▍ | 84/100 [1:49:39<1:54:34, 429.67s/trial, best loss: -0.5317] 85%|████████▌ | 85/100 [1:55:44<1:42:34, 410.32s/trial, best loss: -0.5317] 86%|████████▌ | 86/100 [2:06:29<1:52:09, 480.66s/trial, best loss: -0.5317] 87%|████████▋ | 87/100 [2:10:26<1:28:20, 407.70s/trial, best loss: -0.5317] 88%|████████▊ | 88/100 [2:18:44<1:26:56, 434.74s/trial, best loss: -0.5317] 89%|████████▉ | 89/100 [2:31:13<1:36:59, 529.02s/trial, best loss: -0.5317] 90%|█████████ | 90/100 [2:36:58<1:18:57, 473.78s/trial, best loss: -0.5317] 91%|█████████ | 91/100 [2:46:56<1:16:40, 511.17s/trial, best loss: -0.5317] 92%|█████████▏| 92/100 [2:54:44<1:06:25, 498.13s/trial, best loss: -0.5317] 93%|█████████▎| 93/100 [3:02:22<56:43, 486.24s/trial, best loss: -0.5317]   94%|█████████▍| 94/100 [3:07:24<43:04, 430.74s/trial, best loss: -0.5317] 95%|█████████▌| 95/100 [3:11:11<30:49, 369.85s/trial, best loss: -0.5317] 96%|█████████▌| 96/100 [3:16:37<23:46, 356.58s/trial, best loss: -0.5317] 97%|█████████▋| 97/100 [3:19:55<15:26, 308.89s/trial, best loss: -0.5317] 98%|█████████▊| 98/100 [3:24:07<09:43, 291.98s/trial, best loss: -0.5317] 99%|█████████▉| 99/100 [3:29:23<04:59, 299.00s/trial, best loss: -0.5317]100%|██████████| 100/100 [3:39:09<00:00, 385.25s/trial, best loss: -0.5317]100%|██████████| 100/100 [3:39:09<00:00, 131.50s/trial, best loss: -0.5317]
최적화 완료. 최적 파라미터: {'colsample_bytree': 0.7585295616897205, 'learning_rate': 0.012807299958074884, 'max_depth': 8.0, 'min_child_weight': 2.0, 'num_leaves': 149.0, 'reg_alpha': 0.8175154308532824, 'reg_lambda': 0.7481509687757377, 'subsample': 0.8155067304500027}
최적 CSI 점수: 0.5317 (loss: -0.5317)

최적화 과정 요약:
  - 총 시도 횟수: 100
  - 성공한 시도: 100
  - 최초 CSI: 0.5211
  - 최종 CSI: 0.5200
  - 최고 CSI: 0.5317
  - 최저 CSI: 0.5140
  - 평균 CSI: 0.5239

최적화 Trials 객체가 /workspace/visibility_prediction/Analysis_code/optimization_history/lgb_smote_daejeon_trials.pkl에 저장되었습니다.
최종 모델 학습 시작...
Fold 1 학습 중... (학습 연도: [2018, 2019], 검증 연도: 2020)
Fold 1 검증 CSI: 0.4660
Fold 2 학습 중... (학습 연도: [2018, 2020], 검증 연도: 2019)
Fold 2 검증 CSI: 0.5365
Fold 3 학습 중... (학습 연도: [2019, 2020], 검증 연도: 2018)
Fold 3 검증 CSI: 0.5802
모델 저장 중...
모델이 /workspace/visibility_prediction/Analysis_code/save_model/lgb_optima/lgb_smote_daejeon.pkl에 저장되었습니다.

✓ 완료: lgb_smote/LGB_smote_daejeon.py (소요 시간: 13709초)

----------------------------------------
실행 중: lgb_smote/LGB_smote_gwangju.py
시작 시간: 2025-12-27 18:58:59
----------------------------------------
데이터 로딩 중...
데이터 전처리 중...
하이퍼파라미터 최적화 시작...
  0%|          | 0/100 [00:00<?, ?trial/s, best loss=?]  1%|          | 1/100 [04:15<7:00:48, 255.03s/trial, best loss: -0.514]  2%|▏         | 2/100 [10:51<9:12:33, 338.30s/trial, best loss: -0.5211]  3%|▎         | 3/100 [14:27<7:36:31, 282.39s/trial, best loss: -0.5213]  4%|▍         | 4/100 [28:42<13:33:29, 508.43s/trial, best loss: -0.5213]  5%|▌         | 5/100 [33:47<11:28:58, 435.15s/trial, best loss: -0.5213]  6%|▌         | 6/100 [37:32<9:29:28, 363.50s/trial, best loss: -0.5213]   7%|▋         | 7/100 [43:08<9:09:49, 354.73s/trial, best loss: -0.5231]  8%|▊         | 8/100 [51:25<10:13:26, 400.07s/trial, best loss: -0.5234]  9%|▉         | 9/100 [55:44<8:59:36, 355.78s/trial, best loss: -0.5234]  10%|█         | 10/100 [1:03:59<9:58:14, 398.83s/trial, best loss: -0.5261] 11%|█         | 11/100 [1:16:28<12:30:29, 505.95s/trial, best loss: -0.5261] 12%|█▏        | 12/100 [1:20:41<10:29:13, 429.02s/trial, best loss: -0.5261] 13%|█▎        | 13/100 [1:30:34<11:33:56, 478.58s/trial, best loss: -0.5261] 14%|█▍        | 14/100 [1:37:17<10:53:26, 455.89s/trial, best loss: -0.5261] 15%|█▌        | 15/100 [1:42:50<9:53:17, 418.79s/trial, best loss: -0.5261]  16%|█▌        | 16/100 [1:49:53<9:48:11, 420.13s/trial, best loss: -0.5261] 17%|█▋        | 17/100 [1:56:35<9:33:35, 414.65s/trial, best loss: -0.5261] 18%|█▊        | 18/100 [2:00:09<8:04:11, 354.28s/trial, best loss: -0.5261] 19%|█▉        | 19/100 [2:05:19<7:40:21, 341.00s/trial, best loss: -0.5261] 20%|██        | 20/100 [2:13:48<8:42:11, 391.65s/trial, best loss: -0.5261] 21%|██        | 21/100 [2:17:58<7:39:19, 348.86s/trial, best loss: -0.5282] 22%|██▏       | 22/100 [2:22:36<7:06:06, 327.78s/trial, best loss: -0.5282] 23%|██▎       | 23/100 [2:27:22<6:44:23, 315.11s/trial, best loss: -0.5282] 24%|██▍       | 24/100 [2:33:47<7:05:59, 336.31s/trial, best loss: -0.5282] 25%|██▌       | 25/100 [2:38:41<6:44:31, 323.62s/trial, best loss: -0.5282] 26%|██▌       | 26/100 [2:43:26<6:24:34, 311.81s/trial, best loss: -0.5282] 27%|██▋       | 27/100 [2:58:23<9:53:02, 487.43s/trial, best loss: -0.5282] 28%|██▊       | 28/100 [3:04:09<8:53:56, 444.96s/trial, best loss: -0.5282] 29%|██▉       | 29/100 [3:09:27<8:01:24, 406.82s/trial, best loss: -0.5282] 30%|███       | 30/100 [3:15:25<7:37:38, 392.27s/trial, best loss: -0.5297] 31%|███       | 31/100 [3:19:29<6:39:48, 347.67s/trial, best loss: -0.5297] 32%|███▏      | 32/100 [3:24:12<6:12:04, 328.30s/trial, best loss: -0.5297] 33%|███▎      | 33/100 [3:29:51<6:10:22, 331.68s/trial, best loss: -0.5297] 34%|███▍      | 34/100 [3:33:40<5:30:43, 300.67s/trial, best loss: -0.5297] 35%|███▌      | 35/100 [3:38:31<5:22:52, 298.03s/trial, best loss: -0.5297] 36%|███▌      | 36/100 [3:41:58<4:48:34, 270.54s/trial, best loss: -0.5297] 37%|███▋      | 37/100 [3:46:52<4:51:31, 277.65s/trial, best loss: -0.5297] 38%|███▊      | 38/100 [3:54:21<5:40:06, 329.14s/trial, best loss: -0.5297] 39%|███▉      | 39/100 [3:58:29<5:09:44, 304.66s/trial, best loss: -0.5297] 40%|████      | 40/100 [4:02:11<4:39:51, 279.85s/trial, best loss: -0.5297] 41%|████      | 41/100 [4:09:11<5:16:31, 321.89s/trial, best loss: -0.5297] 42%|████▏     | 42/100 [4:11:59<4:26:26, 275.63s/trial, best loss: -0.5297] 43%|████▎     | 43/100 [4:12:21<3:09:40, 199.66s/trial, best loss: -0.5297] 44%|████▍     | 44/100 [4:13:27<2:29:04, 159.73s/trial, best loss: -0.5297] 45%|████▌     | 45/100 [4:14:01<1:51:49, 121.99s/trial, best loss: -0.5297] 46%|████▌     | 46/100 [4:14:49<1:29:42, 99.67s/trial, best loss: -0.5297]  47%|████▋     | 47/100 [4:15:12<1:07:47, 76.75s/trial, best loss: -0.5297] 48%|████▊     | 48/100 [4:15:35<52:27, 60.53s/trial, best loss: -0.5297]   49%|████▉     | 49/100 [4:16:22<48:03, 56.55s/trial, best loss: -0.5297] 50%|█████     | 50/100 [4:16:50<39:57, 47.94s/trial, best loss: -0.5297] 51%|█████     | 51/100 [4:17:25<35:58, 44.05s/trial, best loss: -0.5297] 52%|█████▏    | 52/100 [4:17:58<32:36, 40.76s/trial, best loss: -0.5297] 53%|█████▎    | 53/100 [4:18:26<28:50, 36.83s/trial, best loss: -0.5297] 54%|█████▍    | 54/100 [4:18:44<23:59, 31.30s/trial, best loss: -0.5297] 55%|█████▌    | 55/100 [4:19:11<22:25, 29.91s/trial, best loss: -0.5297] 56%|█████▌    | 56/100 [4:19:35<20:34, 28.05s/trial, best loss: -0.5297] 57%|█████▋    | 57/100 [4:19:55<18:22, 25.64s/trial, best loss: -0.5297] 58%|█████▊    | 58/100 [4:20:41<22:15, 31.79s/trial, best loss: -0.5297] 59%|█████▉    | 59/100 [4:21:13<21:49, 31.94s/trial, best loss: -0.5297] 60%|██████    | 60/100 [4:22:08<25:52, 38.81s/trial, best loss: -0.5297] 61%|██████    | 61/100 [4:22:32<22:27, 34.56s/trial, best loss: -0.5297] 62%|██████▏   | 62/100 [4:23:01<20:46, 32.81s/trial, best loss: -0.5297] 63%|██████▎   | 63/100 [4:23:41<21:33, 34.97s/trial, best loss: -0.5297] 64%|██████▍   | 64/100 [4:24:29<23:17, 38.83s/trial, best loss: -0.5297] 65%|██████▌   | 65/100 [4:24:56<20:29, 35.13s/trial, best loss: -0.5297] 66%|██████▌   | 66/100 [4:25:27<19:12, 33.90s/trial, best loss: -0.5297] 67%|██████▋   | 67/100 [4:25:57<18:00, 32.75s/trial, best loss: -0.5297] 68%|██████▊   | 68/100 [4:26:30<17:32, 32.88s/trial, best loss: -0.5297] 69%|██████▉   | 69/100 [4:27:03<17:00, 32.93s/trial, best loss: -0.5297] 70%|███████   | 70/100 [4:27:38<16:48, 33.60s/trial, best loss: -0.5297] 71%|███████   | 71/100 [4:28:14<16:32, 34.22s/trial, best loss: -0.5297] 72%|███████▏  | 72/100 [4:28:45<15:30, 33.23s/trial, best loss: -0.5297] 73%|███████▎  | 73/100 [4:29:10<13:51, 30.80s/trial, best loss: -0.5297] 74%|███████▍  | 74/100 [4:29:36<12:48, 29.55s/trial, best loss: -0.5297] 75%|███████▌  | 75/100 [4:30:01<11:41, 28.04s/trial, best loss: -0.5297] 76%|███████▌  | 76/100 [4:30:44<13:00, 32.51s/trial, best loss: -0.5297] 77%|███████▋  | 77/100 [4:31:15<12:19, 32.14s/trial, best loss: -0.5297] 78%|███████▊  | 78/100 [4:31:43<11:17, 30.78s/trial, best loss: -0.5297] 79%|███████▉  | 79/100 [4:32:07<10:04, 28.79s/trial, best loss: -0.5297] 80%|████████  | 80/100 [4:32:34<09:28, 28.41s/trial, best loss: -0.5297] 81%|████████  | 81/100 [4:33:00<08:42, 27.49s/trial, best loss: -0.5297] 82%|████████▏ | 82/100 [4:33:33<08:45, 29.22s/trial, best loss: -0.5297] 83%|████████▎ | 83/100 [4:33:59<08:02, 28.40s/trial, best loss: -0.5297] 84%|████████▍ | 84/100 [4:34:46<09:03, 33.97s/trial, best loss: -0.5297] 85%|████████▌ | 85/100 [4:35:10<07:43, 30.87s/trial, best loss: -0.5297] 86%|████████▌ | 86/100 [4:35:48<07:42, 33.02s/trial, best loss: -0.5297] 87%|████████▋ | 87/100 [4:36:25<07:25, 34.28s/trial, best loss: -0.5297] 88%|████████▊ | 88/100 [4:36:49<06:14, 31.23s/trial, best loss: -0.5297] 89%|████████▉ | 89/100 [4:37:23<05:50, 31.87s/trial, best loss: -0.5297] 90%|█████████ | 90/100 [4:38:00<05:33, 33.34s/trial, best loss: -0.5297] 91%|█████████ | 91/100 [4:38:36<05:07, 34.20s/trial, best loss: -0.5297] 92%|█████████▏| 92/100 [4:39:04<04:18, 32.34s/trial, best loss: -0.5297] 93%|█████████▎| 93/100 [4:39:45<04:04, 34.91s/trial, best loss: -0.5297] 94%|█████████▍| 94/100 [4:40:10<03:13, 32.17s/trial, best loss: -0.5297] 95%|█████████▌| 95/100 [4:40:58<03:03, 36.67s/trial, best loss: -0.5297] 96%|█████████▌| 96/100 [4:41:26<02:16, 34.07s/trial, best loss: -0.5297] 97%|█████████▋| 97/100 [4:41:50<01:33, 31.10s/trial, best loss: -0.5297] 98%|█████████▊| 98/100 [4:42:13<00:57, 28.72s/trial, best loss: -0.5297] 99%|█████████▉| 99/100 [4:42:43<00:28, 29.00s/trial, best loss: -0.5297]100%|██████████| 100/100 [4:43:11<00:00, 28.84s/trial, best loss: -0.5297]100%|██████████| 100/100 [4:43:11<00:00, 169.92s/trial, best loss: -0.5297]
최적화 완료. 최적 파라미터: {'colsample_bytree': 0.9919060649789312, 'learning_rate': 0.054631157314326724, 'max_depth': 15.0, 'min_child_weight': 3.0, 'num_leaves': 47.0, 'reg_alpha': 0.9190252546800255, 'reg_lambda': 0.8800706832709921, 'subsample': 0.7859941375783913}
최적 CSI 점수: 0.5297 (loss: -0.5297)

최적화 과정 요약:
  - 총 시도 횟수: 100
  - 성공한 시도: 100
  - 최초 CSI: 0.5140
  - 최종 CSI: 0.5162
  - 최고 CSI: 0.5297
  - 최저 CSI: 0.5076
  - 평균 CSI: 0.5214

최적화 Trials 객체가 /workspace/visibility_prediction/Analysis_code/optimization_history/lgb_smote_gwangju_trials.pkl에 저장되었습니다.
최종 모델 학습 시작...
Fold 1 학습 중... (학습 연도: [2018, 2019], 검증 연도: 2020)
Fold 1 검증 CSI: 0.4658
Fold 2 학습 중... (학습 연도: [2018, 2020], 검증 연도: 2019)
Fold 2 검증 CSI: 0.5445
Fold 3 학습 중... (학습 연도: [2019, 2020], 검증 연도: 2018)
Fold 3 검증 CSI: 0.5548
모델 저장 중...
모델이 /workspace/visibility_prediction/Analysis_code/save_model/lgb_optima/lgb_smote_gwangju.pkl에 저장되었습니다.

✓ 완료: lgb_smote/LGB_smote_gwangju.py (소요 시간: 17011초)

----------------------------------------
실행 중: lgb_smote/LGB_smote_incheon.py
시작 시간: 2025-12-27 23:42:30
----------------------------------------
데이터 로딩 중...
데이터 전처리 중...
하이퍼파라미터 최적화 시작...
  0%|          | 0/100 [00:00<?, ?trial/s, best loss=?]  1%|          | 1/100 [00:43<1:11:19, 43.22s/trial, best loss: -0.5809]  2%|▏         | 2/100 [01:11<55:54, 34.23s/trial, best loss: -0.5809]    3%|▎         | 3/100 [02:02<1:08:05, 42.12s/trial, best loss: -0.5819]  4%|▍         | 4/100 [03:05<1:20:35, 50.37s/trial, best loss: -0.5824]  5%|▌         | 5/100 [03:26<1:03:01, 39.80s/trial, best loss: -0.5824]  6%|▌         | 6/100 [03:57<57:34, 36.75s/trial, best loss: -0.5824]    7%|▋         | 7/100 [04:31<55:43, 35.96s/trial, best loss: -0.5824]  8%|▊         | 8/100 [04:52<47:49, 31.19s/trial, best loss: -0.5824]  9%|▉         | 9/100 [05:19<45:20, 29.90s/trial, best loss: -0.5824] 10%|█         | 10/100 [06:00<50:00, 33.34s/trial, best loss: -0.5824] 11%|█         | 11/100 [06:26<45:40, 30.80s/trial, best loss: -0.5824] 12%|█▏        | 12/100 [07:09<50:39, 34.54s/trial, best loss: -0.5839] 13%|█▎        | 13/100 [07:57<56:22, 38.88s/trial, best loss: -0.5853] 14%|█▍        | 14/100 [08:58<1:04:58, 45.34s/trial, best loss: -0.5853] 15%|█▌        | 15/100 [09:37<1:01:37, 43.49s/trial, best loss: -0.5853] 16%|█▌        | 16/100 [10:35<1:06:57, 47.83s/trial, best loss: -0.5873] 17%|█▋        | 17/100 [11:05<58:49, 42.53s/trial, best loss: -0.5873]   18%|█▊        | 18/100 [11:59<1:02:45, 45.92s/trial, best loss: -0.5873] 19%|█▉        | 19/100 [12:34<57:28, 42.57s/trial, best loss: -0.5873]   20%|██        | 20/100 [12:55<48:26, 36.33s/trial, best loss: -0.5908] 21%|██        | 21/100 [13:16<41:46, 31.73s/trial, best loss: -0.5954] 22%|██▏       | 22/100 [13:39<37:34, 28.90s/trial, best loss: -0.5957] 23%|██▎       | 23/100 [13:59<33:56, 26.45s/trial, best loss: -0.5957] 24%|██▍       | 24/100 [14:22<32:01, 25.28s/trial, best loss: -0.5957] 25%|██▌       | 25/100 [14:41<29:07, 23.29s/trial, best loss: -0.5957] 26%|██▌       | 26/100 [15:03<28:26, 23.06s/trial, best loss: -0.5957] 27%|██▋       | 27/100 [15:22<26:40, 21.92s/trial, best loss: -0.5957] 28%|██▊       | 28/100 [15:58<31:11, 25.99s/trial, best loss: -0.5957] 29%|██▉       | 29/100 [16:23<30:24, 25.70s/trial, best loss: -0.5957] 30%|███       | 30/100 [16:43<28:09, 24.14s/trial, best loss: -0.5957] 31%|███       | 31/100 [17:11<29:06, 25.31s/trial, best loss: -0.5957] 32%|███▏      | 32/100 [17:30<26:30, 23.39s/trial, best loss: -0.5957] 33%|███▎      | 33/100 [17:56<26:41, 23.90s/trial, best loss: -0.5957] 34%|███▍      | 34/100 [18:22<27:06, 24.65s/trial, best loss: -0.5957] 35%|███▌      | 35/100 [19:04<32:31, 30.03s/trial, best loss: -0.5957] 36%|███▌      | 36/100 [19:31<30:45, 28.84s/trial, best loss: -0.5957] 37%|███▋      | 37/100 [19:50<27:19, 26.02s/trial, best loss: -0.5957] 38%|███▊      | 38/100 [20:09<24:42, 23.90s/trial, best loss: -0.5957] 39%|███▉      | 39/100 [20:30<23:20, 22.96s/trial, best loss: -0.5957] 40%|████      | 40/100 [20:54<23:16, 23.27s/trial, best loss: -0.5957] 41%|████      | 41/100 [21:17<22:52, 23.27s/trial, best loss: -0.5957] 42%|████▏     | 42/100 [21:54<26:30, 27.42s/trial, best loss: -0.5957] 43%|████▎     | 43/100 [22:21<26:00, 27.38s/trial, best loss: -0.5957] 44%|████▍     | 44/100 [22:49<25:32, 27.37s/trial, best loss: -0.5957] 45%|████▌     | 45/100 [23:11<23:38, 25.79s/trial, best loss: -0.5957] 46%|████▌     | 46/100 [23:36<23:11, 25.76s/trial, best loss: -0.5957] 47%|████▋     | 47/100 [24:04<23:08, 26.19s/trial, best loss: -0.5957] 48%|████▊     | 48/100 [24:38<24:41, 28.49s/trial, best loss: -0.5957] 49%|████▉     | 49/100 [25:00<22:40, 26.68s/trial, best loss: -0.5957] 50%|█████     | 50/100 [25:23<21:12, 25.45s/trial, best loss: -0.596]  51%|█████     | 51/100 [26:06<25:13, 30.88s/trial, best loss: -0.596] 52%|█████▏    | 52/100 [26:38<24:53, 31.11s/trial, best loss: -0.596] 53%|█████▎    | 53/100 [27:15<25:44, 32.87s/trial, best loss: -0.596] 54%|█████▍    | 54/100 [27:44<24:28, 31.93s/trial, best loss: -0.596] 55%|█████▌    | 55/100 [28:03<20:51, 27.81s/trial, best loss: -0.596] 56%|█████▌    | 56/100 [28:30<20:11, 27.53s/trial, best loss: -0.596] 57%|█████▋    | 57/100 [28:58<19:51, 27.71s/trial, best loss: -0.596] 58%|█████▊    | 58/100 [29:20<18:09, 25.95s/trial, best loss: -0.596] 59%|█████▉    | 59/100 [29:47<18:00, 26.36s/trial, best loss: -0.596] 60%|██████    | 60/100 [30:30<20:57, 31.45s/trial, best loss: -0.596] 61%|██████    | 61/100 [31:06<21:22, 32.90s/trial, best loss: -0.596] 62%|██████▏   | 62/100 [31:42<21:24, 33.80s/trial, best loss: -0.596] 63%|██████▎   | 63/100 [32:04<18:37, 30.21s/trial, best loss: -0.596] 64%|██████▍   | 64/100 [32:26<16:37, 27.70s/trial, best loss: -0.596] 65%|██████▌   | 65/100 [33:13<19:35, 33.57s/trial, best loss: -0.596] 66%|██████▌   | 66/100 [33:39<17:41, 31.21s/trial, best loss: -0.596] 67%|██████▋   | 67/100 [34:02<15:51, 28.84s/trial, best loss: -0.596] 68%|██████▊   | 68/100 [34:23<14:03, 26.34s/trial, best loss: -0.5969] 69%|██████▉   | 69/100 [34:45<12:55, 25.02s/trial, best loss: -0.5969] 70%|███████   | 70/100 [35:07<12:04, 24.16s/trial, best loss: -0.5969] 71%|███████   | 71/100 [35:36<12:20, 25.52s/trial, best loss: -0.5969] 72%|███████▏  | 72/100 [35:56<11:14, 24.08s/trial, best loss: -0.5969] 73%|███████▎  | 73/100 [36:18<10:34, 23.49s/trial, best loss: -0.5969] 74%|███████▍  | 74/100 [36:45<10:35, 24.45s/trial, best loss: -0.5969] 75%|███████▌  | 75/100 [37:09<10:05, 24.23s/trial, best loss: -0.5969] 76%|███████▌  | 76/100 [37:28<09:02, 22.60s/trial, best loss: -0.5969] 77%|███████▋  | 77/100 [37:55<09:11, 24.00s/trial, best loss: -0.5969] 78%|███████▊  | 78/100 [38:17<08:37, 23.51s/trial, best loss: -0.5969] 79%|███████▉  | 79/100 [38:54<09:35, 27.40s/trial, best loss: -0.5969] 80%|████████  | 80/100 [39:15<08:32, 25.62s/trial, best loss: -0.5969] 81%|████████  | 81/100 [39:36<07:39, 24.19s/trial, best loss: -0.5969] 82%|████████▏ | 82/100 [40:01<07:19, 24.39s/trial, best loss: -0.5969] 83%|████████▎ | 83/100 [40:31<07:21, 25.98s/trial, best loss: -0.5969] 84%|████████▍ | 84/100 [41:00<07:12, 27.01s/trial, best loss: -0.5969] 85%|████████▌ | 85/100 [41:21<06:19, 25.29s/trial, best loss: -0.5969] 86%|████████▌ | 86/100 [41:49<06:02, 25.88s/trial, best loss: -0.5969] 87%|████████▋ | 87/100 [42:09<05:16, 24.33s/trial, best loss: -0.5969] 88%|████████▊ | 88/100 [42:35<04:57, 24.83s/trial, best loss: -0.5969] 89%|████████▉ | 89/100 [43:02<04:38, 25.36s/trial, best loss: -0.5969] 90%|█████████ | 90/100 [43:27<04:12, 25.28s/trial, best loss: -0.5969] 91%|█████████ | 91/100 [43:45<03:27, 23.09s/trial, best loss: -0.5969] 92%|█████████▏| 92/100 [44:08<03:05, 23.18s/trial, best loss: -0.5969] 93%|█████████▎| 93/100 [44:33<02:45, 23.70s/trial, best loss: -0.5969] 94%|█████████▍| 94/100 [44:53<02:15, 22.63s/trial, best loss: -0.5969] 95%|█████████▌| 95/100 [45:13<01:47, 21.59s/trial, best loss: -0.5986] 96%|█████████▌| 96/100 [45:33<01:25, 21.36s/trial, best loss: -0.5986] 97%|█████████▋| 97/100 [45:56<01:05, 21.89s/trial, best loss: -0.5986] 98%|█████████▊| 98/100 [46:26<00:48, 24.14s/trial, best loss: -0.5986] 99%|█████████▉| 99/100 [46:47<00:23, 23.34s/trial, best loss: -0.5986]100%|██████████| 100/100 [47:09<00:00, 22.89s/trial, best loss: -0.5986]100%|██████████| 100/100 [47:09<00:00, 28.30s/trial, best loss: -0.5986]
최적화 완료. 최적 파라미터: {'colsample_bytree': 0.7149911519913482, 'learning_rate': 0.14061649313221522, 'max_depth': 4.0, 'min_child_weight': 4.0, 'num_leaves': 46.0, 'reg_alpha': 0.3323739596170201, 'reg_lambda': 0.3615804769440283, 'subsample': 0.7361106038020775}
최적 CSI 점수: 0.5986 (loss: -0.5986)

최적화 과정 요약:
  - 총 시도 횟수: 100
  - 성공한 시도: 100
  - 최초 CSI: 0.5809
  - 최종 CSI: 0.5894
  - 최고 CSI: 0.5986
  - 최저 CSI: 0.5696
  - 평균 CSI: 0.5862

최적화 Trials 객체가 /workspace/visibility_prediction/Analysis_code/optimization_history/lgb_smote_incheon_trials.pkl에 저장되었습니다.
최종 모델 학습 시작...
Fold 1 학습 중... (학습 연도: [2018, 2019], 검증 연도: 2020)
Fold 1 검증 CSI: 0.5834
Fold 2 학습 중... (학습 연도: [2018, 2020], 검증 연도: 2019)
Fold 2 검증 CSI: 0.6287
Fold 3 학습 중... (학습 연도: [2019, 2020], 검증 연도: 2018)
Fold 3 검증 CSI: 0.5714
모델 저장 중...
모델이 /workspace/visibility_prediction/Analysis_code/save_model/lgb_optima/lgb_smote_incheon.pkl에 저장되었습니다.

✓ 완료: lgb_smote/LGB_smote_incheon.py (소요 시간: 2836초)

----------------------------------------
실행 중: lgb_smote/LGB_smote_seoul.py
시작 시간: 2025-12-28 00:29:46
----------------------------------------
데이터 로딩 중...
데이터 전처리 중...
하이퍼파라미터 최적화 시작...
  0%|          | 0/100 [00:00<?, ?trial/s, best loss=?]  1%|          | 1/100 [00:21<35:48, 21.71s/trial, best loss: -0.5774]  2%|▏         | 2/100 [00:40<32:34, 19.95s/trial, best loss: -0.5774]  3%|▎         | 3/100 [01:05<35:43, 22.09s/trial, best loss: -0.5774]  4%|▍         | 4/100 [01:24<33:30, 20.94s/trial, best loss: -0.5774]  5%|▌         | 5/100 [01:50<36:02, 22.77s/trial, best loss: -0.5774]  6%|▌         | 6/100 [02:30<45:08, 28.82s/trial, best loss: -0.5774]  7%|▋         | 7/100 [03:03<46:46, 30.18s/trial, best loss: -0.5774]  8%|▊         | 8/100 [04:06<1:01:57, 40.40s/trial, best loss: -0.5868]  9%|▉         | 9/100 [04:28<52:43, 34.76s/trial, best loss: -0.5868]   10%|█         | 10/100 [04:53<47:25, 31.62s/trial, best loss: -0.5868] 11%|█         | 11/100 [05:11<40:47, 27.50s/trial, best loss: -0.5868] 12%|█▏        | 12/100 [05:29<36:19, 24.76s/trial, best loss: -0.5868] 13%|█▎        | 13/100 [06:30<51:31, 35.54s/trial, best loss: -0.5868] 14%|█▍        | 14/100 [06:53<45:46, 31.94s/trial, best loss: -0.5868] 15%|█▌        | 15/100 [07:13<40:12, 28.39s/trial, best loss: -0.5868] 16%|█▌        | 16/100 [07:45<41:08, 29.38s/trial, best loss: -0.5868] 17%|█▋        | 17/100 [08:07<37:42, 27.26s/trial, best loss: -0.5868] 18%|█▊        | 18/100 [08:25<33:12, 24.29s/trial, best loss: -0.5868] 19%|█▉        | 19/100 [09:03<38:34, 28.57s/trial, best loss: -0.5868] 20%|██        | 20/100 [09:52<46:05, 34.57s/trial, best loss: -0.5868] 21%|██        | 21/100 [10:37<49:37, 37.69s/trial, best loss: -0.5871] 22%|██▏       | 22/100 [11:26<53:30, 41.15s/trial, best loss: -0.5871] 23%|██▎       | 23/100 [12:12<54:29, 42.46s/trial, best loss: -0.5871] 24%|██▍       | 24/100 [13:10<59:50, 47.25s/trial, best loss: -0.5871] 25%|██▌       | 25/100 [13:50<56:22, 45.10s/trial, best loss: -0.5871] 26%|██▌       | 26/100 [14:22<50:37, 41.05s/trial, best loss: -0.5871] 27%|██▋       | 27/100 [15:17<55:02, 45.24s/trial, best loss: -0.5871] 28%|██▊       | 28/100 [16:09<56:43, 47.27s/trial, best loss: -0.5871] 29%|██▉       | 29/100 [16:38<49:35, 41.90s/trial, best loss: -0.5871] 30%|███       | 30/100 [17:23<50:07, 42.96s/trial, best loss: -0.5871] 31%|███       | 31/100 [18:01<47:24, 41.22s/trial, best loss: -0.5871] 32%|███▏      | 32/100 [18:45<47:44, 42.12s/trial, best loss: -0.5871] 33%|███▎      | 33/100 [19:22<45:12, 40.49s/trial, best loss: -0.5871] 34%|███▍      | 34/100 [19:50<40:42, 37.01s/trial, best loss: -0.5871] 35%|███▌      | 35/100 [20:35<42:35, 39.32s/trial, best loss: -0.5871] 36%|███▌      | 36/100 [21:00<37:14, 34.92s/trial, best loss: -0.5871] 37%|███▋      | 37/100 [21:28<34:26, 32.80s/trial, best loss: -0.5871] 38%|███▊      | 38/100 [22:04<35:03, 33.92s/trial, best loss: -0.5871] 39%|███▉      | 39/100 [22:53<38:54, 38.27s/trial, best loss: -0.5871] 40%|████      | 40/100 [23:24<36:10, 36.18s/trial, best loss: -0.5871] 41%|████      | 41/100 [24:02<36:03, 36.67s/trial, best loss: -0.5871] 42%|████▏     | 42/100 [24:40<36:00, 37.25s/trial, best loss: -0.5871] 43%|████▎     | 43/100 [25:17<35:13, 37.07s/trial, best loss: -0.5871] 44%|████▍     | 44/100 [25:58<35:47, 38.35s/trial, best loss: -0.5871] 45%|████▌     | 45/100 [26:23<31:20, 34.19s/trial, best loss: -0.5871] 46%|████▌     | 46/100 [27:08<33:47, 37.54s/trial, best loss: -0.5871] 47%|████▋     | 47/100 [27:29<28:44, 32.53s/trial, best loss: -0.5871] 48%|████▊     | 48/100 [28:13<31:16, 36.08s/trial, best loss: -0.5871] 49%|████▉     | 49/100 [28:39<27:59, 32.93s/trial, best loss: -0.5871] 50%|█████     | 50/100 [29:26<30:55, 37.12s/trial, best loss: -0.5871] 51%|█████     | 51/100 [30:31<37:12, 45.55s/trial, best loss: -0.588]  52%|█████▏    | 52/100 [31:15<35:58, 44.96s/trial, best loss: -0.588] 53%|█████▎    | 53/100 [32:02<35:42, 45.59s/trial, best loss: -0.588] 54%|█████▍    | 54/100 [32:33<31:42, 41.37s/trial, best loss: -0.588] 55%|█████▌    | 55/100 [33:12<30:28, 40.63s/trial, best loss: -0.588] 56%|█████▌    | 56/100 [33:35<25:49, 35.21s/trial, best loss: -0.588] 57%|█████▋    | 57/100 [34:13<25:53, 36.14s/trial, best loss: -0.588] 58%|█████▊    | 58/100 [35:03<28:17, 40.40s/trial, best loss: -0.588] 59%|█████▉    | 59/100 [35:55<29:58, 43.86s/trial, best loss: -0.588] 60%|██████    | 60/100 [36:18<24:55, 37.38s/trial, best loss: -0.588] 61%|██████    | 61/100 [37:01<25:26, 39.13s/trial, best loss: -0.588] 62%|██████▏   | 62/100 [37:39<24:34, 38.80s/trial, best loss: -0.588] 63%|██████▎   | 63/100 [38:21<24:36, 39.91s/trial, best loss: -0.588] 64%|██████▍   | 64/100 [38:40<20:11, 33.65s/trial, best loss: -0.588] 65%|██████▌   | 65/100 [39:23<21:13, 36.38s/trial, best loss: -0.588] 66%|██████▌   | 66/100 [40:20<24:10, 42.67s/trial, best loss: -0.5887] 67%|██████▋   | 67/100 [41:13<25:08, 45.71s/trial, best loss: -0.5895] 68%|██████▊   | 68/100 [41:57<24:02, 45.07s/trial, best loss: -0.5895] 69%|██████▉   | 69/100 [42:52<24:52, 48.15s/trial, best loss: -0.5895] 70%|███████   | 70/100 [43:52<25:50, 51.68s/trial, best loss: -0.5895] 71%|███████   | 71/100 [44:37<24:02, 49.76s/trial, best loss: -0.5895] 72%|███████▏  | 72/100 [45:26<23:04, 49.45s/trial, best loss: -0.5895] 73%|███████▎  | 73/100 [46:01<20:19, 45.18s/trial, best loss: -0.5895] 74%|███████▍  | 74/100 [46:39<18:37, 43.00s/trial, best loss: -0.5895] 75%|███████▌  | 75/100 [47:19<17:28, 41.95s/trial, best loss: -0.5895] 76%|███████▌  | 76/100 [48:06<17:25, 43.58s/trial, best loss: -0.5895] 77%|███████▋  | 77/100 [48:52<16:56, 44.19s/trial, best loss: -0.5895] 78%|███████▊  | 78/100 [49:45<17:14, 47.03s/trial, best loss: -0.5895] 79%|███████▉  | 79/100 [50:39<17:07, 48.91s/trial, best loss: -0.5895] 80%|████████  | 80/100 [51:11<14:40, 44.04s/trial, best loss: -0.5895] 81%|████████  | 81/100 [51:52<13:37, 43.02s/trial, best loss: -0.5895] 82%|████████▏ | 82/100 [52:34<12:48, 42.67s/trial, best loss: -0.5895] 83%|████████▎ | 83/100 [53:16<12:00, 42.39s/trial, best loss: -0.5895] 84%|████████▍ | 84/100 [53:36<09:33, 35.87s/trial, best loss: -0.5895] 85%|████████▌ | 85/100 [54:09<08:42, 34.81s/trial, best loss: -0.5895] 86%|████████▌ | 86/100 [54:46<08:19, 35.65s/trial, best loss: -0.5895] 87%|████████▋ | 87/100 [55:21<07:38, 35.27s/trial, best loss: -0.5895] 88%|████████▊ | 88/100 [56:19<08:27, 42.25s/trial, best loss: -0.5895] 89%|████████▉ | 89/100 [56:52<07:15, 39.59s/trial, best loss: -0.5895] 90%|█████████ | 90/100 [57:43<07:10, 43.01s/trial, best loss: -0.5895] 91%|█████████ | 91/100 [58:18<06:03, 40.38s/trial, best loss: -0.5895] 92%|█████████▏| 92/100 [59:14<06:00, 45.10s/trial, best loss: -0.5895] 93%|█████████▎| 93/100 [59:44<04:43, 40.55s/trial, best loss: -0.5895] 94%|█████████▍| 94/100 [1:00:34<04:20, 43.48s/trial, best loss: -0.5895] 95%|█████████▌| 95/100 [1:01:22<03:44, 44.85s/trial, best loss: -0.5895] 96%|█████████▌| 96/100 [1:02:00<02:51, 42.84s/trial, best loss: -0.5895] 97%|█████████▋| 97/100 [1:02:26<01:53, 37.83s/trial, best loss: -0.5895] 98%|█████████▊| 98/100 [1:02:57<01:11, 35.71s/trial, best loss: -0.5895] 99%|█████████▉| 99/100 [1:03:48<00:40, 40.41s/trial, best loss: -0.5895]100%|██████████| 100/100 [1:04:46<00:00, 45.55s/trial, best loss: -0.5895]100%|██████████| 100/100 [1:04:46<00:00, 38.87s/trial, best loss: -0.5895]
최적화 완료. 최적 파라미터: {'colsample_bytree': 0.7712993813350446, 'learning_rate': 0.014764448164722338, 'max_depth': 13.0, 'min_child_weight': 2.0, 'num_leaves': 144.0, 'reg_alpha': 0.9375760221934153, 'reg_lambda': 0.6881109653195318, 'subsample': 0.6932106255794361}
최적 CSI 점수: 0.5895 (loss: -0.5895)

최적화 과정 요약:
  - 총 시도 횟수: 100
  - 성공한 시도: 100
  - 최초 CSI: 0.5774
  - 최종 CSI: 0.5837
  - 최고 CSI: 0.5895
  - 최저 CSI: 0.5609
  - 평균 CSI: 0.5779

최적화 Trials 객체가 /workspace/visibility_prediction/Analysis_code/optimization_history/lgb_smote_seoul_trials.pkl에 저장되었습니다.
최종 모델 학습 시작...
Fold 1 학습 중... (학습 연도: [2018, 2019], 검증 연도: 2020)
Fold 1 검증 CSI: 0.4598
Fold 2 학습 중... (학습 연도: [2018, 2020], 검증 연도: 2019)
Fold 2 검증 CSI: 0.6692
Fold 3 학습 중... (학습 연도: [2019, 2020], 검증 연도: 2018)
Fold 3 검증 CSI: 0.6130
모델 저장 중...
모델이 /workspace/visibility_prediction/Analysis_code/save_model/lgb_optima/lgb_smote_seoul.pkl에 저장되었습니다.

✓ 완료: lgb_smote/LGB_smote_seoul.py (소요 시간: 3932초)

==========================================
LGB SMOTE 파일 실행 완료
종료 시간: 2025-12-28 01:35:18
총 소요 시간: 12시간 17분 30초
성공: 6개
실패: 0개
==========================================
