nohup: ignoring input
/bin/bash: /opt/conda/lib/libtinfo.so.6: no version information available (required by /bin/bash)
==========================================
LGB Pure 파일 실행 시작
시작 시간: 2025-12-23 14:35:46
GPU: 1번 (os.environ['CUDA_VISIBLE_DEVICES'] = '1')
==========================================

----------------------------------------
실행 중: lgb_pure/LGB_pure_daegu.py
시작 시간: 2025-12-23 14:35:46
----------------------------------------
데이터 로딩 중...
데이터 전처리 중...
하이퍼파라미터 최적화 시작...

  0%|          | 0/100 [00:00<?, ?trial/s, best loss=?]
  1%|          | 1/100 [00:17<28:08, 17.06s/trial, best loss: -0.3669]
  2%|▏         | 2/100 [00:51<44:13, 27.07s/trial, best loss: -0.3801]
  3%|▎         | 3/100 [01:10<37:53, 23.43s/trial, best loss: -0.3814]
  4%|▍         | 4/100 [01:30<35:15, 22.03s/trial, best loss: -0.3814]
  5%|▌         | 5/100 [02:15<48:08, 30.41s/trial, best loss: -0.3816]
  6%|▌         | 6/100 [02:49<49:48, 31.79s/trial, best loss: -0.3816]
  7%|▋         | 7/100 [03:13<45:15, 29.20s/trial, best loss: -0.3816]
  8%|▊         | 8/100 [03:31<39:19, 25.64s/trial, best loss: -0.3816]
  9%|▉         | 9/100 [03:53<37:11, 24.52s/trial, best loss: -0.3851]
 10%|█         | 10/100 [04:10<33:17, 22.19s/trial, best loss: -0.3851]
 11%|█         | 11/100 [04:32<32:33, 21.95s/trial, best loss: -0.3851]
 12%|█▏        | 12/100 [04:56<33:07, 22.59s/trial, best loss: -0.3851]
 13%|█▎        | 13/100 [05:13<30:13, 20.85s/trial, best loss: -0.3851]
 14%|█▍        | 14/100 [05:43<34:10, 23.84s/trial, best loss: -0.3851]
 15%|█▌        | 15/100 [06:02<31:25, 22.18s/trial, best loss: -0.3851]
 16%|█▌        | 16/100 [06:18<28:35, 20.43s/trial, best loss: -0.3851]
 17%|█▋        | 17/100 [06:35<26:38, 19.26s/trial, best loss: -0.3851]
 18%|█▊        | 18/100 [06:53<25:50, 18.91s/trial, best loss: -0.3851]
 19%|█▉        | 19/100 [07:14<26:27, 19.59s/trial, best loss: -0.3868]
 20%|██        | 20/100 [07:40<28:43, 21.54s/trial, best loss: -0.3868]
 21%|██        | 21/100 [08:01<28:22, 21.54s/trial, best loss: -0.3868]
 22%|██▏       | 22/100 [08:19<26:17, 20.22s/trial, best loss: -0.3868]
 23%|██▎       | 23/100 [08:40<26:13, 20.44s/trial, best loss: -0.3868]
 24%|██▍       | 24/100 [09:03<27:02, 21.35s/trial, best loss: -0.3868]
 25%|██▌       | 25/100 [09:23<26:21, 21.08s/trial, best loss: -0.3941]
 26%|██▌       | 26/100 [09:46<26:22, 21.38s/trial, best loss: -0.3941]
 27%|██▋       | 27/100 [10:05<25:27, 20.93s/trial, best loss: -0.3941]
 28%|██▊       | 28/100 [10:23<23:46, 19.81s/trial, best loss: -0.3941]
 29%|██▉       | 29/100 [10:43<23:45, 20.08s/trial, best loss: -0.3941]
 30%|███       | 30/100 [11:03<23:09, 19.85s/trial, best loss: -0.3941]
 31%|███       | 31/100 [11:22<22:28, 19.55s/trial, best loss: -0.3941]
 32%|███▏      | 32/100 [11:39<21:35, 19.05s/trial, best loss: -0.3941]
 33%|███▎      | 33/100 [12:01<22:12, 19.89s/trial, best loss: -0.3941]
 34%|███▍      | 34/100 [12:23<22:30, 20.46s/trial, best loss: -0.3941]
 35%|███▌      | 35/100 [12:42<21:39, 20.00s/trial, best loss: -0.3941]
 36%|███▌      | 36/100 [13:01<21:06, 19.79s/trial, best loss: -0.3941]
 37%|███▋      | 37/100 [13:21<20:44, 19.76s/trial, best loss: -0.3941]
 38%|███▊      | 38/100 [13:41<20:32, 19.88s/trial, best loss: -0.3941]
 39%|███▉      | 39/100 [14:12<23:41, 23.30s/trial, best loss: -0.4047]
 40%|████      | 40/100 [14:48<26:51, 26.87s/trial, best loss: -0.4047]
 41%|████      | 41/100 [15:16<26:44, 27.19s/trial, best loss: -0.4047]
 42%|████▏     | 42/100 [15:49<28:05, 29.06s/trial, best loss: -0.4047]
 43%|████▎     | 43/100 [16:18<27:41, 29.14s/trial, best loss: -0.4047]
 44%|████▍     | 44/100 [17:02<31:14, 33.47s/trial, best loss: -0.4047]
 45%|████▌     | 45/100 [17:39<31:47, 34.67s/trial, best loss: -0.4047]
 46%|████▌     | 46/100 [18:03<28:19, 31.47s/trial, best loss: -0.4047]
 47%|████▋     | 47/100 [18:36<28:09, 31.88s/trial, best loss: -0.4047]
 48%|████▊     | 48/100 [19:10<28:01, 32.34s/trial, best loss: -0.4047]
 49%|████▉     | 49/100 [19:34<25:27, 29.94s/trial, best loss: -0.4047]
 50%|█████     | 50/100 [19:55<22:45, 27.31s/trial, best loss: -0.4047]
 51%|█████     | 51/100 [20:28<23:39, 28.98s/trial, best loss: -0.4047]
 52%|█████▏    | 52/100 [20:55<22:47, 28.49s/trial, best loss: -0.4047]
 53%|█████▎    | 53/100 [21:19<21:14, 27.12s/trial, best loss: -0.4047]
 54%|█████▍    | 54/100 [21:50<21:31, 28.08s/trial, best loss: -0.4047]
 55%|█████▌    | 55/100 [22:18<21:10, 28.23s/trial, best loss: -0.4047]
 56%|█████▌    | 56/100 [22:43<20:01, 27.32s/trial, best loss: -0.4047]
 57%|█████▋    | 57/100 [23:14<20:22, 28.42s/trial, best loss: -0.4047]
 58%|█████▊    | 58/100 [23:38<18:47, 26.85s/trial, best loss: -0.4047]
 59%|█████▉    | 59/100 [24:05<18:24, 26.93s/trial, best loss: -0.4047]
 60%|██████    | 60/100 [24:42<20:05, 30.15s/trial, best loss: -0.4047]
 61%|██████    | 61/100 [25:07<18:31, 28.49s/trial, best loss: -0.4047]
 62%|██████▏   | 62/100 [25:36<18:13, 28.78s/trial, best loss: -0.4047]
 63%|██████▎   | 63/100 [26:08<18:11, 29.49s/trial, best loss: -0.4047]
 64%|██████▍   | 64/100 [26:49<19:48, 33.00s/trial, best loss: -0.4047]
 65%|██████▌   | 65/100 [27:14<17:50, 30.58s/trial, best loss: -0.4047]
 66%|██████▌   | 66/100 [27:36<15:55, 28.11s/trial, best loss: -0.4047]
 67%|██████▋   | 67/100 [28:01<14:56, 27.17s/trial, best loss: -0.4047]
 68%|██████▊   | 68/100 [28:22<13:26, 25.21s/trial, best loss: -0.4047]
 69%|██████▉   | 69/100 [28:41<12:03, 23.34s/trial, best loss: -0.4047]
 70%|███████   | 70/100 [29:03<11:29, 22.98s/trial, best loss: -0.4047]
 71%|███████   | 71/100 [29:26<11:07, 23.01s/trial, best loss: -0.4047]
 72%|███████▏  | 72/100 [29:49<10:42, 22.96s/trial, best loss: -0.4047]
 73%|███████▎  | 73/100 [30:18<11:08, 24.77s/trial, best loss: -0.4047]
 74%|███████▍  | 74/100 [30:42<10:44, 24.78s/trial, best loss: -0.4047]
 75%|███████▌  | 75/100 [31:07<10:16, 24.64s/trial, best loss: -0.4047]
 76%|███████▌  | 76/100 [31:29<09:37, 24.06s/trial, best loss: -0.4047]
 77%|███████▋  | 77/100 [31:54<09:15, 24.13s/trial, best loss: -0.4047]
 78%|███████▊  | 78/100 [32:21<09:14, 25.19s/trial, best loss: -0.4047]
 79%|███████▉  | 79/100 [32:47<08:48, 25.17s/trial, best loss: -0.4047]
 80%|████████  | 80/100 [33:17<08:52, 26.63s/trial, best loss: -0.4047]
 81%|████████  | 81/100 [33:42<08:21, 26.39s/trial, best loss: -0.4047]
 82%|████████▏ | 82/100 [34:06<07:40, 25.59s/trial, best loss: -0.4047]
 83%|████████▎ | 83/100 [34:33<07:20, 25.89s/trial, best loss: -0.405] 
 84%|████████▍ | 84/100 [35:04<07:20, 27.51s/trial, best loss: -0.405]
 85%|████████▌ | 85/100 [35:35<07:07, 28.52s/trial, best loss: -0.405]
 86%|████████▌ | 86/100 [36:13<07:20, 31.45s/trial, best loss: -0.405]
 87%|████████▋ | 87/100 [36:47<06:59, 32.27s/trial, best loss: -0.405]
 88%|████████▊ | 88/100 [37:24<06:44, 33.70s/trial, best loss: -0.405]
 89%|████████▉ | 89/100 [37:45<05:26, 29.65s/trial, best loss: -0.405]
 90%|█████████ | 90/100 [38:29<05:41, 34.12s/trial, best loss: -0.405]
 91%|█████████ | 91/100 [38:58<04:53, 32.61s/trial, best loss: -0.405]
 92%|█████████▏| 92/100 [39:33<04:26, 33.26s/trial, best loss: -0.405]
 93%|█████████▎| 93/100 [39:57<03:33, 30.47s/trial, best loss: -0.405]
 94%|█████████▍| 94/100 [40:15<02:41, 26.88s/trial, best loss: -0.405]
 95%|█████████▌| 95/100 [40:41<02:12, 26.50s/trial, best loss: -0.405]
 96%|█████████▌| 96/100 [40:59<01:35, 23.82s/trial, best loss: -0.405]
 97%|█████████▋| 97/100 [41:33<01:20, 26.87s/trial, best loss: -0.405]
 98%|█████████▊| 98/100 [41:57<00:52, 26.17s/trial, best loss: -0.405]
 99%|█████████▉| 99/100 [42:17<00:24, 24.21s/trial, best loss: -0.405]
100%|██████████| 100/100 [42:41<00:00, 24.27s/trial, best loss: -0.405]
100%|██████████| 100/100 [42:41<00:00, 25.62s/trial, best loss: -0.405]

최적화 완료. 최적 파라미터: {'colsample_bytree': 0.7032353545561223, 'learning_rate': 0.027019407889171166, 'max_depth': 3.0, 'min_child_weight': 4.0, 'num_leaves': 134.0, 'reg_alpha': 0.3506952189889989, 'reg_lambda': 0.46506999012541095, 'subsample': 0.9411873767438697}
최적 CSI 점수: 0.4050 (loss: -0.4050)

최적화 과정 요약:
  - 총 시도 횟수: 100
  - 성공한 시도: 100
  - 최초 CSI: 0.3669
  - 최종 CSI: 0.3866
  - 최고 CSI: 0.4050
  - 최저 CSI: 0.3499
  - 평균 CSI: 0.3832

최적화 Trials 객체가 ../optimization_history/lgb_pure_daegu_trials.pkl에 저장되었습니다.
최종 모델 학습 시작...
Fold 1 학습 중... (학습 연도: [2018, 2019], 검증 연도: 2020)
Fold 1 검증 CSI: 0.4786
Fold 2 학습 중... (학습 연도: [2018, 2020], 검증 연도: 2019)
Fold 2 검증 CSI: 0.4185
Fold 3 학습 중... (학습 연도: [2019, 2020], 검증 연도: 2018)
Fold 3 검증 CSI: 0.2914
모델 저장 중...
모델이 ../save_model/lgb_optima/lgb_pure_daegu.pkl에 저장되었습니다.

✓ 완료: lgb_pure/LGB_pure_daegu.py (소요 시간: 2567초)

----------------------------------------
실행 중: lgb_pure/LGB_pure_daejeon.py
시작 시간: 2025-12-23 15:18:33
----------------------------------------
데이터 로딩 중...
데이터 전처리 중...
하이퍼파라미터 최적화 시작...

  0%|          | 0/100 [00:00<?, ?trial/s, best loss=?]
  1%|          | 1/100 [00:32<53:10, 32.23s/trial, best loss: -0.494]
  2%|▏         | 2/100 [00:52<41:36, 25.47s/trial, best loss: -0.494]
  3%|▎         | 3/100 [01:20<42:25, 26.24s/trial, best loss: -0.494]
  4%|▍         | 4/100 [01:45<41:43, 26.08s/trial, best loss: -0.4942]
  5%|▌         | 5/100 [02:09<40:03, 25.30s/trial, best loss: -0.4942]
  6%|▌         | 6/100 [02:31<37:37, 24.01s/trial, best loss: -0.4942]
  7%|▋         | 7/100 [02:51<35:04, 22.63s/trial, best loss: -0.4942]
  8%|▊         | 8/100 [03:23<39:24, 25.70s/trial, best loss: -0.4942]
  9%|▉         | 9/100 [03:55<41:53, 27.62s/trial, best loss: -0.4942]
 10%|█         | 10/100 [04:19<40:01, 26.68s/trial, best loss: -0.4951]
 11%|█         | 11/100 [04:58<44:56, 30.30s/trial, best loss: -0.4951]
 12%|█▏        | 12/100 [05:41<50:14, 34.25s/trial, best loss: -0.4951]
 13%|█▎        | 13/100 [06:07<46:05, 31.79s/trial, best loss: -0.4951]
 14%|█▍        | 14/100 [06:27<40:29, 28.25s/trial, best loss: -0.4951]
 15%|█▌        | 15/100 [06:49<37:14, 26.29s/trial, best loss: -0.4951]
 16%|█▌        | 16/100 [07:10<34:40, 24.76s/trial, best loss: -0.4951]
 17%|█▋        | 17/100 [07:38<35:28, 25.65s/trial, best loss: -0.4951]
 18%|█▊        | 18/100 [08:06<36:11, 26.48s/trial, best loss: -0.4951]
 19%|█▉        | 19/100 [08:44<40:14, 29.81s/trial, best loss: -0.4951]
 20%|██        | 20/100 [09:23<43:13, 32.42s/trial, best loss: -0.4951]
 21%|██        | 21/100 [10:22<53:20, 40.51s/trial, best loss: -0.4951]
 22%|██▏       | 22/100 [11:11<56:10, 43.21s/trial, best loss: -0.4951]
 23%|██▎       | 23/100 [11:45<51:44, 40.32s/trial, best loss: -0.4951]
 24%|██▍       | 24/100 [12:25<51:04, 40.32s/trial, best loss: -0.4951]
 25%|██▌       | 25/100 [12:55<46:20, 37.07s/trial, best loss: -0.4951]
 26%|██▌       | 26/100 [13:44<50:04, 40.60s/trial, best loss: -0.4951]
 27%|██▋       | 27/100 [14:39<54:46, 45.02s/trial, best loss: -0.4951]
 28%|██▊       | 28/100 [15:17<51:28, 42.90s/trial, best loss: -0.4951]
 29%|██▉       | 29/100 [15:46<45:55, 38.82s/trial, best loss: -0.4951]
 30%|███       | 30/100 [16:14<41:23, 35.48s/trial, best loss: -0.4951]
 31%|███       | 31/100 [16:35<35:40, 31.02s/trial, best loss: -0.4951]
 32%|███▏      | 32/100 [17:03<34:20, 30.30s/trial, best loss: -0.4951]
 33%|███▎      | 33/100 [17:28<32:07, 28.77s/trial, best loss: -0.4951]
 34%|███▍      | 34/100 [18:06<34:28, 31.34s/trial, best loss: -0.4951]
 35%|███▌      | 35/100 [18:42<35:26, 32.71s/trial, best loss: -0.4951]
 36%|███▌      | 36/100 [19:20<36:40, 34.38s/trial, best loss: -0.4951]
 37%|███▋      | 37/100 [19:43<32:25, 30.88s/trial, best loss: -0.4951]
 38%|███▊      | 38/100 [20:06<29:37, 28.68s/trial, best loss: -0.4951]
 39%|███▉      | 39/100 [20:28<27:09, 26.72s/trial, best loss: -0.4951]
 40%|████      | 40/100 [21:25<35:38, 35.65s/trial, best loss: -0.4951]
 41%|████      | 41/100 [21:49<31:45, 32.29s/trial, best loss: -0.4951]
 42%|████▏     | 42/100 [22:21<31:03, 32.13s/trial, best loss: -0.4951]
 43%|████▎     | 43/100 [22:44<27:49, 29.29s/trial, best loss: -0.4951]
 44%|████▍     | 44/100 [23:18<28:46, 30.83s/trial, best loss: -0.4951]
 45%|████▌     | 45/100 [24:03<32:05, 35.02s/trial, best loss: -0.4951]
 46%|████▌     | 46/100 [24:26<28:18, 31.45s/trial, best loss: -0.4951]
 47%|████▋     | 47/100 [25:04<29:38, 33.56s/trial, best loss: -0.4962]
 48%|████▊     | 48/100 [25:25<25:4
 51%|█████     | 51/100 [26:44<22:33, 27.62s/trial, best loss: -0.4962]
 52%|█████▏    | 52/100 [27:08<21:16, 26.59s/trial, best loss: -0.4962]
 53%|█████▎    | 53/100 [27:32<20:09, 25.74s/trial, best loss: -0.4962]
 54%|█████▍    | 54/100 [27:54<19:01, 24.81s/trial, best loss: -0.4962]
 55%|█████▌    | 55/100 [28:35<22:13, 29.64s/trial, best loss: -0. 56%|█████▌    | 56/100 [29:14<23:49, 32.49s/trial, best loss: -0.4962] 57%|█████▋    | 57/100 [29:44<22:45, 31.75s/trial, best loss: -0.4962] 58%|█████▊    | 58/100 [30:17<22:17, 31.85s/trial, best loss: -0.4962] 59%|█████▉    | 59/100 [31:03<24:46, 36.25s/trial, best loss: -0.4962] 60%|██████    | 60/100 [31:47<25:40, 38.52s/trial, best loss: -0.4962] 61%|██████    | 61/100 [32:10<22:04, 33.96s/trial, best loss: -0.4962] 62%|██████▏   | 62/100 [32:38<20:18, 32.07s/trial, best loss: -0.4962] 63%|██████▎   | 63/100 [33:02<18:17, 29.66s/trial, best loss: -0.4962] 64%|██████▍   | 64/100 [33:25<16:38, 27.75s/trial, best loss: -0.4962] 65%|██████▌   | 65/100 [33:52<16:06, 27.62s/trial, best loss: -0.4962] 66%|██████▌   | 66/100 [34:37<18:31, 32.68s/trial, best loss: -0.4962] 67%|██████▋   | 67/100 [35:19<19:31, 35.51s/trial, best loss: -0.4962] 68%|██████▊   | 68/100 [36:06<20:46, 38.95s/trial, best loss: -0.4962] 69%|██████▉   | 69/100 [36:43<19:48, 38.34s/trial, best loss: -0.4962] 70%|███████   | 70/100 [37:27<20:02, 40.07s/trial, best loss: -0.4962] 71%|███████   | 71/100 [38:10<19:43, 40.81s/trial, best loss: -0.4962] 72%|███████▏  | 72/100 [38:48<18:40, 40.01s/trial, best loss: -0.4962] 73%|███████▎  | 73/100 [39:21<17:06, 38.03s/trial, best loss: -0.4962] 74%|███████▍  | 74/100 [39:52<15:31, 35.83s/trial, best loss: -0.4962] 75%|███████▌  | 75/100 [40:21<14:04, 33.78s/trial, best loss: -0.4962] 76%|███████▌  | 76/100 [41:08<15:09, 37.88s/trial, best loss: -0.4962] 77%|███████▋  | 77/100 [41:34<13:09, 34.32s/trial, best loss: -0.4962] 78%|███████▊  | 78/100 [42:32<15:06, 41.21s/trial, best loss: -0.4962] 79%|███████▉  | 79/100 [43:01<13:12, 37.72s/trial, best loss: -0.4962] 80%|████████  | 80/100 [43:52<13:51, 41.56s/trial, best loss: -0.4962] 81%|████████  | 81/100 [44:26<12:28, 39.39s/trial, best loss: -0.4962] 82%|████████▏ | 82/100 [44:56<10:57, 36.53s/trial, best loss: -0.4962] 83%|████████▎ | 83/100 [45:20<09:18, 32.87s/trial, best loss: -0.4962] 84%|████████▍ | 84/100 [46:15<10:32, 39.52s/trial, best loss: -0.4962] 85%|████████▌ | 85/100 [46:41<08:52, 35.53s/trial, best loss: -0.4963] 86%|████████▌ | 86/100 [47:10<07:49, 33.55s/trial, best loss: -0.4963] 87%|████████▋ | 87/100 [47:47<07:29, 34.55s/trial, best loss: -0.4963] 88%|████████▊ | 88/100 [48:17<06:35, 32.97s/trial, best loss: -0.4963] 89%|████████▉ | 89/100 [48:44<05:44, 31.32s/trial, best loss: -0.4963] 90%|█████████ | 90/100 [49:20<05:25, 32.57s/trial, best loss: -0.4963] 91%|█████████ | 91/100 [49:51<04:51, 32.37s/trial, best loss: -0.4963] 92%|█████████▏| 92/100 [50:18<04:05, 30.66s/trial, best loss: -0.4963] 93%|█████████▎| 93/100 [50:45<03:27, 29.67s/trial, best loss: -0.4963] 94%|█████████▍| 94/100 [51:10<02:49, 28.27s/trial, best loss: -0.4963] 95%|█████████▌| 95/100 [51:33<02:13, 26.63s/trial, best loss: -0.4963] 96%|█████████▌| 96/100 [51:58<01:44, 26.04s/trial, best loss: -0.4963] 97%|█████████▋| 97/100 [52:25<01:18, 26.27s/trial, best loss: -0.4963] 98%|█████████▊| 98/100 [52:54<00:54, 27.20s/trial, best loss: -0.4963] 99%|█████████▉| 99/100 [53:30<00:29, 29.75s/trial, best loss: -0.4963]100%|██████████| 100/100 [53:59<00:00, 29.53s/trial, best loss: -0.4963]100%|██████████| 100/100 [53:59<00:00, 32.39s/trial, best loss: -0.4963]

최적화 완료. 최적 파라미터: {'colsample_bytree': 0.8561310986458904, 'learning_rate': 0.04190098150317689, 'max_depth': 13.0, 'min_child_weight': 10.0, 'num_leaves': 20.0, 'reg_alpha': 0.8699443310189154, 'reg_lambda': 0.6437824460768218, 'subsample': 0.7878286207681128}
최적 CSI 점수: 0.4963 (loss: -0.4963)

최적화 과정 요약:
  - 총 시도 횟수: 100
  - 성공한 시도: 100
  - 최초 CSI: 0.4940
  - 최종 CSI: 0.4862
  - 최고 CSI: 0.4963
  - 최저 CSI: 0.4686
  - 평균 CSI: 0.4895

최적화 Trials 객체가 ../optimization_history/lgb_pure_daejeon_trials.pkl에 저장되었습니다.
최종 모델 학습 시작...
Fold 1 학습 중... (학습 연도: [2018, 2019], 검증 연도: 2020)
Fold 1 검증 CSI: 0.4501
Fold 2 학습 중... (학습 연도: [2018, 2020], 검증 연도: 2019)
Fold 2 검증 CSI: 0.4578
Fold 3 학습 중... (학습 연도: [2019, 2020], 검증 연도: 2018)
Fold 3 검증 CSI: 0.5726
모델 저장 중...
모델이 ../save_model/lgb_optima/lgb_pure_daejeon.pkl에 저장되었습니다.

✓ 완료: lgb_pure/LGB_pure_daejeon.py (소요 시간: 3250초)

----------------------------------------
실행 중: lgb_pure/LGB_pure_gwangju.py
시작 시간: 2025-12-23 16:12:43
----------------------------------------
데이터 로딩 중...
데이터 전처리 중...
하이퍼파라미터 최적화 시작...
  0%|          | 0/100 [00:00<?, ?trial/s, best loss=?]  1%|          | 1/100 [00:35<58:04, 35.20s/trial, best loss: -0.4806]  2%|▏         | 2/100 [00:54<41:54, 25.66s/trial, best loss: -0.4834]  3%|▎         | 3/100 [01:28<47:58, 29.67s/trial, best loss: -0.4834]  4%|▍         | 4/100 [01:51<42:59, 26.87s/trial, best loss: -0.4834]  5%|▌         | 5/100 [02:20<44:10, 27.90s/trial, best loss: -0.4834]  6%|▌         | 6/100 [02:43<40:43, 25.99s/trial, best loss: -0.4861]  7%|▋         | 7/100 [03:14<42:54, 27.68s/trial, best loss: -0.4911]  8%|▊         | 8/100 [03:53<47:53, 31.24s/trial, best loss: -0.4911]  9%|▉         | 9/100 [04:17<44:14, 29.17s/trial, best loss: -0.4911] 10%|█         | 10/100 [04:42<41:51, 27.90s/trial, best loss: -0.4926] 11%|█         | 11/100 [05:10<41:27, 27.95s/trial, best loss: -0.4926] 12%|█▏        | 12/100 [05:36<39:59, 27.27s/trial, best loss: -0.4926] 13%|█▎        | 13/100 [06:06<40:37, 28.02s/trial, best loss: -0.4926] 14%|█▍        | 14/100 [06:34<40:11, 28.04s/trial, best loss: -0.4942] 15%|█▌        | 15/100 [07:03<40:14, 28.41s/trial, best loss: -0.4942] 16%|█▌        | 16/100 [07:25<37:03, 26.47s/trial, best loss: -0.4942] 17%|█▋        | 17/100 [07:53<37:17, 26.96s/trial, best loss: -0.4942] 18%|█▊        | 18/100 [08:14<34:26, 25.20s/trial, best loss: -0.4942] 19%|█▉        | 19/100 [08:50<38:20, 28.40s/trial, best loss: -0.4942] 20%|██        | 20/100 [09:21<38:57, 29.22s/trial, best loss: -0.4942] 21%|██        | 21/100 [09:42<35:12, 26.74s/trial, best loss: -0.4942] 22%|██▏       | 22/100 [10:27<41:40, 32.06s/trial, best loss: -0.4942] 23%|██▎       | 23/100 [10:52<38:25, 29.95s/trial, best loss: -0.4942] 24%|██▍       | 24/100 [11:30<40:53, 32.28s/trial, best loss: -0.4942] 25%|██▌       | 25/100 [11:51<36:12, 28.97s/trial, best loss: -0.4942] 26%|██▌       | 26/100 [12:28<38:54, 31.55s/trial, best loss: -0.4942] 27%|██▋       | 27/100 [12:56<36:57, 30.38s/trial, best loss: -0.4942] 28%|██▊       | 28/100 [13:18<33:16, 27.73s/trial, best loss: -0.4942] 29%|██▉       | 29/100 [13:56<36:46, 31.07s/trial, best loss: -0.4942] 30%|███       | 30/100 [14:50<43:59, 37.70s/trial, best loss: -0.4942] 31%|███       | 31/100 [15:09<36:57, 32.14s/trial, best loss: -0.4942] 32%|███▏      | 32/100 [15:38<35:32, 31.36s/trial, best loss: -0.4942] 33%|███▎      | 33/100 [16:03<32:54, 29.47s/trial, best loss: -0.4942] 34%|███▍      | 34/100 [16:31<31:42, 28.82s/trial, best loss: -0.4942] 35%|███▌      | 35/100 [16:50<27:58, 25.82s/trial, best loss: -0.4942] 36%|███▌      | 36/100 [17:15<27:19, 25.62s/trial, best loss: -0.4942] 37%|███▋      | 37/100 [18:01<33:19, 31.74s/trial, best loss: -0.4942] 38%|███▊      | 38/100 [18:32<32:35, 31.54s/trial, best loss: -0.4942] 39%|███▉      | 39/100 [18:58<30:21, 29.87s/trial, best loss: -0.4942] 40%|████      | 40/100 [19:22<28:10, 28.17s/trial, best loss: -0.4942] 41%|████      | 41/100 [19:58<29:54, 30.41s/trial, best loss: -0.4942] 42%|████▏     | 42/100 [20:24<28:13, 29.20s/trial, best loss: -0.4942] 43%|████▎     | 43/100 [20:46<25:44, 27.10s/trial, best loss: -0.4942] 44%|████▍     | 44/100 [21:15<25:53, 27.75s/trial, best loss: -0.4942] 45%|████▌     | 45/100 [21:53<28:02, 30.59s/trial, best loss: -0.4942] 46%|████▌     | 46/100 [22:44<33:08, 36.83s/trial, best loss: -0.4942] 47%|████▋     | 47/100 [23:05<28:21, 32.11s/trial, best loss: -0.4942] 48%|████▊     | 48/100 [23:28<25:18, 29.20s/trial, best loss: -0.4942] 49%|████▉     | 49/100 [23:58<25:04, 29.50s/trial, best loss: -0.4942] 50%|█████     | 50/100 [24:22<23:22, 28.06s/trial, best loss: -0.4942] 51%|█████     | 51/100 [24:48<22:16, 27.27s/trial, best loss: -0.4942] 52%|█████▏    | 52/100 [25:26<24:30, 30.63s/trial, best loss: -0.4942] 53%|█████▎    | 53/100 [26:01<25:01, 31.95s/trial, best loss: -0.4942] 54%|█████▍    | 54/100 [26:26<22:45, 29.68s/trial, best loss: -0.4942] 55%|█████▌    | 55/100 [26:52<21:33, 28.75s/trial, best loss: -0.4942] 56%|█████▌    | 56/100 [27:13<19:12, 26.18s/trial, best loss: -0.4942] 57%|█████▋    | 57/100 [27:33<17:33, 24.49s/trial, best loss: -0.4942] 58%|█████▊    | 58/100 [27:57<16:55, 24.19s/trial, best loss: -0.4942] 59%|█████▉    | 59/100 [28:29<18:10, 26.60s/trial, best loss: -0.4942] 60%|██████    | 60/100 [28:56<17:53, 26.85s/trial, best loss: -0.4942] 61%|██████    | 61/100 [29:28<18:24, 28.32s/trial, best loss: -0.4942] 62%|██████▏   | 62/100 [30:08<20:14, 31.95s/trial, best loss: -0.4943] 63%|██████▎   | 63/100 [30:53<22:00, 35.68s/trial, best loss: -0.4943] 64%|██████▍   | 64/100 [31:30<21:45, 36.27s/trial, best loss: -0.4943] 65%|██████▌   | 65/100 [32:12<22:00, 37.73s/trial, best loss: -0.4943] 66%|██████▌   | 66/100 [32:45<20:34, 36.31s/trial, best loss: -0.4943] 67%|██████▋   | 67/100 [33:37<22:39, 41.20s/trial, best loss: -0.4943] 68%|██████▊   | 68/100 [34:12<20:57, 39.29s/trial, best loss: -0.4943] 69%|██████▉   | 69/100 [34:52<20:26, 39.58s/trial, best loss: -0.4943] 70%|███████   | 70/100 [35:30<19:27, 38.92s/trial, best loss: -0.4943] 71%|███████   | 71/100 [36:04<18:10, 37.60s/trial, best loss: -0.4943] 72%|███████▏  | 72/100 [36:43<17:42, 37.95s/trial, best loss: -0.4943] 73%|███████▎  | 73/100 [37:19<16:46, 37.27s/trial, best loss: -0.4943] 74%|███████▍  | 74/100 [37:58<16:27, 37.98s/trial, best loss: -0.4976] 75%|███████▌  | 75/100 [38:27<14:42, 35.29s/trial, best loss: -0.4976] 76%|███████▌  | 76/100 [38:53<13:01, 32.54s/trial, best loss: -0.4976] 77%|███████▋  | 77/100 [39:24<12:16, 32.00s/trial, best loss: -0.4976] 78%|███████▊  | 78/100 [40:02<12:24, 33.82s/trial, best loss: -0.4976] 79%|███████▉  | 79/100 [40:51<13:24, 38.30s/trial, best loss: -0.4976] 80%|████████  | 80/100 [41:32<13:02, 39.11s/trial, best loss: -0.4976] 81%|████████  | 81/100 [42:14<12:40, 40.01s/trial, best loss: -0.4976] 82%|████████▏ | 82/100 [42:54<12:01, 40.09s/trial, best loss: -0.4976] 83%|████████▎ | 83/100 [43:26<10:36, 37.43s/trial, best loss: -0.4976] 84%|████████▍ | 84/100 [44:13<10:46, 40.43s/trial, best loss: -0.4976] 85%|████████▌ | 85/100 [44:51<09:57, 39.80s/trial, best loss: -0.4976] 86%|████████▌ | 86/100 [45:26<08:55, 38.26s/trial, best loss: -0.4976] 87%|████████▋ | 87/100 [46:14<08:53, 41.04s/trial, best loss: -0.4976] 88%|████████▊ | 88/100 [46:52<08:04, 40.35s/trial, best loss: -0.4976] 89%|████████▉ | 89/100 [47:25<06:59, 38.12s/trial, best loss: -0.4976] 90%|█████████ | 90/100 [48:02<06:17, 37.72s/trial, best loss: -0.4976] 91%|█████████ | 91/100 [48:40<05:39, 37.68s/trial, best loss: -0.4976] 92%|█████████▏| 92/100 [49:12<04:47, 35.99s/trial, best loss: -0.4976] 93%|█████████▎| 93/100 [49:48<04:13, 36.20s/trial, best loss: -0.4976] 94%|█████████▍| 94/100 [50:38<04:00, 40.14s/trial, best loss: -0.4976] 95%|█████████▌| 95/100 [51:11<03:10, 38.11s/trial, best loss: -0.4976] 96%|█████████▌| 96/100 [51:41<02:22, 35.55s/trial, best loss: -0.4976] 97%|█████████▋| 97/100 [52:09<01:40, 33.52s/trial, best loss: -0.4976] 98%|█████████▊| 98/100 [52:55<01:14, 37.21s/trial, best loss: -0.4976] 99%|█████████▉| 99/100 [53:30<00:36, 36.40s/trial, best loss: -0.4976]100%|██████████| 100/100 [53:56<00:00, 33.32s/trial, best loss: -0.4976]100%|██████████| 100/100 [53:56<00:00, 32.36s/trial, best loss: -0.4976]

최적화 완료. 최적 파라미터: {'colsample_bytree': 0.944925569294789, 'learning_rate': 0.014333972349102263, 'max_depth': 13.0, 'min_child_weight': 13.0, 'num_leaves': 70.0, 'reg_alpha': 0.31059473707139207, 'reg_lambda': 0.19125854192836045, 'subsample': 0.6106523377701687}
최적 CSI 점수: 0.4976 (loss: -0.4976)

최적화 과정 요약:
  - 총 시도 횟수: 100
  - 성공한 시도: 100
  - 최초 CSI: 0.4806
  - 최종 CSI: 0.4914
  - 최고 CSI: 0.4976
  - 최저 CSI: 0.4734
  - 평균 CSI: 0.4866

최적화 Trials 객체가 ../optimization_history/lgb_pure_gwangju_trials.pkl에 저장되었습니다.
최종 모델 학습 시작...
Fold 1 학습 중... (학습 연도: [2018, 2019], 검증 연도: 2020)
Fold 1 검증 CSI: 0.4089
Fold 2 학습 중... (학습 연도: [2018, 2020], 검증 연도: 2019)
Fold 2 검증 CSI: 0.5585
Fold 3 학습 중... (학습 연도: [2019, 2020], 검증 연도: 2018)
Fold 3 검증 CSI: 0.5201
모델 저장 중...
모델이 ../save_model/lgb_optima/lgb_pure_gwangju.pkl에 저장되었습니다.

✓ 완료: lgb_pure/LGB_pure_gwangju.py (소요 시간: 3254초)

----------------------------------------
실행 중: lgb_pure/LGB_pure_incheon.py
시작 시간: 2025-12-23 17:06:57
----------------------------------------
데이터 로딩 중...
데이터 전처리 중...
하이퍼파라미터 최적화 시작...
  0%|          | 0/100 [00:00<?, ?trial/s, best loss=?]  1%|          | 1/100 [00:51<1:24:53, 51.45s/trial, best loss: -0.5435]  2%|▏         | 2/100 [01:27<1:09:21, 42.47s/trial, best loss: -0.5529]  3%|▎         | 3/100 [01:48<52:49, 32.68s/trial, best loss: -0.5543]    4%|▍         | 4/100 [02:10<45:44, 28.59s/trial, best loss: -0.5553]  5%|▌         | 5/100 [02:32<41:05, 25.95s/trial, best loss: -0.5553]  6%|▌         | 6/100 [02:54<38:40, 24.69s/trial, best loss: -0.5553]  7%|▋         | 7/100 [03:18<37:52, 24.43s/trial, best loss: -0.5553]  8%|▊         | 8/100 [03:58<45:19, 29.56s/trial, best loss: -0.5553]  9%|▉         | 9/100 [04:31<46:11, 30.45s/trial, best loss: -0.5553] 10%|█         | 10/100 [05:00<45:02, 30.03s/trial, best loss: -0.5553] 11%|█         | 11/100 [05:28<43:42, 29.47s/trial, best loss: -0.5553] 12%|█▏        | 12/100 [06:26<55:56, 38.14s/trial, best loss: -0.5608] 13%|█▎        | 13/100 [06:59<53:04, 36.61s/trial, best loss: -0.5608] 14%|█▍        | 14/100 [07:28<49:02, 34.21s/trial, best loss: -0.5608] 15%|█▌        | 15/100 [07:48<42:37, 30.08s/trial, best loss: -0.5608] 16%|█▌        | 16/100 [08:18<42:03, 30.04s/trial, best loss: -0.5608] 17%|█▋        | 17/100 [08:45<40:10, 29.04s/trial, best loss: -0.5608] 18%|█▊        | 18/100 [09:05<35:52, 26.25s/trial, best loss: -0.5608] 19%|█▉        | 19/100 [09:40<39:06, 28.97s/trial, best loss: -0.5608] 20%|██        | 20/100 [09:59<34:25, 25.82s/trial, best loss: -0.5608] 21%|██        | 21/100 [10:32<37:01, 28.12s/trial, best loss: -0.5608] 22%|██▏       | 22/100 [11:22<44:55, 34.56s/trial, best loss: -0.5608] 23%|██▎       | 23/100 [12:06<48:09, 37.52s/trial, best loss: -0.5608] 24%|██▍       | 24/100 [12:34<43:42, 34.51s/trial, best loss: -0.5608] 25%|██▌       | 25/100 [13:41<55:33, 44.45s/trial, best loss: -0.5608] 26%|██▌       | 26/100 [14:17<51:36, 41.85s/trial, best loss: -0.5608] 27%|██▋       | 27/100 [15:01<51:34, 42.39s/trial, best loss: -0.5608] 28%|██▊       | 28/100 [15:50<53:13, 44.35s/trial, best loss: -0.5608] 29%|██▉       | 29/100 [16:44<56:04, 47.38s/trial, best loss: -0.561]  30%|███       | 30/100 [17:34<56:10, 48.15s/trial, best loss: -0.561] 31%|███       | 31/100 [18:35<59:58, 52.16s/trial, best loss: -0.561] 32%|███▏      | 32/100 [19:13<54:14, 47.85s/trial, best loss: -0.561] 33%|███▎      | 33/100 [19:58<52:22, 46.90s/trial, best loss: -0.561] 34%|███▍      | 34/100 [20:52<53:48, 48.91s/trial, best loss: -0.561] 35%|███▌      | 35/100 [21:23<47:28, 43.82s/trial, best loss: -0.561] 36%|███▌      | 36/100 [22:03<45:14, 42.41s/trial, best loss: -0.561] 37%|███▋      | 37/100 [22:31<40:05, 38.19s/trial, best loss: -0.561] 38%|███▊      | 38/100 [22:58<35:58, 34.82s/trial, best loss: -0.561] 39%|███▉      | 39/100 [23:39<37:25, 36.82s/trial, best loss: -0.561] 40%|████      | 40/100 [24:18<37:15, 37.26s/trial, best loss: -0.561] 41%|████      | 41/100 [25:14<42:16, 43.00s/trial, best loss: -0.561] 42%|████▏     | 42/100 [25:40<36:38, 37.90s/trial, best loss: -0.561] 43%|████▎     | 43/100 [26:11<34:03, 35.85s/trial, best loss: -0.561] 44%|████▍     | 44/100 [26:45<32:58, 35.33s/trial, best loss: -0.561] 45%|████▌     | 45/100 [27:21<32:31, 35.47s/trial, best loss: -0.561] 46%|████▌     | 46/100 [28:10<35:37, 39.58s/trial, best loss: -0.561] 47%|████▋     | 47/100 [29:07<39:24, 44.62s/trial, best loss: -0.561] 48%|████▊     | 48/100 [29:31<33:23, 38.52s/trial, best loss: -0.561] 49%|████▉     | 49/100 [30:16<34:27, 40.55s/trial, best loss: -0.561] 50%|█████     | 50/100 [30:53<32:55, 39.52s/trial, best loss: -0.561] 51%|█████     | 51/100 [31:28<31:09, 38.15s/trial, best loss: -0.561] 52%|█████▏    | 52/100 [32:06<30:33, 38.19s/trial, best loss: -0.561] 53%|█████▎    | 53/100 [32:28<25:55, 33.09s/trial, best loss: -0.561] 54%|█████▍    | 54/100 [33:14<28:31, 37.21s/trial, best loss: -0.561] 55%|█████▌    | 55/100 [34:08<31:33, 42.09s/trial, best loss: -0.561] 56%|█████▌    | 56/100 [34:45<29:46, 40.61s/trial, best loss: -0.561] 57%|█████▋    | 57/100 [35:36<31:12, 43.54s/trial, best loss: -0.561] 58%|█████▊    | 58/100 [36:11<28:44, 41.07s/trial, best loss: -0.561] 59%|█████▉    | 59/100 [36:38<25:13, 36.91s/trial, best loss: -0.561] 60%|██████    | 60/100 [37:07<23:00, 34.51s/trial, best loss: -0.561] 61%|██████    | 61/100 [37:35<21:04, 32.43s/trial, best loss: -0.561] 62%|██████▏   | 62/100 [38:06<20:21, 32.16s/trial, best loss: -0.561] 63%|██████▎   | 63/100 [38:42<20:28, 33.19s/trial, best loss: -0.561] 64%|██████▍   | 64/100 [39:50<26:13, 43.71s/trial, best loss: -0.561] 65%|██████▌   | 65/100 [40:45<27:33, 47.25s/trial, best loss: -0.561] 66%|██████▌   | 66/100 [41:44<28:38, 50.54s/trial, best loss: -0.561] 67%|██████▋   | 67/100 [42:38<28:21, 51.57s/trial, best loss: -0.561] 68%|██████▊   | 68/100 [43:21<26:07, 48.99s/trial, best loss: -0.5613] 69%|██████▉   | 69/100 [43:58<23:33, 45.58s/trial, best loss: -0.5613] 70%|███████   | 70/100 [44:50<23:40, 47.34s/trial, best loss: -0.5613] 71%|███████   | 71/100 [45:35<22:39, 46.88s/trial, best loss: -0.5613] 72%|███████▏  | 72/100 [46:25<22:12, 47.58s/trial, best loss: -0.5613] 73%|███████▎  | 73/100 [47:15<21:46, 48.41s/trial, best loss: -0.5617] 74%|███████▍  | 74/100 [47:52<19:28, 44.94s/trial, best loss: -0.5617] 75%|███████▌  | 75/100 [48:45<19:46, 47.45s/trial, best loss: -0.5617] 76%|███████▌  | 76/100 [49:09<16:11, 40.46s/trial, best loss: -0.5617] 77%|███████▋  | 77/100 [50:12<18:00, 46.99s/trial, best loss: -0.5617] 78%|███████▊  | 78/100 [50:55<16:48, 45.83s/trial, best loss: -0.5617] 79%|███████▉  | 79/100 [51:43<16:17, 46.53s/trial, best loss: -0.5617] 80%|████████  | 80/100 [52:13<13:52, 41.62s/trial, best loss: -0.5617] 81%|████████  | 81/100 [53:05<14:12, 44.88s/trial, best loss: -0.5617] 82%|████████▏ | 82/100 [53:44<12:51, 42.85s/trial, best loss: -0.5617] 83%|████████▎ | 83/100 [54:23<11:48, 41.68s/trial, best loss: -0.5617] 84%|████████▍ | 84/100 [54:54<10:20, 38.76s/trial, best loss: -0.5617] 85%|████████▌ | 85/100 [55:21<08:45, 35.06s/trial, best loss: -0.5617] 86%|████████▌ | 86/100 [55:56<08:10, 35.00s/trial, best loss: -0.5617] 87%|████████▋ | 87/100 [56:36<07:55, 36.58s/trial, best loss: -0.5617] 88%|████████▊ | 88/100 [57:05<06:53, 34.42s/trial, best loss: -0.5617] 89%|████████▉ | 89/100 [57:32<05:53, 32.16s/trial, best loss: -0.5617] 90%|█████████ | 90/100 [58:19<06:04, 36.42s/trial, best loss: -0.5617] 91%|█████████ | 91/100 [59:05<05:53, 39.25s/trial, best loss: -0.5617] 92%|█████████▏| 92/100 [59:35<04:53, 36.68s/trial, best loss: -0.5617] 93%|█████████▎| 93/100 [1:00:09<04:10, 35.82s/trial, best loss: -0.5617] 94%|█████████▍| 94/100 [1:00:34<03:16, 32.68s/trial, best loss: -0.5617] 95%|█████████▌| 95/100 [1:01:00<02:32, 30.44s/trial, best loss: -0.5617] 96%|█████████▌| 96/100 [1:01:39<02:12, 33.11s/trial, best loss: -0.5617] 97%|█████████▋| 97/100 [1:02:17<01:43, 34.54s/trial, best loss: -0.5617] 98%|█████████▊| 98/100 [1:02:50<01:08, 34.11s/trial, best loss: -0.5617] 99%|█████████▉| 99/100 [1:03:21<00:33, 33.34s/trial, best loss: -0.5617]100%|██████████| 100/100 [1:03:58<00:00, 34.34s/trial, best loss: -0.5617]100%|██████████| 100/100 [1:03:58<00:00, 38.39s/trial, best loss: -0.5617]

최적화 완료. 최적 파라미터: {'colsample_bytree': 0.7451758674748375, 'learning_rate': 0.012136256520039064, 'max_depth': 10.0, 'min_child_weight': 9.0, 'num_leaves': 89.0, 'reg_alpha': 0.41323940989949803, 'reg_lambda': 0.9961125910856155, 'subsample': 0.7322009271446389}
최적 CSI 점수: 0.5617 (loss: -0.5617)

최적화 과정 요약:
  - 총 시도 횟수: 100
  - 성공한 시도: 100
  - 최초 CSI: 0.5435
  - 최종 CSI: 0.5551
  - 최고 CSI: 0.5617
  - 최저 CSI: 0.5397
  - 평균 CSI: 0.5551

최적화 Trials 객체가 ../optimization_history/lgb_pure_incheon_trials.pkl에 저장되었습니다.
최종 모델 학습 시작...
Fold 1 학습 중... (학습 연도: [2018, 2019], 검증 연도: 2020)
Fold 1 검증 CSI: 0.4775
Fold 2 학습 중... (학습 연도: [2018, 2020], 검증 연도: 2019)
Fold 2 검증 CSI: 0.6174
Fold 3 학습 중... (학습 연도: [2019, 2020], 검증 연도: 2018)
Fold 3 검증 CSI: 0.5825
모델 저장 중...
모델이 ../save_model/lgb_optima/lgb_pure_incheon.pkl에 저장되었습니다.

✓ 완료: lgb_pure/LGB_pure_incheon.py (소요 시간: 3866초)

----------------------------------------
실행 중: lgb_pure/LGB_pure_seoul.py
시작 시간: 2025-12-23 18:11:23
----------------------------------------
데이터 로딩 중...
데이터 전처리 중...
하이퍼파라미터 최적화 시작...
  0%|          | 0/100 [00:00<?, ?trial/s, best loss=?]  1%|          | 1/100 [00:48<1:20:46, 48.95s/trial, best loss: -0.5505]  2%|▏         | 2/100 [01:10<53:36, 32.82s/trial, best loss: -0.5506]    3%|▎         | 3/100 [01:38<49:38, 30.71s/trial, best loss: -0.5506]  4%|▍         | 4/100 [02:18<54:45, 34.22s/trial, best loss: -0.5515]  5%|▌         | 5/100 [02:59<58:22, 36.87s/trial, best loss: -0.5515]  6%|▌         | 6/100 [03:30<54:11, 34.59s/trial, best loss: -0.5515]  7%|▋         | 7/100 [04:03<53:17, 34.38s/trial, best loss: -0.5515]  8%|▊         | 8/100 [04:26<47:10, 30.76s/trial, best loss: -0.5515]  9%|▉         | 9/100 [04:49<42:33, 28.06s/trial, best loss: -0.5515] 10%|█         | 10/100 [05:09<38:35, 25.73s/trial, best loss: -0.5515] 11%|█         | 11/100 [05:28<35:11, 23.73s/trial, best loss: -0.5515] 12%|█▏        | 12/100 [06:09<42:31, 28.99s/trial, best loss: -0.5515] 13%|█▎        | 13/100 [06:37<41:22, 28.54s/trial, best loss: -0.5515] 14%|█▍        | 14/100 [07:01<38:51, 27.11s/trial, best loss: -0.5515] 15%|█▌        | 15/100 [07:43<44:51, 31.67s/trial, best loss: -0.5515] 16%|█▌        | 16/100 [08:12<43:08, 30.81s/trial, best loss: -0.5515] 17%|█▋        | 17/100 [08:43<42:52, 30.99s/trial, best loss: -0.5515] 18%|█▊        | 18/100 [09:03<37:42, 27.59s/trial, best loss: -0.5515] 19%|█▉        | 19/100 [09:25<35:05, 26.00s/trial, best loss: -0.5515] 20%|██        | 20/100 [10:19<45:58, 34.48s/trial, best loss: -0.5515] 21%|██        | 21/100 [10:41<40:30, 30.77s/trial, best loss: -0.5515] 22%|██▏       | 22/100 [11:02<36:11, 27.84s/trial, best loss: -0.5515] 23%|██▎       | 23/100 [11:22<32:41, 25.47s/trial, best loss: -0.5515] 24%|██▍       | 24/100 [11:45<31:12, 24.64s/trial, best loss: -0.5515] 25%|██▌       | 25/100 [12:04<28:28, 22.78s/trial, best loss: -0.5561] 26%|██▌       | 26/100 [12:35<31:26, 25.49s/trial, best loss: -0.5561] 27%|██▋       | 27/100 [12:53<28:03, 23.06s/trial, best loss: -0.5561] 28%|██▊       | 28/100 [13:11<26:04, 21.73s/trial, best loss: -0.5561] 29%|██▉       | 29/100 [13:30<24:28, 20.68s/trial, best loss: -0.5561] 30%|███       | 30/100 [13:49<23:36, 20.23s/trial, best loss: -0.5561] 31%|███       | 31/100 [14:14<25:02, 21.78s/trial, best loss: -0.5561] 32%|███▏      | 32/100 [14:33<23:42, 20.93s/trial, best loss: -0.5561] 33%|███▎      | 33/100 [14:55<23:45, 21.28s/trial, best loss: -0.5561] 34%|███▍      | 34/100 [15:17<23:37, 21.47s/trial, best loss: -0.5561] 35%|███▌      | 35/100 [15:33<21:32, 19.89s/trial, best loss: -0.5561] 36%|███▌      | 36/100 [15:56<21:58, 20.60s/trial, best loss: -0.5561] 37%|███▋      | 37/100 [16:15<21:17, 20.28s/trial, best loss: -0.5561] 38%|███▊      | 38/100 [16:36<20:59, 20.32s/trial, best loss: -0.5561] 39%|███▉      | 39/100 [16:57<21:00, 20.66s/trial, best loss: -0.5561] 40%|████      | 40/100 [17:19<20:58, 20.98s/trial, best loss: -0.5561] 41%|████      | 41/100 [17:45<22:12, 22.59s/trial, best loss: -0.5561] 42%|████▏     | 42/100 [18:11<22:43, 23.51s/trial, best loss: -0.5561] 43%|████▎     | 43/100 [18:36<22:44, 23.94s/trial, best loss: -0.5561] 44%|████▍     | 44/100 [18:55<21:10, 22.68s/trial, best loss: -0.5561] 45%|████▌     | 45/100 [19:16<20:19, 22.17s/trial, best loss: -0.5561] 46%|████▌     | 46/100 [19:51<23:26, 26.05s/trial, best loss: -0.5561] 47%|████▋     | 47/100 [20:12<21:28, 24.32s/trial, best loss: -0.5561] 48%|████▊     | 48/100 [20:30<19:35, 22.60s/trial, best loss: -0.5561] 49%|████▉     | 49/100 [20:51<18:43, 22.03s/trial, best loss: -0.5561] 50%|█████     | 50/100 [21:10<17:33, 21.06s/trial, best loss: -0.5561] 51%|█████     | 51/100 [21:35<18:08, 22.22s/trial, best loss: -0.5561] 52%|█████▏    | 52/100 [21:59<18:11, 22.75s/trial, best loss: -0.5561] 53%|█████▎    | 53/100 [22:23<18:08, 23.17s/trial, best loss: -0.5561] 54%|█████▍    | 54/100 [22:47<18:05, 23.59s/trial, best loss: -0.5561] 55%|█████▌    | 55/100 [23:12<17:54, 23.88s/trial, best loss: -0.5561] 56%|█████▌    | 56/100 [23:35<17:18, 23.59s/trial, best loss: -0.5561] 57%|█████▋    | 57/100 [23:52<15:33, 21.70s/trial, best loss: -0.5561] 58%|█████▊    | 58/100 [24:20<16:23, 23.43s/trial, best loss: -0.5561] 59%|█████▉    | 59/100 [24:43<16:01, 23.46s/trial, best loss: -0.5561] 60%|██████    | 60/100 [25:11<16:31, 24.80s/trial, best loss: -0.5561] 61%|██████    | 61/100 [25:33<15:31, 23.87s/trial, best loss: -0.5561] 62%|██████▏   | 62/100 [25:52<14:11, 22.42s/trial, best loss: -0.5561] 63%|██████▎   | 63/100 [26:14<13:43, 22.26s/trial, best loss: -0.5561] 64%|██████▍   | 64/100 [26:33<12:50, 21.40s/trial, best loss: -0.5561] 65%|██████▌   | 65/100 [26:52<12:04, 20.69s/trial, best loss: -0.5561] 66%|██████▌   | 66/100 [27:25<13:45, 24.29s/trial, best loss: -0.5561] 67%|██████▋   | 67/100 [27:47<13:04, 23.76s/trial, best loss: -0.5561] 68%|██████▊   | 68/100 [28:11<12:36, 23.63s/trial, best loss: -0.5561] 69%|██████▉   | 69/100 [28:43<13:32, 26.22s/trial, best loss: -0.5561] 70%|███████   | 70/100 [29:00<11:43, 23.46s/trial, best loss: -0.5561] 71%|███████   | 71/100 [29:18<10:33, 21.84s/trial, best loss: -0.5561] 72%|███████▏  | 72/100 [29:45<10:51, 23.26s/trial, best loss: -0.5561] 73%|███████▎  | 73/100 [30:10<10:44, 23.87s/trial, best loss: -0.5561] 74%|███████▍  | 74/100 [30:27<09:26, 21.78s/trial, best loss: -0.5561] 75%|███████▌  | 75/100 [30:46<08:45, 21.03s/trial, best loss: -0.5561] 76%|███████▌  | 76/100 [31:04<08:02, 20.09s/trial, best loss: -0.5561] 77%|███████▋  | 77/100 [31:22<07:26, 19.43s/trial, best loss: -0.5561] 78%|███████▊  | 78/100 [31:49<07:57, 21.71s/trial, best loss: -0.5561] 79%|███████▉  | 79/100 [32:23<08:52, 25.37s/trial, best loss: -0.5561] 80%|████████  | 80/100 [33:03<09:56, 29.83s/trial, best loss: -0.5561] 81%|████████  | 81/100 [33:22<08:22, 26.44s/trial, best loss: -0.5561] 82%|████████▏ | 82/100 [33:47<07:51, 26.20s/trial, best loss: -0.5561] 83%|████████▎ | 83/100 [34:17<07:43, 27.29s/trial, best loss: -0.5561] 84%|████████▍ | 84/100 [34:34<06:27, 24.22s/trial, best loss: -0.5561] 85%|████████▌ | 85/100 [34:57<05:55, 23.72s/trial, best loss: -0.5561] 86%|████████▌ | 86/100 [35:17<05:19, 22.82s/trial, best loss: -0.5561] 87%|████████▋ | 87/100 [35:37<04:43, 21.79s/trial, best loss: -0.5561] 88%|████████▊ | 88/100 [35:57<04:15, 21.26s/trial, best loss: -0.5561] 89%|████████▉ | 89/100 [36:28<04:25, 24.15s/trial, best loss: -0.5561] 90%|█████████ | 90/100 [36:46<03:44, 22.50s/trial, best loss: -0.5561] 91%|█████████ | 91/100 [37:19<03:50, 25.64s/trial, best loss: -0.5561] 92%|█████████▏| 92/100 [37:40<03:12, 24.01s/trial, best loss: -0.5561] 93%|█████████▎| 93/100 [38:16<03:13, 27.63s/trial, best loss: -0.5561] 94%|█████████▍| 94/100 [38:49<02:55, 29.28s/trial, best loss: -0.5561] 95%|█████████▌| 95/100 [39:10<02:14, 26.97s/trial, best loss: -0.5561] 96%|█████████▌| 96/100 [39:29<01:37, 24.39s/trial, best loss: -0.5561] 97%|█████████▋| 97/100 [39:48<01:08, 22.83s/trial, best loss: -0.5561] 98%|█████████▊| 98/100 [40:14<00:47, 23.71s/trial, best loss: -0.5561] 99%|█████████▉| 99/100 [40:46<00:26, 26.22s/trial, best loss: -0.5561]100%|██████████| 100/100 [41:06<00:00, 24.44s/trial, best loss: -0.5561]100%|██████████| 100/100 [41:06<00:00, 24.67s/trial, best loss: -0.5561]

최적화 완료. 최적 파라미터: {'colsample_bytree': 0.9656226027993231, 'learning_rate': 0.19802455575535455, 'max_depth': 9.0, 'min_child_weight': 20.0, 'num_leaves': 40.0, 'reg_alpha': 0.9688960116885452, 'reg_lambda': 0.8497573873429717, 'subsample': 0.9553638492982583}
최적 CSI 점수: 0.5561 (loss: -0.5561)

최적화 과정 요약:
  - 총 시도 횟수: 100
  - 성공한 시도: 100
  - 최초 CSI: 0.5505
  - 최종 CSI: 0.5477
  - 최고 CSI: 0.5561
  - 최저 CSI: 0.5420
  - 평균 CSI: 0.5485

최적화 Trials 객체가 ../optimization_history/lgb_pure_seoul_trials.pkl에 저장되었습니다.
최종 모델 학습 시작...
Fold 1 학습 중... (학습 연도: [2018, 2019], 검증 연도: 2020)
Fold 1 검증 CSI: 0.4861
Fold 2 학습 중... (학습 연도: [2018, 2020], 검증 연도: 2019)
Fold 2 검증 CSI: 0.6014
Fold 3 학습 중... (학습 연도: [2019, 2020], 검증 연도: 2018)
Fold 3 검증 CSI: 0.5809
모델 저장 중...
모델이 ../save_model/lgb_optima/lgb_pure_seoul.pkl에 저장되었습니다.

✓ 완료: lgb_pure/LGB_pure_seoul.py (소요 시간: 2474초)

./run_lgb_pure.sh: line 84: unexpected EOF while looking for matching `"'
